zone,region,city,att_type,att_name,author,rating,comment,comment_date
Дальневосточный округ,Приморский край,Владивосток,Развлечения в Владивостоке,Океанариум Аквамир,0609_2013448,5,"Ни один гость города не пропустить расположенного в самом центре города Памятника. Три скульптурные группы установлены на основной площади , носящейся одноименное с памятником название Борцам за власть Советов. Прямо от памятника вверх от площади уходит главный проспект города- Океанский. Обязательно спуститесь пешком по нему от Центрального парка до площади, почувствуйте дух города и полюбуйтесь видом блестящих вод бухты Золотой Рог , силуэтом основной группы памятника , кораблей и видом Русского острова.",Опубликовано 28 января 2014 г.
Дальневосточный округ,Приморский край,Владивосток,Развлечения в Владивостоке,Океанариум Аквамир,310Natali,2,"говорили, что здесь сделали ремонт, но никакого ремонта нет, огромные проблемы с вентиляцией, в общем совершенно не стоит сюда ходить!",Опубликовано 19 августа 2015 г.
Дальневосточный округ,Приморский край,Владивосток,Развлечения в Владивостоке,Океанариум Аквамир,862VIP,4,"Отличное место! Правда показалось что слишком большой, дело в том что к середине пропадает особый интерес, а идти еще много, либо я в этом не был заинтересован.. В общем узнал много нового, увидел то чего похоже нигде не увижу! Советую идти не одному, на случай если станет скучно.",Опубликовано 27 марта 2014 г.
Дальневосточный округ,Приморский край,Владивосток,Развлечения в Владивостоке,Океанариум Аквамир,Aleksandr Z,3,"Посещаю его переодически когда показываю город друзьям из других городов. Для детей возможно аквариумы и интересны, а вот второй этаж скукотища для всех. За многие годы существования океанариума он тихо диградирует, но все равно интересно увидеть осетровых.",Опубликовано 28 июля 2016 г.
Дальневосточный округ,Приморский край,Владивосток,Развлечения в Владивостоке,Океанариум Аквамир,Alexey A,3,Детям понравится а вот взрослым думаю может и не очень из минусов только думаю что дорогая цена ... Но зато сможете посетить музей восковых фигур тамже либо покормить карпов,Опубликовано 5 июня 2015 г.
Дальневосточный округ,Приморский край,Владивосток,Развлечения в Владивостоке,Океанариум Аквамир,Alyonanek,3,"Экспозиция, в целом неплохая, два этажа, все подписано на русском языке, ходишь и смотришь все сам. площадь осмотра совсем небольшая. Вход за взрослого 300 руб, ребенок с пяти лет 150 руб. Дорого.",Опубликовано 18 марта 2015 г.
Дальневосточный округ,Приморский край,Владивосток,Развлечения в Владивостоке,Океанариум Аквамир,AnonimAnonimov,3,"Всё почти не изменилось с моего детства, по прежнему бедные рыбки плавают в неудобный аквариумах, билет 350 рублей, детям - бесплатно",Опубликовано 1 августа 2016 г.
Дальневосточный округ,Приморский край,Владивосток,Развлечения в Владивостоке,Океанариум Аквамир,Anton K,4,Сам по себе Владивосток удивительный город и есть достопримечательности которые необходимо посетить тем более что стоимость входного билета 250 взрослый 150 детский. Так как рядом морские возможности следовательно и разнообразие морепродуктов как и за пределами океанариуме очень большое !!! Всем удачи...,Опубликовано 3 января 2014 г.
Дальневосточный округ,Приморский край,Владивосток,Развлечения в Владивостоке,Океанариум Аквамир,BOGDAN K,4,"Вход - 250 рублей. На первом этаже из интересного - крокодил, краб, ну и множество рыбок. Особенно впечатляют огроменные осётры. Отдельный аквариум со злобной пираньей. На втором этаже понравилась коллекция ракушек. Довольно хорошее впечатление от посещения.",Опубликовано 23 октября 2013 г.
Дальневосточный округ,Приморский край,Владивосток,Развлечения в Владивостоке,Океанариум Аквамир,BeloeilSmith,1,"Мы проходили мимо и думали, почему нет. С первого внимания, когда вы проходите мимо деньги маленький горках и получаете сдачу, таким же образом, общее впечатление хватало любви, заботы и любви.Некоторые рыбы была явно слишком большой, был один или два мертвых и, ну, в целом, это просто не было хорошо. Даже первая достопримечательность - аллигатор, сидя в баке, не достаточно большой, чтобы втиснуть в сказке, он знает лучше, чем любой, что нужно. Закройте его, или, по крайней мере, переселите рыбу в среды обитатели, которых они заслуживают в баках, достаточно большие, чтобы положить их.Даже когда за угол мы познакомились с одного человека, не отличное, уборка ведро. Там воняло. Так почему это, когда профессиональные игра вокруг. Это имидж, которое я устраняю со мной. не рыба, но вонючий человек с волосатой грудью.",Перевод: PROMT
Дальневосточный округ,Приморский край,Владивосток,Развлечения в Владивостоке,Океанариум Аквамир,DTatyana,5,"Очень интересно детям, не достигшим подросткового возраста. Детям постарше хочется увидеть и дельфинов, и побольше акул. Билеты дорогие, но объясняется соседством с набережной. Там же можно приобрести сувенирную продукцию.",
Дальневосточный округ,Приморский край,Владивосток,Развлечения в Владивостоке,Океанариум Аквамир,DariaSK,3,"Океанариум небольшой, обойти его можно минут за 15-20. Билеты относительно недешевые, но побывать во Владивостоке и не посетить океанариум - было бы странно. Конечно, если сравнивать с Бангкоком, где находится 5-й по величине в мире океанариум, то наш проигрывает. Но надо понимать с чем сравнивать.",Опубликовано 6 мая 2013 г.
Дальневосточный округ,Приморский край,Владивосток,Развлечения в Владивостоке,Океанариум Аквамир,DigoDV,3,"Океанариум во Владивостоке небольшой, пора расширяться. Экспозиция не меняется годами. На втором этаже впечатляет чучело сома. Не дай бог оказаться в воде рядом с таким чудищем. Цена вопроса 250 р.",Опубликовано 26 января 2014 г.
Дальневосточный округ,Приморский край,Владивосток,Развлечения в Владивостоке,Океанариум Аквамир,Dragosteya,4,"Океанариум хороший и очень познавательный, к сожалению, со временем его территория только уменьшается, сдают в аренду площади всяким торговым точкам и аттракционам :(
Очень понравился большущий осьминог, красивые рыбы,на втором этаже расположена выставку эскопаемых. Но по-моему большинство экспонатов спрятана в хранилище, а ведь раньше они выставлялись и были доступны для просомтра посетителей :(",Опубликовано 27 марта 2014 г.
Дальневосточный округ,Приморский край,Владивосток,Развлечения в Владивостоке,Океанариум Аквамир,Ed1K2,1,"Такой убогой экспозиции ямы не видели нигде... Внутри здания имеются аквариумы с рыбками (некоторые не функционируют), описания на некоторых аквариумах не соответствуют его содержанию, а на других просто отсутствуют. Имеются чучела птиц, ракушки, заспиртованные моллюски и т.д. Самое удивительное, что почти все подписи на латыни, без обозначения на русском языке... Ещё поразили рукотворные ""скульптуры"" рыб... Видимо чтобы заполнить экспозицию... В общем, всё это производит удручающее впечатление, при всём при том, что это ""океанариум"" совсем недавно реставрировался... Вход - 350 руб. с человека. Карты к оплате не принимают. Аудиогида нет. Никакого гида нет.",Опубликовано 14 августа 2015 г.
Дальневосточный округ,Приморский край,Владивосток,Развлечения в Владивостоке,Океанариум Аквамир,Ekaterina1886,4,"Сам по себе океанариум небольшой, на первом этаже расположены аквариумы с разными рыбками и пресмыкающими, на втором этаже находятся чучела разных птиц и животных. С торца здания летом проходила высвтака бабочек. Каждый посетитель мог увидеть разнообразных бабочек, которые свободно летали и садились на людей.",Опубликовано 21 января 2014 г.
Дальневосточный округ,Приморский край,Владивосток,Развлечения в Владивостоке,Океанариум Аквамир,Elena S,4,"Из опыта посещения океанариумов, этот неплохой, сходить можно и нужно. Были мы и на Крите, и в Пекине в океанариуме, конечно там огромные, богатые и интересные они. Но этот из российских вполне достоин посещения. Богатый ассортимент, если так можно сказать, рыб живых, и на втором этаже разные виды морских жителей и их частей в сухом) виде.",Опубликовано 26 мая 2014 г.
Дальневосточный округ,Приморский край,Владивосток,Развлечения в Владивостоке,Океанариум Аквамир,FakiR777,3,"Блин! Восхититься нечем, кроме может быть белуг, плавающих по кругу. Ничего подобного океанариуму в Санкт-Петербурге даже близко. Понятно, что тягаться трудно, но оформление можно было бы сделать лучше.",Опубликовано 9 января 2014 г.
Дальневосточный округ,Приморский край,Владивосток,Развлечения в Владивостоке,Океанариум Аквамир,Gavrilov_Andrey,3,"В целом, неплохие впечатления от его посещение. Если вы были в больших океанаримумах, то интереса мало будет.",Опубликовано 25 мая 2015 г.
Дальневосточный округ,Приморский край,Владивосток,Развлечения в Владивостоке,Океанариум Аквамир,GeorgySemenov,4,"Первый океанариум. Место, где можно познакомиться со многими морскими и океанскими обитателями. Особенно весело там детям)",Опубликовано 31 мая 2017 г.
Дальневосточный округ,Приморский край,Владивосток,Развлечения в Владивостоке,Океанариум Аквамир,Ireeenka,5,"Небольшой океанариум, недалеко от набережной. Очень позновательно, и интересно. Но маловато.
Есть как аквариумы с разнообразными рыбами и небольними млекопитающими, так и засушенные чучела рыб, и даже ископаемые рыбы.",Опубликовано 29 июня 2014 г.
Дальневосточный округ,Приморский край,Владивосток,Развлечения в Владивостоке,Океанариум Аквамир,Irinalib,3,"Мы с мужем давно взрослые люди, но в океанариум сходили с удовольствием, на морских и речных обитателей можно любоваться, ими можно очаровываться: их разнообразию, их красоте и грации, замирать перед их близостью. Много интересного, огромный стеклянный туннель для калуги и осетра. Электронные экранчики с разнообразной информацией об обитателях аквариумов. Я была и в океанариуме на о. Русский, там, конечно, размах и объем площадей, но разнообразие и количество видов рыб на ул. Батарейной богаче. На втором этаже вообще музей с уникальными экспонатами, которые собирались многие годы. На о. Русском такого нет, там сплошь муляжи и бутафория. Хотя побывать гостям города стоит и там и там. Еще один плюс океанариума на ул. Батарейной в том, что он расположен в таком чудесном месте, на набережной, в центре города. Ему есть чем вас удивить. Я думаю, пытливый ум найдет себе пищу. Цена билета, правда, не порадовала - 350 руб. И еще налево от входа - музей восковых фигур",
Дальневосточный округ,Приморский край,Владивосток,Развлечения в Владивостоке,Океанариум Аквамир,JZeppelina,2,"Этот океанариум нуждается в серьезном ремонте. Также не все морские-океанские гады обозначены на табличках. Ракушки в сувенирном магазине совершенно не из тех местностей, что весьма печально. Учитывая то состояние, в котором этот океанариум находится, билет мог бы быть и подешевле.",Опубликовано 24 ноября 2015 г.
Дальневосточный округ,Приморский край,Владивосток,Развлечения в Владивостоке,Океанариум Аквамир,Joanne S,1,"Если честно, мы вошли, потому что было так холодно и снежно, и мы хотим где-нибудь тепло. Вместо кафе, почему бы не увидеть рыбу. Мы думали, что в одном городе может быть размещен только один аквариум, поэтому, не проводя никаких исследований, он не должен быть слишком плохим. Внутри было темно и мало. Вода и бак грязные. Некоторые рептилии пропали без вести.
С 400 на человека, мы бы предпочли провести это с кофе поблизости.",
Дальневосточный округ,Приморский край,Владивосток,Развлечения в Владивостоке,Океанариум Аквамир,Karina V,5,"Интересное место, для единоразового посещения, если вас интересует природа, реки, моря с их обитателями.",Опубликовано 28 февраля 2017 г.
Дальневосточный округ,Приморский край,Владивосток,Развлечения в Владивостоке,Океанариум Аквамир,Katki2013,4,"Как то не впечатлило данное заведение, билет недешёвый, 300 р, экспозиция не большая и выглядит как то изношенно все",Опубликовано 23 мая 2015 г.
Дальневосточный округ,Приморский край,Владивосток,Развлечения в Владивостоке,Океанариум Аквамир,Konstancio,5,"Океанариум очень небольшой, но коллекция аквариумов с рыбами очень красивая и интересная, а на втором этаже очень интересная коллекция чучел морских обитателей. В сентябре 2016 года на острове Русский открывается новый океанариум, который обещает быть одним из лучших в мире.",Опубликовано 15 сентября 2016 г.
Дальневосточный округ,Приморский край,Владивосток,Развлечения в Владивостоке,Океанариум Аквамир,Kseniia B,4,"Во Владивостоке достаточно маленький океанариум, но можно увидеть много мелких обитателей Японского моря. Цена приемлемая - 250 рублей, дети со скидкой - 150 рублей",Опубликовано 10 января 2014 г.
Дальневосточный округ,Приморский край,Владивосток,Развлечения в Владивостоке,Океанариум Аквамир,Leha E,4,"Понравилось всем, но быстро надоело, не каждому будет по душе целый день ходить и любоваться. Понравится только детям, идти туда в возрасте с парой не стоит. ИМХО",Опубликовано 18 января 2016 г.
Дальневосточный округ,Приморский край,Владивосток,Развлечения в Владивостоке,Океанариум Аквамир,Maire M,1,"Предыдущие отзывы сказали, что он маленький, но интересное, что я думаю, что это слишком, казалось, было слишком много рыб за ведро, и много воды в баках плохо пахло и очень грязный. Это стоит 350r, чтобы войти, и я не думаю, что это того стоит. Наверху ""Научная"" район полон фаршированных птиц в распадающемся состоянии.",Перевод: PROMT
Дальневосточный округ,Приморский край,Владивосток,Развлечения в Владивостоке,Океанариум Аквамир,Maksim M,4,"На не большой территории раскинулся водный мир Владивостока. Из удивительного - это размеры пресноводных рыб. Сначала подумал акула, а нет.",Опубликовано 21 марта 2014 г.
Дальневосточный округ,Приморский край,Владивосток,Развлечения в Владивостоке,Океанариум Аквамир,MaksimSokolov,4,"Океанариум посещал второй раз с ребенком, ничего не изменилось за прошедшие несколько лет. Первый раз был в день, когда увозили белух. Люли стояои и плакали. Если не задумаетесь о будущем, то и океанариум китайцам достанется!",Опубликовано 12 марта 2013 г.
