zone,region,city,att_type,att_name,author,rating,comment,comment_date
Дальневосточный округ,Приморский край,Владивосток,Развлечения в Владивостоке,Центральная площадь Владивостока,SVB89825,3,"В целом, стандартная городская площадь, не особо отличающаяся от таковых других городов РФ. В центре площади Монумент Борцам за власть Советов на Дальнем Востоке. Если у Вас не так много времени на знакомство с городом, можно данный пункт исключить из культурной программы, лучше спуститесь на Набережную Цесаревича.",
Дальневосточный округ,Приморский край,Владивосток,Развлечения в Владивостоке,Центральная площадь Владивостока,Sash0k,5,"Красивое историческое место, но как правильно замечено - не место там для ярмарок . Особая фишка этого места - голуби, не боятся,можно кормить с руки.",Опубликовано 3 ноября 2012 г.
Дальневосточный округ,Приморский край,Владивосток,Развлечения в Владивостоке,Центральная площадь Владивостока,Sergei K,2,"Площадь города разочаровывает. Во первых, покрытие самой центральной площади - асфальт, что само по себе отвратительно. Во вторых, за моду приняли организацию рынка. В итоге, грязь, мусор. Все это не совсем подходит для центра города.",
Дальневосточный округ,Приморский край,Владивосток,Развлечения в Владивостоке,Центральная площадь Владивостока,SergeiKSMksm,5,Площадь выходит к бухте Золотой Рог. Находится в центре Владивостока. На площади проходят всякие мероприятия. Недалеко находится подводная лодка С 56 музей.,Опубликовано 17 сентября 2015 г.
Дальневосточный округ,Приморский край,Владивосток,Развлечения в Владивостоке,Центральная площадь Владивостока,Sergey A,3,"Неплохое место для небольшой прогулки от одной набережной до другой, но в целом скучновато. Так же портит впечатление многолетнее строительство храма, и не особая чистота. А если вы попадёте летом, то на выходных можете лицезреть абсолютно дикое мероприятие, под названием сельскохозяйственная ярмарка, с кучей мусора и толпой непонятного народа.",Опубликовано 5 октября 2017 г.
Дальневосточный округ,Приморский край,Владивосток,Развлечения в Владивостоке,Центральная площадь Владивостока,Sergey777,5,"Не только просто красивое место, но и самый центр общественной жизни Владивостока. Здесь часто проводятся разные, интересные мероприятия. Например, я попал на День молодежи, было очень здорово и зрелищно! Интересно было смотреть, как ребята отжимались на перекладинах, катались на великах на горках, рисовали граффити. Так что обязательно сходите. Спасибо ""Аэрофлоту"", благодаря которому по акции мне удалось недорого слетать туда. И там прожил почти полтора месяца! Это самые лучшие воспоминания в жизни. На площади установлен памятник борцам за советскую власть на Дальнем Востоке. И рядом много разных достопримечательностей.
К сожалению, здесь нет указания года раньше, чем 2015 г. На самом деле я слетал в июне 2011 года.",Опубликовано 27 февраля 2016 г.
Дальневосточный округ,Приморский край,Владивосток,Развлечения в Владивостоке,Центральная площадь Владивостока,SshellW,3,"Площадь в городе Владивосток оставляет желать лучшего. Только по праздникам площадь наполняется жителями, в остальное время площадь пуста и не привлекает к себе ни чем. Нет ни лавочек, просто посидеть поболтать с подружкой, ни клумб с цветами, за исключением тех, которые огораживают площадь от трассы.",Опубликовано 6 августа 2014 г.
Дальневосточный округ,Приморский край,Владивосток,Развлечения в Владивостоке,Центральная площадь Владивостока,Svetlana N,3,"К сожалению, в пятницу и субботу площадь изуродованна торговыми рядами. Для местных, конечно, удобно, перед туристами стыдно.",Опубликовано 7 мая 2019 г.
Дальневосточный округ,Приморский край,Владивосток,Развлечения в Владивостоке,Центральная площадь Владивостока,Svetlana R,3,"Уважаемые гости нашего города, наша площадь это не достопримечательность. На самой площади делать нечего, вообще нечего. Но! С площади открывается потрясающий вид на историческую за тройку города Владивостока, с одной стороны это Океанский проспект, который со всех сторон украшают исторические здания, с другой стороны вид на бухту Золотой рог, с красивой панорамой наших сопок и если повезет парусного судна ""Паллада"" или ""Надежда"". Ну и конечно памятник на площади, который символ Владивостока. Ради фото стоит зайти.",Опубликовано 22 апреля 2015 г.
Дальневосточный округ,Приморский край,Владивосток,Развлечения в Владивостоке,Центральная площадь Владивостока,Svetlana_Popova,3,"На мой взгляд, это не особо интересная достопримечательность, если времени мало, то ее можно и не посещать. Да, есть памятники, символизирующие Владивосток, но вокруг нет ни деревца, чтобы спрятаться от палящего солнца, вокруг только серый асфальт. Чуть ниже идет стройка храма. Да и поскольку сам памятник борцам за власть Советов сделан из гранита, то от него несколько повышенное радиоактивное излучение, чуть выше нормы.",Опубликовано 23 декабря 2013 г.
Дальневосточный округ,Приморский край,Владивосток,Развлечения в Владивостоке,Центральная площадь Владивостока,Tangodv,4,"Для центральной площади города она как-то маловата (на мой взгляд). Хотелось больше простора... В дни нашего пребывания в городе ( с 4 по 7 января) на площади была устроена ярмарка, а также новогодние развлечения. в основном для детей.",
Дальневосточный округ,Приморский край,Владивосток,Развлечения в Владивостоке,Центральная площадь Владивостока,Tanya M,5,"Я прошла через площадь много раз, просто потому что, прежде всего, это было хорошее место, чтобы сбежать от подъема на холмы: ), Однако площадь находится в самом центре города с впечатляюще большим памятником последних борцов советской электричества. Вместе с опытом русской архитектуры, моста, старого советского супермаркета. Это был один из моих любимых мест для посещения. Я также, оказалось, посетил 2 июля, который был днем рождения города Владивостока, поэтому, был огромный парад и концерты, весь день сопровождаемые фейерверком. Обязательно посетите.",Перевод: PROMT
Дальневосточный округ,Приморский край,Владивосток,Развлечения в Владивостоке,Центральная площадь Владивостока,TatianaBTV,3,Как туристический объект площадь интересна только памятниками и близостью к Светланской. Просто потому что никто не ставит цель сделать из неё туристическую привлекательность.,Опубликовано 28 мая 2014 г.
Дальневосточный округ,Приморский край,Владивосток,Развлечения в Владивостоке,Центральная площадь Владивостока,Viktoria R,4,"Были в ноябре, и, хотя было очень ветрено, погуляли по городу с удовольствием. Особый аутентичный приморский колорит. Ухоженные улицы и здания. Порадовал мемориальный комплекс на главной площади, но ещё больше порадовал расположившийся там привозной рынок - молодцы владивостокцы, все используют по максимуму))",Опубликовано 29 августа 2020 г.
Дальневосточный округ,Приморский край,Владивосток,Развлечения в Владивостоке,Центральная площадь Владивостока,Viktory-1090,5,центральная площадь Владивостока очень красивая) на ней проходят все главные праздные и парады года!),Опубликовано 22 апреля 2015 г.
Дальневосточный округ,Приморский край,Владивосток,Развлечения в Владивостоке,Центральная площадь Владивостока,Vladimir G,5,"Это визитная карточка Владивостока. Интересно увидеть туристов, уличных музыкантов, торговцев, маргиналов. Быть в столице Приморья и не посетить централ ную площадь - нельзя.",Опубликовано 6 февраля 2017 г.
Дальневосточный округ,Приморский край,Владивосток,Развлечения в Владивостоке,Центральная площадь Владивостока,Yaninast2004,4,"Обычная площадь, памятник Борцам, вид на гавань, голуби. Почему-то хочется украсить площадь клумбами или фонтанчиком или хоть чем-то",Опубликовано 19 декабря 2013 г.
Дальневосточный округ,Приморский край,Владивосток,Развлечения в Владивостоке,Центральная площадь Владивостока,Zabrodin,4,"Я много раз был на этой площади, последний раз - в июне, здесь проходят по выходным продуктовые ярмарки, на праздники - бесплатные концерты для горожан, а на 7 ноября любят собираться сторонники Компартии, а мимо площади на 9 мая - проходят парадом части Владивостокского гарнизона.Памятник Борцам за власть Советов уже много лет является символом этого места, наверное потому, что здесь действительно постоянно идет какая-то борьба",Опубликовано 29 июля 2014 г.
Дальневосточный округ,Приморский край,Владивосток,Развлечения в Владивостоке,Центральная площадь Владивостока,ZarinaSab,4,"Возможно из-за того, что я видела ее тогда, когда проходил VROX, но очень хорошая площадь. Особенно для концертов.",Опубликовано 5 февраля 2014 г.
Дальневосточный округ,Приморский край,Владивосток,Развлечения в Владивостоке,Центральная площадь Владивостока,Ziggy28104,4,"Несколько статуй, некоторые старая архитектура и большая площадь. Красивый, чтобы посидеть и отдохнуть некоторое время, но на этом все. Было бы здорово, чтобы посмотреть некоторые фестивали и вещи, которые проводятся здесь.",Перевод: PROMT
Дальневосточный округ,Приморский край,Владивосток,Развлечения в Владивостоке,Центральная площадь Владивостока,Zrencr Z,2,"Кроме памятника борцам за советскую власть, смотреть тут нечего. Вряд ли это место можно назвать достопримечательностью.",Опубликовано 14 мая 2013 г.
Дальневосточный округ,Приморский край,Владивосток,Развлечения в Владивостоке,Центральная площадь Владивостока,_12208,4,"Площадь расположена вблизи моря и порта,что очень удобно.С нее открывается красивый вид на город и океан.",Опубликовано 17 августа 2012 г.
Дальневосточный округ,Приморский край,Владивосток,Развлечения в Владивостоке,Центральная площадь Владивостока,_H6681GY,4,"вытянутая узкая площадь в дни праздников красива, а так -тесно, шумно, близко порт и вокзал. Под площадью - последние метры Транссиба",Опубликовано 22 марта 2016 г.
Дальневосточный округ,Приморский край,Владивосток,Развлечения в Владивостоке,Центральная площадь Владивостока,_irina1zh,4,"Эта площадь - самый узнаваемый элемент образа Владивостока. В нынешнем своем виде она существует с начала 1960-х годов. На заре истории города тут был большой рынок, рыбный базар, потом цирк шапито. В советсвие времена на площади проводились праздничные демонстрации. В общем, жизнь в этом месте всегда была оживленной. Памятник Борцам за власть Советов видно издалека, когда подплываешь к городу на морском транспорте. Есть еще один интересный момент: эта площадь - одно из самых холодных мест в городе. Здесь всегда наиболее сильный ветер, а температура на пару градусов ниже, чем в других, закрытых от ветра местах.",Опубликовано 13 января 2018 г.
Дальневосточный округ,Приморский край,Владивосток,Развлечения в Владивостоке,Центральная площадь Владивостока,adm1916,4,"Находится не далеко от морского и железнодорожного вокзалов. В центре площади стоит Монумент Борцам за власть Советов на Дальнем Востоке. Отдельно хочется сказать о Монумент Воинской славы, укрепленные на нем барельефы показывают этапы славного пути, но не имеют надписей, т.е. не зная истории тяжело понять. Рядом здание администрации Приморского края. Окрывается вид с площади на военные корабли. Проходят на площади культурно-массовые мероприятия для жителей и гостей города.",Опубликовано 23 декабря 2013 г.
Дальневосточный округ,Приморский край,Владивосток,Развлечения в Владивостоке,Центральная площадь Владивостока,ahatnabi,3,"Главная площадь Владика в пятницу в теплое время используется как рынок под открытым небом. Она и так неказистая, а тут еще местная торговля. Хотя для интереса к местным продуктам стоит посетить. Цены вполне приемлемые. Жители активно пользуются.",Опубликовано 23 октября 2016 г.
Дальневосточный округ,Приморский край,Владивосток,Развлечения в Владивостоке,Центральная площадь Владивостока,akirienko65,3,"Путешествуя по ДВ конечно прошли весь центр Владивостока.
Узнали много интересного из истории города и края.
Площадь огромная, но как будто чего-то на ней не хватает..
Полно только наших соседей..",
Дальневосточный округ,Приморский край,Владивосток,Развлечения в Владивостоке,Центральная площадь Владивостока,aleninparty,3,"Ну площадь, ну Центральная, ну памятник... Смысла описывать как ""достопримечательность"" не вижу! Во Владике гораздо более интересных мест, чем памятники спорным моментам Российской истории!",
Дальневосточный округ,Приморский край,Владивосток,Развлечения в Владивостоке,Центральная площадь Владивостока,alexxx1993,5,"Понятно, что на этой площади проходят все главные события города. Кроме того, с неё открывается хороший вид на бухту Золотой Рог, виден Золотой Мост, жд и морской вокзал. Высокое белое здание администрации Приморского края также вписывается в калорит города. Не думаю, что хотя бы один турист города Владивостока не посетил или не нашёл это место)",Опубликовано 13 июня 2014 г.
Дальневосточный округ,Приморский край,Владивосток,Развлечения в Владивостоке,Центральная площадь Владивостока,angelinatitova,3,"Вчера 04.05.19 совершенно случайно узнали о том, что на главной площади Владивостока проходил байкеский слёт. Мероприятие проходило централизованно. Установили сцену, пригласили сотрудников полиции. Сколько участвовало человек и единиц техники не знаю.",
Дальневосточный округ,Приморский край,Владивосток,Развлечения в Владивостоке,Центральная площадь Владивостока,artcher16,4,"Центральная площадь которую сложно не заметить ели ты приехал во Владивосток, большая, просторная, хороший вид на Золотой рог, единственный минус-асфальт ну очень плохо положен, много стыков и неровностей, когда катаются дети на скейтах и роликах часто спотыкаются, да и сам эстетический вид от этого портится,неужели в центре приморской столицы нельзя было положить идеальный асфальт?",Опубликовано 18 января 2016 г.
Дальневосточный округ,Приморский край,Владивосток,Развлечения в Владивостоке,Центральная площадь Владивостока,asmodey14,5,отличный вид на мост через бухту Золотой Рог))) сцена на фестивале В-Рокс и группа Муммий Тролль! отличный летний отдых!,Опубликовано 31 октября 2013 г.
