Дальневосточный округ,Хабаровский край,Хабаровск,Развлечения в Хабаровске,Парк Муравьева-Амурского,natali2510,3,"В моем детстве это был самый лучший и красивый парк.После ремона его никак не могут обустроить. Вроде и карусели установили и колесо 🎡 обозрения(только маленькое какое-то), но всё равно чего-то не хватает. Может когда сделают полностью набережную и будет всё хорошо, а пока так себе.",Опубликовано 12 августа 2015 г.
Дальневосточный округ,Хабаровский край,Хабаровск,Развлечения в Хабаровске,Парк Муравьева-Амурского,nazgull,5,"Часто бывая в Хабаровске могу сказать одно - если ты не был здесь - ты не видел Хабаровска!
Этот парк является сердцем города, а Амур - его артерия.
кажется что с этого места начиналась история Хабаровска.
Гулять здесь можно бесконечно...утром - днем - ночью...здесь всегда многолюдно.
Наверное поэтому здесь легко думается и быстро находятся решения всех проблем.",Опубликовано 22 июня 2015 г.
Дальневосточный округ,Хабаровский край,Хабаровск,Развлечения в Хабаровске,Парк Муравьева-Амурского,neuandres,5,"Прекрасное место в городе для неспешных прогулок. Очень зелено, чисто и не многолюдно:) Рекомендую всем гостям Хабаровска!",Опубликовано 26 октября 2014 г.
Дальневосточный округ,Хабаровский край,Хабаровск,Развлечения в Хабаровске,Парк Муравьева-Амурского,nikolay v,3,"Большой и красивый парк в центре Хабаровска, зимой после конкурса там разместили красивые ледянные фигуры, все обошел за полчаса.",Опубликовано 4 апреля 2014 г.
Дальневосточный округ,Хабаровский край,Хабаровск,Развлечения в Хабаровске,Парк Муравьева-Амурского,ozzika2016,5,"Старейший городской парк, который преобразован и осовременен. В 50 годах на входе в парк стояла скульптура И.В. Сталина. Фонтаны, детские аттракционы и ночная подсветка сделали для горожан парк любимым местом отдыха.",
Дальневосточный округ,Хабаровский край,Хабаровск,Развлечения в Хабаровске,Парк Муравьева-Амурского,panas2009,5,"Парк расположен параллельно набережной, очень много развлечений и аттракционов, неподалеку футбольный стадион имени Ленина, ну и конечно сама набережная, где дует самый что ни на есть пронизывающий ветер!",Опубликовано 23 апреля 2019 г.
Дальневосточный округ,Хабаровский край,Хабаровск,Развлечения в Хабаровске,Парк Муравьева-Амурского,pavel128,5,"Очень чисто, рабочие старательно убирают снег. Дорожки вычищены трактором. Деревья в снегу, просто зимняя сказка. Летом не был, но уверен, что в любое время года парк прекрасен.",
Дальневосточный округ,Хабаровский край,Хабаровск,Развлечения в Хабаровске,Парк Муравьева-Амурского,peroga,5,"Реконструкция парка на Амурском утесе с его ландшафтным объединением с прекрасной набережной имени адмирала Геннадия Ивановича Невельского еще продолжается после наводнения 2013 года. Но этопо прежнему один из красивейших уголков Хабаровска, с террасами для обозрения, концертными площадками, аттракционами и кафе. Любимое место любителей активного и пассивного образа жизни. Есть бесплатный вайфай.",
Дальневосточный округ,Хабаровский край,Хабаровск,Развлечения в Хабаровске,Парк Муравьева-Амурского,pfedor22,5,"Прямо на берегу Амура великолепные виды. Очень много мам с маленькими детьми. Настоящее чудо.
Было немного мошки. Непривычно но терпимо.",Опубликовано 29 сентября 2014 г.
Дальневосточный округ,Хабаровский край,Хабаровск,Развлечения в Хабаровске,Парк Муравьева-Амурского,rittmmitr,3,"В парке куча аттракционов. Стоят от 150р. Есть туалеты. Есть мороженное, но оно так себе. Попали бесплатно на пенную вечеринку от рекламной акции развл.комплекса. Дети продержали нас там два дня... Рядом находится музей в нем были на научно-прикладной выставке и с живыми бабочками, что очень понравилась нашим школьникам. Рядом с музеем расположены пушки. Дети на них провели около часа, мы их еле увели домой. Не радуют, конечно, палатки с пивасом. Много народа катается в парке вокруг стадиона на велосипедах, сигвеях, роликах. Все это можно там взять напрокат. Есть какой-то фонтан, скамеечки. И очень хорошо то, что парк и стадион находятся на набережной р.Амур. Короче, приехав туда вы увидите музейный комплекс (художественный, военный, краеведческий), парк развлечений, колесо обозрения(небольшое), набережную, стадион, прокатитесь на роликах-великах, увидите главный памятник Хабаровска - памятник Муравьеву-Амурскому, памятник Дьяченко, кучу псевдо советских памятников, скелет финвала...и кучу свадебных фотографов.",Опубликовано 18 августа 2016 г.
Дальневосточный округ,Хабаровский край,Хабаровск,Развлечения в Хабаровске,Парк Муравьева-Амурского,rogneda77,5,"Сюда можно прийти не только детьми, а они будут в абсолютном восторге. Но и с компанией друзей, немного ностальгии и дополнительно развлечения и новизна ощущений от современных аттракционов.",Опубликовано 19 февраля 2014 г.
Дальневосточный округ,Хабаровский край,Хабаровск,Развлечения в Хабаровске,Парк Муравьева-Амурского,ropot_volny,5,"Замечательное место для прогулки с ребёнком. Много горок, есть ""переносной надувной"" планетарий и летом на стадионе организовывают аквапарк.",Опубликовано 28 марта 2012 г.
Дальневосточный округ,Хабаровский край,Хабаровск,Развлечения в Хабаровске,Парк Муравьева-Амурского,sakril,5,"Замечательный парк для прогулок, занятий спортом и семейного отдыха. Ухоженный, красивый с большим выбором развлечений.",Опубликовано 20 мая 2014 г.
Дальневосточный округ,Хабаровский край,Хабаровск,Развлечения в Хабаровске,Парк Муравьева-Амурского,sakril,5,"Очень люблю бывать в Хабаровске. Во время приезда обязательно посещаем парк Муравьева-Амурского. Там не скучно и зимой, и летом, и детям, и взрослым.",Опубликовано 9 февраля 2014 г.
Дальневосточный округ,Хабаровский край,Хабаровск,Развлечения в Хабаровске,Парк Муравьева-Амурского,sunshine_gold,5,"Парк находится прямо на набережной реки Амур. В нем мнжество дорожек, лестниц. Шикарный вид на Амур. В марте на реке еще лед, но вот летом там будет просто бесподобно. В парке хорошо прогуляться в солнечную погоду.",Опубликовано 27 марта 2014 г.
Дальневосточный округ,Хабаровский край,Хабаровск,Развлечения в Хабаровске,Парк Муравьева-Амурского,tikhon82,5,"Тихо и спокойно. Особенно можно погулять с детьми. Никакого мусора. Был приятно удивлен. На момент моего пребывания там, попалась группа китайских туристов. Они также были доброжелательны.",Опубликовано 9 мая 2014 г.
Дальневосточный округ,Хабаровский край,Хабаровск,Развлечения в Хабаровске,Парк Муравьева-Амурского,utkin_nikita,4,"Парк очень запущен. Летом в выходные дни представляет собой удручающее зрелище: кроме культурных отдыхающих, множество ""отдыхающих любой ценой"", бегают несчастные бродячие животные, под деревом можно встретить ""утомившихся от жизни"" людей.
Зимой производит гнетущее впечатление - просто мертвый парк - жизни практически никакой.
Однако Амур красив, а набережная вдоль Амура очень приятна для прогулок.
Инфраструктура отдыха и развлечений практически отсутствует.",Опубликовано 5 февраля 2014 г.
Дальневосточный округ,Хабаровский край,Хабаровск,Развлечения в Хабаровске,Парк Муравьева-Амурского,veliko114,5,"Очень хороший зеленый парк, дорожки, фонари - все очень красиво! Памятник Муравьеву-Амурскому впечатляет и вид на Амур с утеса.",Опубликовано 2 июня 2015 г.
Дальневосточный округ,Хабаровский край,Хабаровск,Развлечения в Хабаровске,Парк Муравьева-Амурского,vesna271,5,"выглядело все прикольно. набережная в воде, охрана от диких граждан, зеваки с фотоаппаратами. говорят, местные катались на стадионе на досках с парусом, пока стояла вода, но я не видела)) но надо сказать до катаклизма было гораздо веселее. Особенно понравились танцы сирок на набережной, здорово!",Опубликовано 14 февраля 2014 г.
Дальневосточный округ,Хабаровский край,Хабаровск,Развлечения в Хабаровске,Парк Муравьева-Амурского,viv_nosyrova,5,"Я очень люблю этот парк,наверно, это место визитная карточка города. Здесь можно прогуляться среди красивых деревьев (особенно приятно,когда цветет сирень😊), походить по набережной, насладиться видами, покататься на аттракционах. На праздники проходят веселые гуляния. Там же проходят выставки и ярмарки. Думаю, что каждый найдет в этом парке свою зону отдыха.",Опубликовано 23 июля 2018 г.
Дальневосточный округ,Хабаровский край,Хабаровск,Развлечения в Хабаровске,Парк Муравьева-Амурского,worldspm,5,"Это - место рождения Хабаровска. Очень зеленое и удобное место с отличными достопримечательностями на реке Амур. И памятник Н. Н. Муравьев-Амурского очень великий. Это место находится на фотографии на российской банкноте 5000 рублей.Есть некоторые места и развлечения парка для детей. Около парка есть порт, где вы можете взять поездку на линейном судне.Так, сделайте youк фотографии, семью и друзей и пойдите сюда!",Перевод: PROMT
Дальневосточный округ,Хабаровский край,Хабаровск,Развлечения в Хабаровске,Парк Муравьева-Амурского,yamomotto,5,"Красивый, ухоженный парк. Достопримечательность города. Сюда постоянно приезжают свадьбы. Со смотровой площадки открывается потрясающий вид на Амур.",Опубликовано 22 сентября 2014 г.
Дальневосточный округ,Хабаровский край,Хабаровск,Развлечения в Хабаровске,Парк Муравьева-Амурского,yulin7,5,"Чисто, спокойно и уютно. Нижняя часть набережной сейчас закрыта для прогулок из-за разрушений после наводнения, а верхняя все так же хороша как и прежде. Прекрасный вид на Амур. Неподалеку от памятника Муравьеву-Амурскому есть сцена для музыкантов, если повезет по времени, можно попасть на концерт под открытым небом.",Опубликовано 29 августа 2014 г.
Дальневосточный округ,Хабаровский край,Хабаровск,Развлечения в Хабаровске,Парк Муравьева-Амурского,zenit_alex,4,"Понравился парк, чисто вокруг, ухоженная и зеленая территория. С него открывается отличный вид на Амур. Рядом есть музеи, которые тоже очень интересные",Опубликовано 18 июля 2014 г.
Дальневосточный округ,Хабаровский край,Хабаровск,Развлечения в Хабаровске,Парк Муравьева-Амурского,Александр И,1,"Парк в очень уставшем состоянии. Асфальт весь раздолбан. Вообще ощущерие что попал назад в прошлое савдеп да и только! Контингент просто отвратный. С соседних сел и деревень пьяные личности. Фантаны в которых купаются бомжи около стадиона Ленина просто ужас!
Приятная часть набережной (хотя наверно это уже не этот парк) около комсомольской площади, где утес и музей. Вот там очень все цевильно. А стоит спуститься к колесу обозрения и начинается просто трэш. Прям савдепия полная.",Опубликовано 28 августа 2018 г.
Дальневосточный округ,Хабаровский край,Хабаровск,Развлечения в Хабаровске,Парк Муравьева-Амурского,Александр И,5,"Парк на берегу Амура, красиво. Если от парка пойти вверх по лестнице, можно придти к памятнику Муравьева-Амурского.",Опубликовано 15 июля 2016 г.
Дальневосточный округ,Хабаровский край,Хабаровск,Развлечения в Хабаровске,Парк Муравьева-Амурского,Алексей А,5,"Приятное место для прогулок с семьей, друзьями. Открывается красивый вид на реку Амур. Ширина набережной позволяет проехать по ней на велосипеде или с детской коляской. Есть несколько аттракционов для взрослых.",
Дальневосточный округ,Хабаровский край,Хабаровск,Развлечения в Хабаровске,Парк Муравьева-Амурского,Альбина К,5,"Я, со своими ребятами, побывали на колесе обозрения. Это было восхитительно. Ребята смотрели на город с высоты птичьего полета и любовались красотами нашего города. Восторгу не было предела! Советуем всем горожанам побывать в парке, покататься на аттракционнах и обязательно посетить колесо обозрения!",Опубликовано 25 июля 2016 г.
Дальневосточный округ,Хабаровский край,Хабаровск,Развлечения в Хабаровске,Парк Муравьева-Амурского,Андрей Т,4,"Недавно вместе с внучкой семейство гуляло по парку имени Муравьева-Амурского, очень понравилось! Работники парка залили множество прогулочных дорожек водой и получился прекрасный каток! При этом сохранили и пешеходные дорожки, позволив прогуливаться просто пешком! Рекомендую!",Опубликовано 15 декабря 2015 г.
Дальневосточный округ,Хабаровский край,Хабаровск,Развлечения в Хабаровске,Парк Муравьева-Амурского,Анжелика М,5,"Это великолепное место для отдыха любой компанией, с детьми, с друзьями. Есть всё :карусели, где можно прокатиться,вспомнить детские годы, можно пройтись-парк огромен! Плюс до него можно дойти пешком по очень красивому месту - Амурскому бульвару! В общем супер Парк ⛲!!! 🙌",
Дальневосточный округ,Хабаровский край,Хабаровск,Развлечения в Хабаровске,Парк Муравьева-Амурского,Анна Л,4,"Мне как туристу понравился парк. Красивый. Очень удобный для людей: везде стоят лавочки, мусорные урны, красивые виды для фотографий. Очень чисто, аккуратно. Одно удовольствие было гулять.",Опубликовано 5 ноября 2019 г.
Дальневосточный округ,Хабаровский край,Хабаровск,Развлечения в Хабаровске,Парк Муравьева-Амурского,Анна Ш,4,"Это ностальгическое место, в юности часто гуляли по этим дорожкам и хотя многое изменилось, в памяти осталось ощущение праздника.",Опубликовано 9 апреля 2014 г.
Дальневосточный округ,Хабаровский край,Хабаровск,Развлечения в Хабаровске,Парк Муравьева-Амурского,Антон Л,5,Был в Хабаровске как раз после сильнейшего снегопада. На удивление парк был вычищен. Очень понравилось прогуляться тишине по дорожке.,Опубликовано 27 февраля 2015 г.
Дальневосточный округ,Хабаровский край,Хабаровск,Развлечения в Хабаровске,Парк Муравьева-Амурского,Артем Г,4,"Парк очень красивый, в памяти оставляет самые лучшие воспоминания. Есть смотровая площадка, где установлены платные бинокли. Летом действует много различных аттракционов и развлечений, в том числе для детей. В теплое время года периодически играет настоящий духовой оркестр. От набережной отходят экскурсионные прогулочные теплоходы. Много лестниц, но, к сожалению, мало дорожек для детских колясок, велосипедов и инвалидных колясок, это может доставить небольшие неудобства. А в целом, классное, очень красивое место.",Опубликовано 30 октября 2013 г.
Дальневосточный округ,Хабаровский край,Хабаровск,Развлечения в Хабаровске,Парк Муравьева-Амурского,Валентина П,5,"Хороший и ухоженный парк. Место для романтической прогулки, прогулки с детьми, для пожилых людей и просто прогуляться. Доступ к воде правда был закрыт. Безумно красивых вид со смотровой площадки. Есть даже маленькая сцена для местных музыкантов=)",Опубликовано 14 мая 2014 г.
Дальневосточный округ,Хабаровский край,Хабаровск,Развлечения в Хабаровске,Парк Муравьева-Амурского,Валерий К,5,"парк, достойно представляющий столичный статус города - громадный, красивый, ухоженный да к тому же и в самом центре Хабаровска",Опубликовано 31 августа 2014 г.
