Дальневосточный округ,Сахалинская область,"Сахалин,Южно-Сахалинск",Развлечения в Южно-Сахалинске,"Спортивно-туристический комплекс ""Горный воздух""",02petrushina76,5,"Очень понравилось восхождение на самый верх базы. Подъемники как в Европе, очень удивило на краю земли....!!!!Самые современные. Красивый вид на горы, пейзажи. На самой высоте наблюдали посадку самолета, впечатлило.",Опубликовано 29 января 2014 г.
Дальневосточный округ,Сахалинская область,"Сахалин,Южно-Сахалинск",Развлечения в Южно-Сахалинске,"Спортивно-туристический комплекс ""Горный воздух""",177_70,5,Прекрасный вид на город и если честно то с горда на турбазу тоже прекрасный вид.Особенно вечером когда горнолыжная трассы в огнях.Кажется что она плывет над городом.Канатная дорога на современном уровне.Ну вообщем если вы впервые в городе то стоит побывать.,Опубликовано 10 декабря 2014 г.
Дальневосточный округ,Сахалинская область,"Сахалин,Южно-Сахалинск",Развлечения в Южно-Сахалинске,"Спортивно-туристический комплекс ""Горный воздух""",193337,5,"Хорошее место для ознакомления с природой Южно-Сахалинска, весь город как на ладони, отличная канатная дорога, очень комфортная и безопасная. Зимой возможность заняться зимними видами спорта (для лыжников есть отдельный подъемник)",Опубликовано 26 октября 2015 г.
Дальневосточный округ,Сахалинская область,"Сахалин,Южно-Сахалинск",Развлечения в Южно-Сахалинске,"Спортивно-туристический комплекс ""Горный воздух""",514_2013,5,"Отличное место-подойдет для обычной прогулки, ну и конечно для людей кто занимается спортом. Зимой наверху конечно очень холодно. Не забудьте фотоаппарат- поводов для фото будет достаточно, панорама на город-красота! Сам подъем много времени не займет",Опубликовано 29 ноября 2013 г.
Дальневосточный округ,Сахалинская область,"Сахалин,Южно-Сахалинск",Развлечения в Южно-Сахалинске,"Спортивно-туристический комплекс ""Горный воздух""",775natalia,5,Подъем наверх при помощи современной канатной дороги не оставит равнодушным ценителей красоты видов с высоты птичьего полета,Опубликовано 11 июля 2017 г.
Дальневосточный округ,Сахалинская область,"Сахалин,Южно-Сахалинск",Развлечения в Южно-Сахалинске,"Спортивно-туристический комплекс ""Горный воздух""",Afon90ka,5,"Вид с верху завораживает, город и сусунайская долина, в далеке видно залив Анива . А спуск по южному склону !-) красота сопок закрывающих друг друга. Зеленые ели на синем фоне неба, спуск в виде каскада.словами не передать)))",Опубликовано 15 апреля 2014 г.
Дальневосточный округ,Сахалинская область,"Сахалин,Южно-Сахалинск",Развлечения в Южно-Сахалинске,"Спортивно-туристический комплекс ""Горный воздух""",Aleksandrlok,5,"Самый лучший на Дальнем востоке горнолыжный комплекс. Каждый год что то новое строят. Мягкий натуральный снег. Ухоженные трассы. Расположение просто супер. Аэропорт прямо в городе. Полчаса до гостиницы. Можно снять квартиру рядом с горой. Или на такси тоже недорого с любого места в городе.
Бывает конечно с погодой не повезет. Ну и нужно смотреть графики мероприятий проводимых на горе. Можно попасть когда не все трассы будут открыты. Природа сказочная. Виды завораживающие. Фрирайда навалом. В общем все супер.",Опубликовано 9 марта 2015 г.
Дальневосточный округ,Сахалинская область,"Сахалин,Южно-Сахалинск",Развлечения в Южно-Сахалинске,"Спортивно-туристический комплекс ""Горный воздух""",Aleksei2013,5,Отлично организованный для России лыжно-сноубордный отдых. Поменьше бы очереди и вообще сто баллов!!!,Опубликовано 31 октября 2013 г.
Дальневосточный округ,Сахалинская область,"Сахалин,Южно-Сахалинск",Развлечения в Южно-Сахалинске,"Спортивно-туристический комплекс ""Горный воздух""",Aleksem А,5,Отличный отдых для катающихся на горных лыжах.Комплекс находится в городе.В этом сезоне заработают снеговые пушки.Это увеличит продолжительность сезона.Жаль сейчас гондольная дорога не работает в связи с установкой пушек.,Опубликовано 5 августа 2013 г.
Дальневосточный округ,Сахалинская область,"Сахалин,Южно-Сахалинск",Развлечения в Южно-Сахалинске,"Спортивно-туристический комплекс ""Горный воздух""",Aleksem А,5,"Хорошее место для катания на горных лыжах и пеших прогулок
Летом на велосипеде рекомендую серпантин на южном склоне",
Дальневосточный округ,Сахалинская область,"Сахалин,Южно-Сахалинск",Развлечения в Южно-Сахалинске,"Спортивно-туристический комплекс ""Горный воздух""",Alex V,5,"Это был мой первый опыт катания на горных лыжах, потому, наверное, и такая высокая оценка.
Канатная дорога- современна, в кабинках не холодно.
Рядом есть прокат, цены тоже на приемлимом уровне.
На днях обязательно пойду еще! )",Опубликовано 27 января 2014 г.
Дальневосточный округ,Сахалинская область,"Сахалин,Южно-Сахалинск",Развлечения в Южно-Сахалинске,"Спортивно-туристический комплекс ""Горный воздух""",Alexander .,4,"Задумка организации горнолыжного хозяйства международного уровня на Сахалине отличная. Реализация - ещё есть, над чем работать.

Комплекс, собственно, только развивается - летом строят новые трассы, ухаживают за существующими, чистят лес.

Все оборудование новое, за ним хорошо следят. Кабинки есть открытые и закрытые.

В хорошую снежную зиму кататься - одно удовольствие. Трасс много, они широкие, разного уровня сложности. Фрирайд среди густого леса или поля - пожалуйста.

Один минус - это выкат самого нижнего склона. Из-за жилых построек трасса в этом месте сильно сужается - бутылочное горлышко. Может быть перестроят со временем.

Мест отдыха не так много - основное скопление (1-2 кафе) на среднем уровне комплекса. В час пик места за столиком можно не найти. В одном из кафе имеется большая детская комната на втором этаже. Пожелание - расширить общепит.

И конечно же туалеты. То, что было в сезон 2016-2017 гг. - это кошмар. За туалетами надо следить и строить их с учётом специфики размещения (просторнее, с поручнями, поменьше ступенек и пошире коридоры и т.д.).

В целом очень хороший курорт, желаю развития и процветания!",Опубликовано 27 сентября 2017 г.
Дальневосточный округ,Сахалинская область,"Сахалин,Южно-Сахалинск",Развлечения в Южно-Сахалинске,"Спортивно-туристический комплекс ""Горный воздух""",Alexander K,4,"Всем, кто приезжает в Южно-Сахалинск в командировку и катается на горных лыжах или сноуборде рекомендую комплекс ""Горный воздух"", трассы на любой уровень катания, прокат и современные подъемники; комплекс удобно расположен недалеко от центра города. Гладких трасс ! Александр.",Опубликовано 21 февраля 2014 г.
Дальневосточный округ,Сахалинская область,"Сахалин,Южно-Сахалинск",Развлечения в Южно-Сахалинске,"Спортивно-туристический комплекс ""Горный воздух""",Alexander K,5,"Друзья, рекомендую обратить внимание на трассу ""Север"": новый подьемник, крутой склон и мало посетителей. В хороший сезон можно кататься до конца марта. Недалеко от входа есть кафе с недорогой едой.

Хорошего Вам отдыха !",Опубликовано 5 сентября 2019 г.
Дальневосточный округ,Сахалинская область,"Сахалин,Южно-Сахалинск",Развлечения в Южно-Сахалинске,"Спортивно-туристический комплекс ""Горный воздух""",Alexander N,5,"Прекрасный вид на город!!! Вид на гору и на залив Анива. На самой горе кафе, когда устанете смотреть, закажите там шашлык! Мне очень понравился, хотя более чем скептически отношусь к подобного рода фастфуду.
Из минусов, прежде чем соберетесь посетить гору, уточните как правильно на нее попасть. Подъемник который виден из города - это его вторая часть там пересадка с нижней половины, даже если добретесь к этой пересадке пешком или на машине - на верх вас не пустят. Потребуется спуститься вниз, к кассе (бесплатно), там взять билет, и потом уже с пересадкой, попадете на вершину.
Для фотографий предпочтительно первая половина дня, после обеда солнце светит со стороны города.
И еще - подъемник вниз работает до 20-00 вечера, о чем предупреждают. Иначе вниз только пешком.",Опубликовано 16 августа 2014 г.
Дальневосточный округ,Сахалинская область,"Сахалин,Южно-Сахалинск",Развлечения в Южно-Сахалинске,"Спортивно-туристический комплекс ""Горный воздух""",Alexander R,4,"Подъемник не работал - может именно в мой ДР, 21 июня, решили профилактику провести, а может летом он не работает вовсе, не выяснял.
Кафешки закрыты. Но.
Наверху реально классно в хорошую погоду, Южный как на ладони, море видно (в сторону Анивы), самолёты внизу на Хомутово на посадку заходят.
Наверх есть больше одной дороги (мне попались две автомобильные, две пешие).
По дороге подъем минут 40 без остановок, в жару может быть напряжно.
По другую сторону горы Большевик видны другие сопки, больше ничего.
Рядом несколько родников, но они не совсем по пути, так что воду лучше взять.",Опубликовано 24 июня 2016 г.
Дальневосточный округ,Сахалинская область,"Сахалин,Южно-Сахалинск",Развлечения в Южно-Сахалинске,"Спортивно-туристический комплекс ""Горный воздух""",Alexander S,4,"Очень живописное место - хороший вид на горы вокруг. Ремонт вошла в полном шкале - новом стуле - лифт накрыт, новый отель pists. Напоминает Абзаково в Южном Уральские горы.",Перевод: PROMT
Дальневосточный округ,Сахалинская область,"Сахалин,Южно-Сахалинск",Развлечения в Южно-Сахалинске,"Спортивно-туристический комплекс ""Горный воздух""",Alexander S,5,Горный воздух действительно лучший на Дальнем Востоке и по протяженности трасс и по перепадам высот и по количеству склонов и по уровню подъемников и по качеству покрытия склонов и по месторасположению горы. Будет возможность решайтесь и не сомневайтесь. Красивейшая природа местные деликатесы дополнят впечатления от каталки.,Опубликовано 12 марта 2016 г.
Дальневосточный округ,Сахалинская область,"Сахалин,Южно-Сахалинск",Развлечения в Южно-Сахалинске,"Спортивно-туристический комплекс ""Горный воздух""",Alexander S,5,"Лучший горнолыжный курорт в Дальневосточном регионе России. Отлично подготовленные трассы, неповторимая природа, дружелюбная атмосфера Сахалина создают отличные условия для активного отдыха. Курорт развивается, появляются новые трассы, подъемники. Есть возможность катания как по склонам, так и по лесу. Приезжайте, восторг гарантирован.",Опубликовано 4 марта 2017 г.
Дальневосточный округ,Сахалинская область,"Сахалин,Южно-Сахалинск",Развлечения в Южно-Сахалинске,"Спортивно-туристический комплекс ""Горный воздух""",Alexandra,5,"Место, которое должен посетить каждый гость нашего города. В любое время года.
Этой зимой наш родственник, родом из далекой солнечной Австралии, выкроил неделю своего драгоценного времени, чтобы покататься на склонах Горного. Пребывал в абсолютном восторге от мягкого, белого, искрящегося снега.
Люблю провести на горе выходной день зимой, всей семьей стоим на лыжах.
Начинающим можно взять индивидуальные уроки у тренеров, это не бюджетно, но того стоит.",Опубликовано 30 июня 2015 г.
Дальневосточный округ,Сахалинская область,"Сахалин,Южно-Сахалинск",Развлечения в Южно-Сахалинске,"Спортивно-туристический комплекс ""Горный воздух""",Alexandra F,4,"+ Радует, что комплекс развивается: за год на самом красивом склоне установили кресельный подъёмник и был разработан новый склон. Если ничего не путаю, то и на ""Серпатнитне"" новые фонари. Отдельно хотелось бы отметить работу службы канатных дорог :всегда начеку!
- Из ТРЁХ кафе на всем комплексе абсолютно нечего порекомендовать. Год назад обедали в кафе Лиана, в этом году еда испортилась настолько, что просто не передать словами. В верхнем кафе всегда было на любителя, ну а само кафе ""Горный воздух"" разочаровало: еда как в столовой, а цены как в ресторане. Спасал фургон ""Мельницы"". Мы проводили на комплексе практически целый день и полноценного обеда всё таки не хватало. Очень просим обратить внимание на этот момент.",Опубликовано 13 марта 2017 г.
Дальневосточный округ,Сахалинская область,"Сахалин,Южно-Сахалинск",Развлечения в Южно-Сахалинске,"Спортивно-туристический комплекс ""Горный воздух""",Alexey O,5,"Отличное катание, разнообразные трассы. С одного подъемника можно получить как хорошее трассовое катание, так и достаточное количество вне трассовых, не подготовленных маршрутов. Если есть возможность - не планируйте визит на праздники, очереди испортят ощущения от катания.",
Дальневосточный округ,Сахалинская область,"Сахалин,Южно-Сахалинск",Развлечения в Южно-Сахалинске,"Спортивно-туристический комплекс ""Горный воздух""",Alina V,4,"Попали в период, когда не работала Канатная дорога, неудобств доставило массу, подъем на бугеле доставил хлопот- это устал пока поднялся, трасса подъемника все время куда пытается тебя унести, ещё и холодно. Но поездка в конце января, в отличии от новогодних каникул, радует отсутствием очередей! Трассы работали все, что очень радует, как только отремонтировали тёплые кабинки, все недостатки ушли и можно было насладиться катанием! Вид с вершины на город шикарный, посетителям можно подняться просто в прогулочной кабинке и погулять по вершине.",
Дальневосточный округ,Сахалинская область,"Сахалин,Южно-Сахалинск",Развлечения в Южно-Сахалинске,"Спортивно-туристический комплекс ""Горный воздух""",Alisa_200372,5,"Были когда Погода! Не радовала, но понравилась и цена и качество обслуживания я ,за троих заплатили подняться до самого верха 900 рублей , площадка симпатичная и можно чай горный попить и красиво сфотографироваться ,очень рекомендую гостям города",Опубликовано 8 октября 2016 г.
Дальневосточный округ,Сахалинская область,"Сахалин,Южно-Сахалинск",Развлечения в Южно-Сахалинске,"Спортивно-туристический комплекс ""Горный воздух""",An R,5,"Сравниваю только с российскими склонами (пока на других не был). Очень понравилось, здесь поставил сына на сноуборд. Опробовали все склоны. Если сравнивать по сервису, то выше Домбая и ниже Красной поляны. А по соотношению цена/качество - выше всех...",Опубликовано 2 июля 2014 г.
Дальневосточный округ,Сахалинская область,"Сахалин,Южно-Сахалинск",Развлечения в Южно-Сахалинске,"Спортивно-туристический комплекс ""Горный воздух""",Anastasia F,5,"Если вы лыжник или сноубордист - Вам сюда! Это прекрасные склоны, много сахалинского снега, тепло и солнце, а если сильно повезет - то и метель, а после - целина и пухляк! Конечно, это не Альпы и не европейские бесконечные трассы, но Горный воздух доступен для дальневосточников и по цене, и по расстоянию. А/к SAT ранее устраивали акции для посетителей ГВ, в стоимость перелета входила стоимость безлимитного абонемента на подъемник, и это была прекрасная инициатива и поддержка внутреннего туризма! Там я влюбилась в сноубординг!
А еще это прекрасный вид на город и природу вокруг, там стоит побывать!",Опубликовано 24 июля 2015 г.
