zone,region,city,att_type,att_name,author,rating,comment,comment_date
Дальневосточный округ,Приморский край,Владивосток,Развлечения в Владивостоке,Океанариум Аквамир,Артем Ч,2,"Если честно, то с таким же успехом можно сходить в зоомагазин и при этом бесплатно. Билет не оправданно дорогой. Помимо огромных стерлядей в центре зала и еще пары раб смотреть просто не на кого. А стерлядь просто жалко: Аквариум круглый, в центре то ли труб, то ли еще что то. В итоге бедные рыбы просто плавают изо дня в день по кругу в одном направлении так что им даже не развернуться из за их размера.",Опубликовано 18 октября 2015 г.
Дальневосточный округ,Приморский край,Владивосток,Развлечения в Владивостоке,Океанариум Аквамир,Владимир Щ,3,"Был почти сразу после открытия океанариума. Рыб и животных мало, зато много стендов, муляжей, видеофильмов. По-видимому, пока идет разработка и отладка. по сравнению с заграничными, пока проигрывает.",Опубликовано 10 декабря 2016 г.
Дальневосточный округ,Приморский край,Владивосток,Развлечения в Владивостоке,Океанариум Аквамир,Галина А,4,Хорошее место для прогулок семьей и с друзьями. Повидала много морских гадов. Понравились заспиртованные змеи в банке и круговой аквариум с осетрами. Не понравилась женщина Билетёр - очень неприветливая.,Опубликовано 7 сентября 2016 г.
Дальневосточный округ,Приморский край,Владивосток,Развлечения в Владивостоке,Океанариум Аквамир,Дмитрий Ф,4,"Очень полезное как с научной так и с любительской точки зрения место. Здесь можно провести не один час изучая, любуясь чудесами океанов и морей.",Опубликовано 23 марта 2014 г.
Дальневосточный округ,Приморский край,Владивосток,Развлечения в Владивостоке,Океанариум Аквамир,Евгения Пермякова,5,"Были на Дне Рыбака на Спортивной Набережной. Решили показать детям Океанариум.
Очень изменился! Добавилась выставка Рептилий - очень круто))
Интересные рыбки - красивые, большие и маленькие, местные и тропические.
Все довольны! Отлично провели время с семьей!",Опубликовано 14 июля 2019 г.
Дальневосточный округ,Приморский край,Владивосток,Развлечения в Владивостоке,Океанариум Аквамир,Екатерина Д,3,"За год посетили с ребенком два раза, ему конечно интересно и ходилис удовольствием, тем более что на втором этаже есть музей. Но если сравнивать с ОКЕАНАРИУМАМИ, то это я не знаю как назвать.... Хотя аквариум с осетрами интересный. А так на все уходит 15 мин максимум с остановкой в лавке каких то бессмысленных безделушек. Вот если совсем нечего делать то сходить можно, хотя если не ходить ничего не потеряешь",Опубликовано 18 июля 2013 г.
Дальневосточный округ,Приморский край,Владивосток,Развлечения в Владивостоке,Океанариум Аквамир,Иван Макаров,4,"Интересное место. Удобно расположено в районе где можно погулять, поесть в кафешках и сходить с детьми в парк с качелями. В Океанариуме много рыб, рептилий, змей. Особенно понравились экзотические рыбки, крокодил, осьминог, огромные осетровые.",Опубликовано 14 июля 2019 г.
Дальневосточный округ,Приморский край,Владивосток,Развлечения в Владивостоке,Океанариум Аквамир,Игорь И,3,"В целом неплохая экспозиция. Здание и все стенды сильно нуждаются в ремонте. Экспозиция не большая. Хотелось бы увидеть больше видов крупных животных, хищников и прочих.",Опубликовано 30 декабря 2015 г.
Дальневосточный округ,Приморский край,Владивосток,Развлечения в Владивостоке,Океанариум Аквамир,Игорь Н,3,"Можно посмотреть всякую живность, но только один, максимум два раза. Скучновато..рыбки побитые, смотреть мало, но в условиях ограниченного времени можно.",Опубликовано 2 сентября 2017 г.
Дальневосточный округ,Приморский край,Владивосток,Развлечения в Владивостоке,Океанариум Аквамир,Кира К,3,"Увы, в крутой океанариум на острове Русский мы поехать не смогли... Пришлось посетить этот ))
Ничего особенного. Маленький... Темный... Черепашки... Гигантские сазаны... А на втором этаже что-то вроде музея с позвонками китов и заспиртованными зародышами всяких нерп...
Внутри еще есть магазин сувениров... Довольно неплохой, если вам нужны магнитики, или что-то в этом роде...
Стоимость - кажется 350. Слишком дорого. Но нам все равно было некуда идти )) Заходили всюду, куда можно было ))

Скат на фото - пожалуй, самое симпатичное существо в Океанариуме.",Опубликовано 16 сентября 2016 г.
Дальневосточный округ,Приморский край,Владивосток,Развлечения в Владивостоке,Океанариум Аквамир,Константин Б,5,"Единственный океанариум в городе и является одной из достопримечательностей города. Имеет два зала, общая площадь которых составляет 1500 кв. м. В зале первого этажа представлены аквариумы с орбиталями пресных водоемов и морей Дальнего востока. На втором этаже в витринах размещена коллекция морских раковин, чучила пингвинов, рыб, птиц тропиков, череп морской коровы, зародыш калана-альбиноса. Океанариум построен в 1990 году и на сегодняшний день насчитывает около 120 разных видов морских обитателей.",Опубликовано 3 июня 2015 г.
Дальневосточный округ,Приморский край,Владивосток,Развлечения в Владивостоке,Океанариум Аквамир,Константин Елисеев,4,Хороший океанариум.. в основном представлена фауна Дальнего Востока и Тихого океана. Главныйм минус - огромные очереди !!!!,
Дальневосточный округ,Приморский край,Владивосток,Развлечения в Владивостоке,Океанариум Аквамир,Леонид П,4,Гуляя пр набережной я увидел здание океанариум решил зайти посмотреть на обитателей морей и рек. Стоимость билета довольно высокая ну и я расчитывал увидит что-то особенное но войдя внутрь был разочерован насколько все убого а мне есть с чем срамнивать.,
Дальневосточный округ,Приморский край,Владивосток,Развлечения в Владивостоке,Океанариум Аквамир,Лера S,4,"Водили детей для общего ознакомления... и по причине того, что обещали с 01.01.2017 закрыть...Жаль...После зарубежных океанариумов, детей сначало ничего не впечатлило ..., но в океанариуме есть редкие экспонаты, которые не увидешь нигде...Благодаря опытному экскурсоводу получили интересную информацию... Единственный плюс в центре города...можно построить удобный маршрут с посещением и других достопримечательностей (прогулкой по набережной с фонтаном, посещением спорткомплекса)... Все таки у нас есть чем гордится...и еще бы научились бы правильно и красиво преподносить ...делать изюминку...- тогда даже из небольшого океанариума Аквамир можно сделать привлекательный туристический маршрут, приносящий доход.. Ведь где мы были..экспонатов меньше...но за счет различных маркетинговых мероприятий - туристы едут смотреть...Удачи и процветания, наш Владивостокский океанариум Аквамир.",Опубликовано 11 марта 2017 г.
Дальневосточный округ,Приморский край,Владивосток,Развлечения в Владивостоке,Океанариум Аквамир,Маргарита Т.,5,Нам всё очень понравилось. Жаль конечно что морских обитателей стало намного меньше. Дети остались немного расстроены.,Опубликовано 12 января 2023 г.
Дальневосточный округ,Приморский край,Владивосток,Развлечения в Владивостоке,Океанариум Аквамир,Марина Т,3,"Идея была очень хорошая, но по факту деньги ушли не по назначению... Куча дешевого пластика гигантских размеров, помещения оформлены просто ужасно, без вкуса и стиля для такого масштабного океанариума.
Стекла аквариумов просто ужасные. Ребёнок в очках не мог в них смотреть, увеличивалась резкость и начинали болеть глаза. У меня 100% зрение, но смотреть тоже не могла.
Часть аквариумов заполнена на половину, поэтому рыбок можно смотреть стоя на коленях... Ну что поделать, так спроектировал ""гениальный"" архитектор.
Гигантские макеты животных (абсолютно убого выглядящие) и под ними 3 крохотный аквариума к которым не подобраться.
Безопасность. Тоже сильно удивила, но писать про это не буду.
Полное разочарование от посещения.",
Дальневосточный округ,Приморский край,Владивосток,Развлечения в Владивостоке,Океанариум Аквамир,Мария Д,5,Довольно интересно для посещения. Есть большой магазин с сувенирами. Также на 2 этаже морской музей. Есть что посмотреть и детям и взрослым. Рыбок представлено не очень большое количество. Тем не менее узнала много нового.,
Дальневосточный округ,Приморский край,Владивосток,Развлечения в Владивостоке,Океанариум Аквамир,Мария П,1,"Покупаешь билет и попадаешь в казематы для несчастных обитателей сего заведения. Помещения темные, мрачные, вода мутная. При нахождении там появляется дикое желание поскорее выйти и забыть, что заходила. Рыбех искренне жалко.",Опубликовано 16 сентября 2015 г.
Дальневосточный округ,Приморский край,Владивосток,Развлечения в Владивостоке,Океанариум Аквамир,Надежда К,3,"Очень дорого. Если вы пенсионер или ветеран боевых действий-возьмите соответствующий подтверждающий документ, тогда пройдете со скидкой. Помещение оказалось темным, даже слишком мрачным. Некоторые аквариумы были грязными, много заспиртованных моллюсков и прочей живности. Ожидали большего...С другой стороны вход в зоомагазин, там гораздо интереснее можно рыбок посмотреть и бесплатно.",Опубликовано 30 августа 2015 г.
Дальневосточный округ,Приморский край,Владивосток,Развлечения в Владивостоке,Океанариум Аквамир,Наталья П,4,"В детстве мы часто с родителями ездили во Владивосток из соседнего города погулять по набережной, посетить дельфинарий, который к сожалению закрыт, а так же, обязательно сходить в океанариум! Сейчас, спустя много лет, часто бываю с деловыми визитами во Владивостоке и по-прежнему люблю, иногда, прогуляться по историческому центру города в хорошую солнечную погоду, а за одно и зайти в старый добрый океанариум. Надо сказать с моего детства там мало, что изменилось. Интерьер тот же, те же самые экспонаты и, непосредственно, все главные герои-тоже те же. Но стоит заметить, что всё в отличном состоянии, регулярно реставрируется. Из раза в раз всегда нахожу что-то интересное для себя. Всем советую посетить!",Опубликовано 7 апреля 2014 г.
Дальневосточный округ,Приморский край,Владивосток,Развлечения в Владивостоке,Океанариум Аквамир,Наталья С.,5,Расположен на набережной. Много интересных рыб и других обитателей водных глубин. Приятное соотношение цены и качества.,Опубликовано 22 июня 2017 г.
Дальневосточный округ,Приморский край,Владивосток,Развлечения в Владивостоке,Океанариум Аквамир,Олег П П,4,"Не нашёл, когда был открыт аквариум, но думаю лет тридцать ему точно есть и соответственно здание и сама экспозиция отвечала требованиям того времени. На сегодняшний день этого маловато, но посетить стоит. Центр выставки это большой аквариум в виде цилиндра, в котором плавают огромные осетры. В стенах небольшие аквариумы с различными рыбками. Есть интересные экземпляры. Вольер с крокодилом. Также здании интересант выставка бабочек, но за отдельную плату. На выходе кафе.",Опубликовано 19 октября 2017 г.
Дальневосточный округ,Приморский край,Владивосток,Развлечения в Владивостоке,Океанариум Аквамир,Петр К,4,"В России мало океанариумов. На фоне подобных объектов в Японии, Австралии и других зарубежных странах он очень маленький и не самый дешевый. Но общее представление о фауне Тихого океана и реки Амур он даёт.",Опубликовано 30 сентября 2015 г.
Дальневосточный округ,Приморский край,Владивосток,Развлечения в Владивостоке,Океанариум Аквамир,Светлана К,5,"Особенностью данного океанариума для нас явилось то, что нем представлены не только водоплавающие представители (различные рыбы, ракообразные, черепахи и.т.п.), но и имеется отдельный зал где представлены манекены различных морских животных, паразитов, которые в них живут, а также множество ракушек и кораллов. Стоимость посещения составляет 250 рублей на человека. В отдельном помещении на территории океанариума имеется лавка, где можно приобрести сувениры по очень приемлемым ценам.",
Дальневосточный округ,Приморский край,Владивосток,Развлечения в Владивостоке,Океанариум Аквамир,Сергей Г,2,Маленькая экспозиция. Единственный аквариум понравился с белугами и калугами. Скудно. Не понравилось. Лучше не тратить своё время.,Опубликовано 23 июня 2015 г.
Дальневосточный округ,Приморский край,Владивосток,Развлечения в Владивостоке,Океанариум Аквамир,Сергей К,3,"Путешествуя по Владивостоку мою группу привезли на остров Русский и издалека показали строящийся океанариум, рассказали о том, что будет в нем, поэтому я был готов к тому, что в старом океанариуме всё выглядит по-старому - так оно и получилось. Тем не менее есть, что посмотреть: впечатляет аквариум с осетровыми, понравилась камбала.... На втором этаже представлена прекрасная коллекция птиц, рыб и других даров морей тихого океана. В общем было интересно.... но, хочется, большего.",Опубликовано 5 декабря 2014 г.
Дальневосточный округ,Приморский край,Владивосток,Развлечения в Владивостоке,Океанариум Аквамир,Татьяна В,5,"Океанариум хоть и небольшой, но там очень интересно.
Особенно хорош аквариум, который размещен в центре зала и можно ходить за рыбами вокруг него и ,например, заглянуть в глаза осетру)
Вообще, кроме рыб там есть еще и полипы и крабики и кожистая черепаха и много кого еще)
Крокодил там тоже есть.",Опубликовано 30 мая 2014 г.
Дальневосточный округ,Приморский край,Владивосток,Развлечения в Владивостоке,Океанариум Аквамир,Татьяна Г,5,"Океанариум расположен на набережной. Много аквариумов с красивыми рыбами и другими морскими гадами. Есть магазинчик, где можно приобрести сувениры.",Опубликовано 12 августа 2015 г.
Дальневосточный округ,Приморский край,Владивосток,Развлечения в Владивостоке,Океанариум Аквамир,Татьяна П,5,"Часто бываю в разных городах и странах и почти всегда бываю в местных океанариумах. Вроде бы что можно нового увидеть, а везде сделано совершенно по-разному, какая-то своя изюминка. Вот и во Владивостоке главный корпус океанариума сделан похожим на белую раковину двустворчатого моллюска, высунувшуюся из синих морских вод.
В левом крыле расположен 75-и метровый подводный тоннель с разнообразной морской живностью. В восточной части расположен дельфинарий с ареной и трибунами для зрителей. Сколько бы не смотрел представления, а в новом месте пропустить такое зрелище не возможно!",Опубликовано 30 декабря 2014 г.
Дальневосточный округ,Приморский край,Владивосток,Развлечения в Владивостоке,Океанариум Аквамир,Худякова Л,5,"По приезду нас встретил безоплатный автобус и подвез всех гостей до океанариума. Было приятно.
Вокруг очень красивая территория. Не только перед зданием, но и за ним.
В океанариуме отлично. Много необычных экспозиций.",
