Дальневосточный округ,Приморский край,Владивосток,Развлечения в Владивостоке,Сопка Орлиное гнездо,"""ШАМОРА-ТУР""",5,"Посетив видовую площадку Вы насладитесь великолепными видами на бухту Золотой Рог и Золотой мост. Всегда тепло одевайтесь, так как очень часто дует сильный ветер..",Опубликовано 20 декабря 2019 г.
Дальневосточный округ,Приморский край,Владивосток,Развлечения в Владивостоке,Сопка Орлиное гнездо,133Alin,4,"Рекомендую посетить. Вид на городи изумительный. Общество, в основном, студенческое вокруг, это тоже приятно. Жаль, смотровая площадка не в полную силу эксплутируется: там идут ремонтные работы.",Опубликовано 16 ноября 2013 г.
Дальневосточный округ,Приморский край,Владивосток,Развлечения в Владивостоке,Сопка Орлиное гнездо,2013_400,4,Заехать в это место стоит. Главное его достоинство-потрясающий вид на город Владивосток. Можно охватить самые разные уголки. Оттуда получаются красивые фотки с видом на город. Только бы с погодой повезло-туман ухудшает обзор.,Опубликовано 14 мая 2015 г.
Дальневосточный округ,Приморский край,Владивосток,Развлечения в Владивостоке,Сопка Орлиное гнездо,28Natasha,5,"Самая лучшая видовая города Владивосток. Прекраснейший вид на бухту Золотой Рог. Город как на ладони, виден мост на остров Русский. Виден фуникулер. Советую всем гостям города посетить это замечательное место. Единственный минус, это плохая дорога при заезде на видовую площадку.",Опубликовано 25 мая 2014 г.
Дальневосточный округ,Приморский край,Владивосток,Развлечения в Владивостоке,Сопка Орлиное гнездо,311_2014,5,"На сопке расположена лучшая смотровая площадка, памятник Кириллу и Мефодию. часто можно встретить молодоженов, которые приезжают фотографироваться именно сюда. Кстати, орлы иногда летают до сих пор (не машут крыльями, а парят в отличии от других птиц)",Опубликовано 7 мая 2015 г.
Дальневосточный округ,Приморский край,Владивосток,Развлечения в Владивостоке,Сопка Орлиное гнездо,4-07-90,5,Прекрасный вид на город)))как на ладони!Одно из самых любимых мест в городе!И одно из лучших мест для свадебных покатушек))),Опубликовано 6 июня 2012 г.
Дальневосточный округ,Приморский край,Владивосток,Развлечения в Владивостоке,Сопка Орлиное гнездо,809_13,5,"Отличный вид на город. Советую посетить на закате . Достаточно посещаемое место. Много свадеб. Панорамный вид на мост через бухту Золотой Рог, на саму бухту , центральную часть города. На закате очень красиво. Сразу поймете почему бухта так называется )",Опубликовано 15 марта 2016 г.
Дальневосточный округ,Приморский край,Владивосток,Развлечения в Владивостоке,Сопка Орлиное гнездо,82_2014,4,Одно из мест с которого открывается великолепный вид на Владивосток. Судя по количеству замков на ограждении это ещё и место паломничества молодоженов.,Опубликовано 12 декабря 2018 г.
Дальневосточный округ,Приморский край,Владивосток,Развлечения в Владивостоке,Сопка Орлиное гнездо,AZCasualTraveler,4,"Есть довольно много шагов, чтобы подняться до Орлиной точки зрения Гнезда, но когда вы добираетесь там, виды довольно хорошие. Вы добираетесь, чтобы увидеть Новый мост во Владивостоке, городском горизонте и заливе, где входят суда. Также в точке зрения, есть удобный Сувенирный магазин, у которого есть много пунктов сувенира на выбор.",
Дальневосточный округ,Приморский край,Владивосток,Развлечения в Владивостоке,Сопка Орлиное гнездо,Academyjapanese,5,"Отличное место не только для того, чтобы сделать много памятных фото с городом Владивостоком, но и купить сувениров по адекватных ценам, посмотреть на город с высоты птичьего полета и насладиться красотой.",Опубликовано 29 октября 2018 г.
Дальневосточный округ,Приморский край,Владивосток,Развлечения в Владивостоке,Сопка Орлиное гнездо,Aleksandr S,5,"Видовая площадка расположена не на самой вершине сопки Орлиное гнездо, но на центральную часть Владивостока, бухту Золотой Рог, Амурский залив отсюда открывается захватывающий вид, здесь вы ощутите трёхмерность и своеобразие города. Это всегда была одна из лучших точек для панорамного обзора, и до, и после возведения Золотого моста, дневной вид мне больше нравится. Впечатления и фото будут более эффектные в ясную погоду, в туман абсолютно не то. Владивосток является одним из самых ветреных городов России, поэтому на видовой площадке часто дует свежий ветер.",Опубликовано 21 апреля 2017 г.
Дальневосточный округ,Приморский край,Владивосток,Развлечения в Владивостоке,Сопка Орлиное гнездо,Aleksandr S,5,"На сопке Орлиное гнездо расположена популярная видовая площадка, откуда открывается красивый вид на бухту Золотой Рог, Золотой мост, исторический центр Владивостока, мыс Чуркина, полуостров Эгершельд. Важным условием успешного посещения является ясная солнечная погода.",
Дальневосточный округ,Приморский край,Владивосток,Развлечения в Владивостоке,Сопка Орлиное гнездо,Aleksandr Z,5,"Если ты прибыл во Владивосток и хочешь увидеть город - то это то самое место. Обязательно нужно посетить вечером, вам понравится))))",Опубликовано 28 июля 2016 г.
Дальневосточный округ,Приморский край,Владивосток,Развлечения в Владивостоке,Сопка Орлиное гнездо,Aleksey V,3,"Если есть хорошая погода, есть интересный взгляд, но нет никакой полиции, хороших магазинов, туалетов и часто ветров, все здесь должно быть определенно лучше, чем вагон фуникулера или группа на автобусе, не забывайте свою камеру и воду.",
Дальневосточный округ,Приморский край,Владивосток,Развлечения в Владивостоке,Сопка Орлиное гнездо,Alex P,5,"Лучшее место чтобы увидеть весь город. Видно оба моста,всю бухту Золотой Рог. Пешком идти минут 20 с улицы Светланской.",Опубликовано 10 августа 2016 г.
Дальневосточный округ,Приморский край,Владивосток,Развлечения в Владивостоке,Сопка Орлиное гнездо,Alex S,3,"Вот почему скажите мне, почему же это место нельзя обустроить? Периодически езжу во Владивосток по разным делам. Каждую поездку стараюсь посетить это место (очень хороший вид). Но, самое интересное, что в 2005 году это место выглядело намного лучше чем то во что оно превратилось в 2012 году.. Грязь и мусор очень портят впечатление от шикарного вида на Владивосток..",Опубликовано 17 ноября 2013 г.
Дальневосточный округ,Приморский край,Владивосток,Развлечения в Владивостоке,Сопка Орлиное гнездо,Alexander M,5,"Хоть днем, хоть ночью открывается лучший вид на город. Обязательно стоит забраться, лучше всего это сделать со стороны Нерчинской, дорога наверх за зданием Нерчинская 10. Обязательно захватите с собой приличную камеру. она пригодится.",Опубликовано 4 сентября 2014 г.
Дальневосточный округ,Приморский край,Владивосток,Развлечения в Владивостоке,Сопка Орлиное гнездо,Alexander15853,5,"Самая эффектная видовая площадка города. Так как город расположен на сопках, есть возможность увидеть большую его часть, забравшись, например, на Орлиную сопку. Можно на автобусе, но лучше всего доберитесь до остановки автобуса ""политехнический"" и там сядьте на фуникулер - это такой горный трамвайчик, не пожалеете!",Опубликовано 24 декабря 2013 г.
Дальневосточный округ,Приморский край,Владивосток,Развлечения в Владивостоке,Сопка Орлиное гнездо,AlexanderVDK2,5,"Одна из видовых нашего города. Всем обязательно к посещению. Особенно здорово там встречать рассвет, когда утренняя дымка застелает бухту золотой рог. И сонные машины уже едут по своим делам. Так же, как и рассветы - не менее прекрасны, летние вечера и заход солнца.

Ну и вообще, в любое время, в принципе, там красиво.",Опубликовано 24 марта 2016 г.
Дальневосточный округ,Приморский край,Владивосток,Развлечения в Владивостоке,Сопка Орлиное гнездо,Alexander_Kudrin,5,"Это место, которое нужно посетить для полного представления о Владивостоке. За 8 рублей (0,22 USD) на фуникулёре можно подняться на видовую площадку Орлиное гнездо, самую высокую точку исторической части города, откуда открывается потрясающий вид на город и бухту Золотой Рог. Можно сделать отличные фотографии и купить сувениры на любой вкус. Многие считают эту сопку мистическим ""местом силы"". Тут же находится часовня и памятник Кириллу и Мефодию. Это место очень популярно среди туристов и молодожёнов.",
Дальневосточный округ,Приморский край,Владивосток,Развлечения в Владивостоке,Сопка Орлиное гнездо,Alexandra Х,5,"Отличная обзорная площадка! Супер вид на Мост. Подыматься пешком очень высоко конечно, но оно того стоит. Хотя на машине можно подъехать достаточно близко, но прогулка подъем сами по себе приключение.
Красивые фото и днем и вечером. Но конечно лучше в солнечную погоду. Мы попали в туман.",
Дальневосточный округ,Приморский край,Владивосток,Развлечения в Владивостоке,Сопка Орлиное гнездо,Alexei K,5,"Отличное место для просмотра на золотой мост , место очень популярное для свадеб . У каждого жителя я думаю есть фотография с этого места с видом на мост",Опубликовано 27 февраля 2016 г.
Дальневосточный округ,Приморский край,Владивосток,Развлечения в Владивостоке,Сопка Орлиное гнездо,Alexey A,5,Отсюда город как на ладони ))) и мост ))) все видно))) я оттуда сделал очень много фото и видео ))) красивейшее место)))) заряжает энергией и положительными эмоциями на весь день )))) под вечер там классно находиться так как вечером город преображается и множество огней украшают город,Опубликовано 5 июня 2015 г.
Дальневосточный округ,Приморский край,Владивосток,Развлечения в Владивостоке,Сопка Орлиное гнездо,Alexey G,5,"С этого места Владивосток воспринимается по-другому. Ярко, во всей красе, всеми прелестями к Вам лицом. Бухта, мост, корабли, город, у Ваших ног. Обязательно поднимитесь и посмотрите!",
Дальневосточный округ,Приморский край,Владивосток,Развлечения в Владивостоке,Сопка Орлиное гнездо,Alexey K,4,"Виды хорошие, даже отличные, но место заброшено администрацией города и не организовано.
Разрушенные ступени, жуткого вида Кирилл и Мефодий из фильма про зомби.

Я не рассчитал маршрут с закатом и приехал рано для ночных фото, пришлось потом возвращаться на такси, потому что делать там нечего. Вспоминается смотровая в Афинах, где можно провести время в таверне прямо на месте за стаканчиком узо. Здесь же и поблизости ничего нет, чтобы скоротать час-полтора за бокалом пива или, на худой конец, чашкой кофе с корицей в тёплом помещении.",
Дальневосточный округ,Приморский край,Владивосток,Развлечения в Владивостоке,Сопка Орлиное гнездо,Alexey K,5,"Захватывающий вид на город, Золотой мост и бухту. На сопке расположена небольшая смотровая площадка, памятник Кириллу и Мефодию. С верхней станции фуникулера надо ещё немного подняться вверх.",Опубликовано 2 мая 2015 г.
Дальневосточный округ,Приморский край,Владивосток,Развлечения в Владивостоке,Сопка Орлиное гнездо,Alexey S,5,"Один из лучших видов центра города и бухты, правда, несколько шумно от трафика с огибающих площадку дорог.",Опубликовано 10 апреля 2014 г.
Дальневосточный округ,Приморский край,Владивосток,Развлечения в Владивостоке,Сопка Орлиное гнездо,Alexyanshin,5,"Великолепный Вид на весь город Владивосток и его залив, Золотой Роговой залив, и ближайшие острова",Перевод: PROMT
Дальневосточный округ,Приморский край,Владивосток,Развлечения в Владивостоке,Сопка Орлиное гнездо,Ana Zlender Tokuhisa,5,"Приятно иметь исторический монумент в том же месте как замки романтичной любви и захватывающий вид на море и моста, который стоит посетить обязательно.",Перевод: PROMT
Дальневосточный округ,Приморский край,Владивосток,Развлечения в Владивостоке,Сопка Орлиное гнездо,Anastasiia,5,"а Вы знаете откуда берутся все эти удивительные фотографии на фоне Золотого моста?
Как один из альтернативных вариантов: добраться по ул. Светланской, остановка ДВГТУ (напротив STREET BAR, кафе Хлопок, Republic и т.д.), поднимаетесь немного вверх, садитесь на фуникудер и едите вверх. Дальше через пешеходные переходы (вначале подземный, потом надземный) и попадаете на видовую площадку. И наслаждаетесь потрясающим видом на бухту! Солнечной вам погоды и отличных фотографий!:)

И еще, там есть хороший сувенирный магазин. Если ни хотите ничего покупать, зайдите просто пофотографироваться;)

п.с. Обязательно вернитесь на Орлинную сопку в темное время суток, чтобы полюбоваться ночным городом:)
и еще одна полезная информация - фуникулер работает до 20-00.",Опубликовано 28 марта 2014 г.
Дальневосточный округ,Приморский край,Владивосток,Развлечения в Владивостоке,Сопка Орлиное гнездо,Anastasiia404,5,Вид с этой сопки просто потрясающий. Сюда приезжают свадьбы и пары на романтические посиделки в машине. Можно долго стоять и любоваться. Красиво и днем и вечером и ночью),Опубликовано 19 июня 2016 г.
Дальневосточный округ,Приморский край,Владивосток,Развлечения в Владивостоке,Сопка Орлиное гнездо,Andrey G,5,"Одно из лучших мест, где открывается замечательный вид на ""Золотой"" мост. Советую посмотреть в темное время суток - красота!",Опубликовано 16 ноября 2013 г.
Дальневосточный округ,Приморский край,Владивосток,Развлечения в Владивостоке,Сопка Орлиное гнездо,Andrey K,4,"Могу рекомендовать для посещения.
Как минимум, гостям города, можно сделать несколько селфи с хорошим видом.)",Опубликовано 3 марта 2018 г.
Дальневосточный округ,Приморский край,Владивосток,Развлечения в Владивостоке,Сопка Орлиное гнездо,Andrey_Shilimanov,5,"Земля на вершине этой сопки выглядит весьма лакомым местом для застройщиков, однако там практически нет строений. А всё потому, что стратегические высоты с незапамятных времён принадлежат военным и предназначены для оборонительных точек.",Опубликовано 8 ноября 2013 г.
Дальневосточный округ,Приморский край,Владивосток,Развлечения в Владивостоке,Сопка Орлиное гнездо,Anna D,4,"Сопка ""Орлинное гнездо"" одно из самых романтичных мест города Владивостока. Вечерний город предстает как на ладони. Здесь можно сделать потрясающие фотографии. Рекомендую в качестве свадебного вояжа, прогулки с любимым человеком и в качестве визитной карточки города для приезжих друзей и родственников.",Опубликовано 8 июля 2015 г.
Дальневосточный округ,Приморский край,Владивосток,Развлечения в Владивостоке,Сопка Орлиное гнездо,Anna V,5,"Замечательная обзорная площадка, отличный вид обеспечен в любое время суток. Главное - немноголюдная, что приятно. Или просто нам так повезло) есть магазин с сувенирами.",Опубликовано 13 февраля 2017 г.
Дальневосточный округ,Приморский край,Владивосток,Развлечения в Владивостоке,Сопка Орлиное гнездо,Anna V,5,"Памятник и смотровая площадка в запущенном состоянии - всё ржавое, кое-где отсутствуют ограждения (следите за детьми), однако виды открываются чудесные.",Опубликовано 23 октября 2015 г.
