zone,region,city,att_type,att_name,author,rating,comment,comment_date
Дальневосточный округ,Приморский край,Владивосток,Развлечения в Владивостоке,Океанариум Аквамир,Maslik-Alena,2,"Ничего не изменилось там со времен моего детства... Океанариумом назвать сложно, особенно если ты хоть раз был в данном заведении за границей. Мы забежали погреться с ребенком, гуляя по набережной. Тусклый свет создает атмосферу угнетающую мне кажется. Бедные рыбы в этих крохотных аквариумах. А на тех, что плавают по узкому кругу, так вообще смотреть больно. ВОт это жизнь! Не развернуться даже, хоть чтоб в другую сторону плыть. Что у них там внутри аквариума не ясно, но места им просто катастрофически не хватает, что вызывает тупо жалость.
Вход 350р, ребенок у меня 3,5 года прошел бесплатно.",Опубликовано 1 апреля 2016 г.
Дальневосточный округ,Приморский край,Владивосток,Развлечения в Владивостоке,Океанариум Аквамир,NLegion,5,"Классический океанариум, есть рептилии и прочие... Все активно двигались, выглядят сытыми и ухоженными",
Дальневосточный округ,Приморский край,Владивосток,Развлечения в Владивостоке,Океанариум Аквамир,Nastya_vlad,4,"Океанариум в достаточно печальном совковом состоянии. Хотя посмотреть все же есть на что. довольно интересно. Но если вы были в современных и по-настоящему красивых океанариумах, то лучше, наверное, и не ходить) если только с детьми...",Опубликовано 14 апреля 2016 г.
Дальневосточный округ,Приморский край,Владивосток,Развлечения в Владивостоке,Океанариум Аквамир,Nick S,4,"несомненно, что китайские, малазийские и даже тайские океанариумы больше и красивее. Они изначально создавались по всем правилам туристических объектов, в то время как наш - классический морской музей, как он и задумывался в 90-е.
Несомненно, что обновление фасада и реконструкция значительно улучшили его облик, важно и то, что сам по себе океанариум является обязательным атрибутом любого серьезного туристического и культурного центра. Это радует.
Мы были в океанариуме большой компанией, с детьми, и конечно все были в восторге от осетровых, кружащих в центре зала, от большого осьминога и каракатиц, но дети, у которых оказался фотоаппарат, как потом выяснилось пересняли всю экспозицию музея, с его экспонатами))
Цена билета невысока (вроде бы около 300 р.), к тому же, учреждение стало активно включаться в программы, по которым предлагаются скидки на посещение.
Остается надеяться, что задуманный на Русском океанариум учтет весь опыт этого и будет сделан качественно и красиво.",Опубликовано 4 октября 2014 г.
Дальневосточный округ,Приморский край,Владивосток,Развлечения в Владивостоке,Океанариум Аквамир,OLiya У,3,"Океанариум не очень большой, особо и не затратишь времени на просмотр. Хотя, если это в первый раз,возможно,впечатлит новичков. Были давно,может быть,что-то изменилось.",Опубликовано 4 мая 2015 г.
Дальневосточный округ,Приморский край,Владивосток,Развлечения в Владивостоке,Океанариум Аквамир,Oleg6510,3,"Слово океанариум слишком громкое для этой аквариальной. Но в целом посещение людей, у которых в городе нет таких заведений будет полезным и скрасит это время.",Опубликовано 6 июля 2015 г.
Дальневосточный округ,Приморский край,Владивосток,Развлечения в Владивостоке,Океанариум Аквамир,Olyawhale,1,"Жалко рыбу стало, условия у них не лучшие на вид, не везде есть надписи о рыбах в аквариуме. Старый и дорогой океанариум.",Опубликовано 23 апреля 2014 г.
Дальневосточный округ,Приморский край,Владивосток,Развлечения в Владивостоке,Океанариум Аквамир,Pavel_Chepurkov,2,"В Океанариуме я был несколько раз, и каждый раз с промежутком в 5 - 10 лет. И в каждое посещения я видел одни и те же макеты, одни и те же аквариумы, одни и те же экспонаты. Вот только живности каждый раз становилось меньше. Возможно в юности в советском союзе это и производило впечатление, но сейчас посмотрев океанариумы в других странах, я понял что Владивостокский океанариум уныл, сер и скучен. Мне было бы стыдно приглосить в него иностранцев которых я иногда экскурсирую по Владивостоку",Опубликовано 26 марта 2013 г.
Дальневосточный округ,Приморский край,Владивосток,Развлечения в Владивостоке,Океанариум Аквамир,PazzaB,1,"Очень скудный и плохой интерьер. Плохая особая выставка подводной флоры и фауны... Невоспитанное поведение персонала. Есть кофеварки возле туалета и в том же месте рядом с туалета, чтобы выпить вас бронируйте его (был шаг шагах стреляющий - прямо на месте! ). Администратор отсутствующий, все работает месте все время. Все развлечения нацеливались на торговлю океанария, продажу сувениров с фантастическими ценами. Извините за деньги, потратить время, и это подпортило сувенирный магазин скотный рабочего настроения",
Дальневосточный округ,Приморский край,Владивосток,Развлечения в Владивостоке,Океанариум Аквамир,Petrovich55,5,"Был здесь с дочкой 4х лет, не мог остановить только и было слышно папа мосмотри это ...... а это ..... особенно поразил огомный аквариум с осетровыми, решили сходить еще так как уверен ноловину экспонатов пробежали.",Опубликовано 1 марта 2014 г.
Дальневосточный округ,Приморский край,Владивосток,Развлечения в Владивостоке,Океанариум Аквамир,PhilipBALL,2,"Это аквариум, но маленький нравится аквариум. Без особенным рыбам внутри, и всего лишь не нужен около 5-10 минут, чтобы обойти весь.350 рублей на взрослого.Может быть это самый маленький аквариум в мире.",
Дальневосточный округ,Приморский край,Владивосток,Развлечения в Владивостоке,Океанариум Аквамир,Primorskiy,2,"Чувство укачивание не покидает даже еще полчаса после выхода (морской болезнью не болею) СОВОК - вот это общая оценка этого океанариума. Печаль и разочарование - чувство и настроение соответствующие посещению. Радость - после выхода- жизнь продолжается. Ровно на один раз. Ожидание, что новый океанариум будет лучше.",Опубликовано 17 января 2014 г.
Дальневосточный округ,Приморский край,Владивосток,Развлечения в Владивостоке,Океанариум Аквамир,RK3006,2,"Я до многих аквариумам и, к сожалению, это, вероятно, худший я к. Это стоит примерно 7.50 долларов на человека, чтобы войти и если вы не свое время, то вы, вероятно, провели бы максимум в час там...Вы платите в мертвый кассире напротив здания, который дает вам квитанцию, что они просто снимают вас, как только вы входите, возможно, приблизительно 30 резервуаров с другой рыбой в них, которые действительно не описано на русском языке, не говоря уже о на английском языке. Выставки рыбы не очень хорошие, и все это место очень темное внутри. Кажется, нет ничего в нем, что делает его особенном стоит посещения.Есть музей некоторые лестница с примерами пляжных разновидностей и есть 4 магазина, продающие разные блюда, что для маленького аквариума - это просто смешно, fells как аквариум потратил больше денег на магазины, чем он есть на рыбы.Мой вид - то, что есть дела увидеть во Владивостоке, поэтому, если вы не попадаете сразу нечего делать, и им, то я бы не стал прилагать усилия, чтобы поехать туда.",
Дальневосточный округ,Приморский край,Владивосток,Развлечения в Владивостоке,Океанариум Аквамир,Ribka,1,"Многие смотрю добавили сюда ошибочные фото с другого океанариума с острова Русский!!! Это про океанариум на набережной, старый, маленький и отвратительный!! смотрите внимательней место расположения прежде чем писать отзывы!!!",Опубликовано 3 октября 2016 г.
Дальневосточный округ,Приморский край,Владивосток,Развлечения в Владивостоке,Океанариум Аквамир,SANVkhv,3,"Сходить конечно сходите, тем более если с детьми. Но в целом и виды не те и рыбёшек маловато. Но возможно сейчас туда не вкладываются, тк планируется открытие огромного океанариума на о Русский.",Опубликовано 5 декабря 2014 г.
Дальневосточный округ,Приморский край,Владивосток,Развлечения в Владивостоке,Океанариум Аквамир,Sardana U,5,"Я просто в восторге! Ты погружаешься в водный мир, отдыхаешь душой и узнаешь много нового. Вначале мы заинтересовались осьминогом, он такой красивый оказывается! А дальше - больше. Огромные рыбы, медленно плывущие в воде, страшные пираньи, которых помним по фильмам, маленькие, забавные водные черепашечки... сходите, это круто!",Опубликовано 10 декабря 2015 г.
Дальневосточный округ,Приморский край,Владивосток,Развлечения в Владивостоке,Океанариум Аквамир,Sergei F,1,"Закройте данное помещение и не позарьтесь, все на столько убого стало что аж обидно. Старый ремонт, заходишь как будто в машину времени, на улице 21век, а в океанариуме 20,",Опубликовано 10 марта 2017 г.
Дальневосточный округ,Приморский край,Владивосток,Развлечения в Владивостоке,Океанариум Аквамир,Sergey R,5,"Начитались отзывов и хотели не посещать это место, но все-таки решились, и не зря!!! Место замечательное, цена приемлемая, дети, да и мы тоже остались в восторге. Все рассказали, показали. Обязательно приедем ещё сюда. Спасибо за проведенную экскурсию Сергей Ивановичу!",Опубликовано 29 марта 2021 г.
Дальневосточный округ,Приморский край,Владивосток,Развлечения в Владивостоке,Океанариум Аквамир,Serh50,3,"Здание небольшое, как и аквариумы. Примерно тоже, что и в Сочи в Дендрариуме. Для слова Океанариум я ожидал большего количества океанских рыб, а так обычный набор.",Опубликовано 29 августа 2014 г.
Дальневосточный округ,Приморский край,Владивосток,Развлечения в Владивостоке,Океанариум Аквамир,Stepan A,3,"Посетили с семьей океанариум г.Владивостока после того как побывали в нескольких Азиатских океанариумах, сравнивать не приходится... хотя с детьми, для общего развития рекомендую посетить данное заведение.",Опубликовано 27 октября 2014 г.
Дальневосточный округ,Приморский край,Владивосток,Развлечения в Владивостоке,Океанариум Аквамир,Sviol,2,"Этот океанариум давно требовал реставрации, а после открытия нового на о. Русском все больше приходит в упадок(( Не знаю как сейчас, но даже продажа билетов по безналу в прошлом году не работала. А ведь здесь есть и яркие тропические рыбки, и огромные осетры в циллиндрическом аквариуме, и чучела морских животных и птиц, и учебные мероприятия для школьников. Но помещение небольшое, темноватое и требующее основательной переделки (как впрочем и практически вся Набережная) или даже смены направления деятельности, ведь это здание находится в самом прогулочном месте города.",Опубликовано 12 мая 2018 г.
Дальневосточный округ,Приморский край,Владивосток,Развлечения в Владивостоке,Океанариум Аквамир,Svitlana,2,"Данный ""океанариум"" должен называться Аквариум ""Аквамир"" и плата за вход вдвое дешевле должна быть. Самые обыкновенные рыбки ( за исключением больших осетров ), экспозиция мала и скудна плюс небольшой террариум , состоящий из крокодила, двух змей и пяти ящериц. Таких аквариумов почти в каждом городеможно найти , но дешевле и приятнее обстановка. Извините , конечно , но разочарование полное - грязные стекла, нет табличек ( либо находятся сбоку и в темноте невозможно прочесть названия рыб, унылые декорации и пустые аквариумы , занавешаны проходы ( где видимо складируют что-то ).. туалет это вообще просто Позор ! Дорогой магазин- лавка , в котором сидит хамоватая продавец. Вобщем после посещения этого места неприятный осадок . Весь осмотр экспозиции занял 20 минут максимум , настолько мала она .Коль уж назвались ""океанариумом "" - приведите в соответствие это заведение . Я не советую никому здесь тратить деньги , а лучше добавить и посетить океанариум на о.Русский - он достойный и дарит массу приятных впечатлений .",Опубликовано 16 июля 2020 г.
Дальневосточный округ,Приморский край,Владивосток,Развлечения в Владивостоке,Океанариум Аквамир,TATIANA K,5,"Океанариум находится на Спортивной набережной, здание очень приметное. Стоимость билетов для взрослых 250 рублей,детям 150 рублей. Работает без выходных.
Очень большое разнообразие рыб и морских гадов, есть даже крокодил. На втором этаже морской музей разных сушеных и заспиртованных морских жителей, даже есть китовые вши. В такие места очень интересно и познавательно ходить с детьми, да и взрослым очень интересно.
Рядом с океанариумом есть небольшой парк аттракционов, рестораны.",Опубликовано 16 декабря 2013 г.
Дальневосточный округ,Приморский край,Владивосток,Развлечения в Владивостоке,Океанариум Аквамир,Tatyana5011,3,"Мы с мужем жители Владивостока, родились и выросли в этом городе, океанариум построился и заработал на наших глазах, сюда мы гордо водили своих детей и гостей города...не были 2 года, в последний раз шла какая то реконструкция с лева, там где была диарама птичий базар с моржами и морскими котиками....радостно подумали, что будет свежая красивая панорама, а ....вчера увидели на этом месте бутики....и везде одни бутики, просто не океанариум, а торговый дом......прям плакать хотелось от скудности экспозиций....куда делись дивные тропические рыбки? Аквариум с актиниями почти пуст....какая была красотища!( Куда делось столько интересных рыб и представителей океанов? Продали в частные аквариумы или все это богатство погибло? Зияющие пустые аквариумы....как разрушенные дома....",Опубликовано 31 марта 2013 г.
Дальневосточный округ,Приморский край,Владивосток,Развлечения в Владивостоке,Океанариум Аквамир,Tokaev,4,Забрели сюда случайно но очень понравилось и нисколько не пожалели! В разных аквариумах много всякой живности.За час или полтора можно все не спеша посмотреть.Я считаю что фотоаппарат тащить в этот музей не стоит но это мое мнение. В любом случае это интересная достопримечательность Владивостока!,
Дальневосточный округ,Приморский край,Владивосток,Развлечения в Владивостоке,Океанариум Аквамир,VIK237,4,"Повезет, если придете к кормлению. Очень интересно посмотреть. В большом зале довольно темно, да и стекла запотевают, фотографии получаются не очень. Но детям нравится, да и взрослым любопытно.",Опубликовано 16 июля 2014 г.
Дальневосточный округ,Приморский край,Владивосток,Развлечения в Владивостоке,Океанариум Аквамир,Vasin_official,2,"Посетили семьей (Жена, я и маленький ребенок 1 годик и 3 месяца) океанариум. Если честно, то были разочарованы. Несмотря на близость к морю и, по идее, к морским обитателям, большинство экспонатов пластмассовые. Кол-во рыбок, черепашек и т.д. очень маленькое.

Вдоль и поперек обойти можно всё за 30 минут.

Вывод: если Вам доводилось посещать любой другой океанариум, то в данном месте Вы вряд ли откроете для себя что - нибудь новое.",Опубликовано 24 октября 2014 г.
