Дальневосточный округ,Сахалинская область,"Сахалин,Южно-Сахалинск",Развлечения в Южно-Сахалинске,"Спортивно-туристический комплекс ""Горный воздух""",Ivan K,5,"С каждым годом комплекс становится все лучше и лучше и вместе с этим очередь на подъемники все прибавляется и прибавляется. Каждый год добавляют новые трассы. В новом сезоне должны запустить систему искусственного оснежения трасс, что позволит раньше начинать горнолыжный сезон. На южном склоне канатная дорога работает только в выходные дни.",Опубликовано 24 октября 2013 г.
Дальневосточный округ,Сахалинская область,"Сахалин,Южно-Сахалинск",Развлечения в Южно-Сахалинске,"Спортивно-туристический комплекс ""Горный воздух""",Ivan O,5,"Здравствуйте! Поделюсь впечатлением от посещения горного воздуха в Южно- Сахалинске, был в будний день и меня порадовало, что было не очень людно на склонах и очередей на подъем нитки не было. Понравился вид сверху. Действительно когда поднимется открывается великолепный пейзаж. Посещая какое либо место город страну я старюсь посетить какое либо высокое место и увидеться панораму сверху, это очень красиво. Складывается определенное впечатление о посещаемом месте. Горный воздух мне понравился и тем что трассы в хорошем состоянии. Конечно цена на покат лыж высока, но впечатления которые получить можно покатавшись того стоят. Рекомендую!",Опубликовано 7 ноября 2013 г.
Дальневосточный округ,Сахалинская область,"Сахалин,Южно-Сахалинск",Развлечения в Южно-Сахалинске,"Спортивно-туристический комплекс ""Горный воздух""",IvanSPb1982,5,Свежий воздух и красивый вид ! для прогулок и отдыха супер ! Можно и прокатиться по канатной дороге и пешочком погулять !!!,Опубликовано 12 августа 2014 г.
Дальневосточный округ,Сахалинская область,"Сахалин,Южно-Сахалинск",Развлечения в Южно-Сахалинске,"Спортивно-туристический комплекс ""Горный воздух""",JacobXI,5,"На этот раз мы поднимались на гору гондолой, которая очень дешевая в 200rb / человек. Мы решили идти налево от лифта, который оказался самое крутое приличное возможное. Тем не менее, красивый и есть много различной зелени вокруг. Когда вы хотите иметь более спокойное, подходят или вниз на вулкан, я бы предложил взять путь, который идет в прямо с видом из лифта.Мы не взяли на полпути кафе, но это оказалось очень появляющимся. катание на велосипедах вверх и вниз по горе сделано довольно много, мы видели, однако, поднимаясь на горе, вам нужен очень хорошие ноги, чтобы преодолеть крутые дороги (до 16%).В целом, думаю, очень хороший способ провести прекрасный день.",Перевод: PROMT
Дальневосточный округ,Сахалинская область,"Сахалин,Южно-Сахалинск",Развлечения в Южно-Сахалинске,"Спортивно-туристический комплекс ""Горный воздух""",JamesStu,5,"Я также посетить сюда сноубординг после работы.Фантастическое место, отличные владельцев и восхитительный порошок.Ночной свет времени фантастический.Покататься фуникулера огромные.Немного доступных кафе.Всего в 5 минутах от города.Очень рекомендую его, если вы думаете об этом",Перевод: PROMT
Дальневосточный округ,Сахалинская область,"Сахалин,Южно-Сахалинск",Развлечения в Южно-Сахалинске,"Спортивно-туристический комплекс ""Горный воздух""",JuLLSS,5,"В подъемниках очень тепло и безопасно, присутствует шумоизоляция. Можно наслаждаться великолепными видами на город и лыжные трассы. Очень отзывчивый персонал, помогут, улыбнутся. В кафе на вершине можно выпить горячий вкуснейший глинтвейн, любуясь на Южно-Сахалинск с высоты птичьего полета или погреться у камина.",Опубликовано 29 января 2014 г.
Дальневосточный округ,Сахалинская область,"Сахалин,Южно-Сахалинск",Развлечения в Южно-Сахалинске,"Спортивно-туристический комплекс ""Горный воздух""",Julie V,5,"отличная горнолыжка. недешево правда, но оно того стоит. отличные подъёмники, всегда есть снег. масса трасс. любимая - серпантин. довольно лёгкая, жаль, что такая только одна. в праздники на НГ и на 8 марта народу нереально много ((( очередь на подъёмник гигантская!
в остальном - супер. и теплушка и прокат - всё рядом!",Опубликовано 19 июня 2014 г.
Дальневосточный округ,Сахалинская область,"Сахалин,Южно-Сахалинск",Развлечения в Южно-Сахалинске,"Спортивно-туристический комплекс ""Горный воздух""",K_Malachite,5,"Обязательное для посещения место, на которое можно подняться по удобной современной гондольно-кресельной канатной дороге. Шикарный вид на панораму города. Чистый воздух и красивые пейзажи.",
Дальневосточный округ,Сахалинская область,"Сахалин,Южно-Сахалинск",Развлечения в Южно-Сахалинске,"Спортивно-туристический комплекс ""Горный воздух""",Kainat1108,5,"Отличный горнолыжный комплекс с кучей прокатов, горок, кафешек и школ для обучения лыжам и сноубордингу. Ездим каждый год и Владивостока с детьми уже третий год.
Персонал очень отзывчивый и приятный.
Рекомендую 👍🏽",
Дальневосточный округ,Сахалинская область,"Сахалин,Южно-Сахалинск",Развлечения в Южно-Сахалинске,"Спортивно-туристический комплекс ""Горный воздух""",Kaplan_off,5,"Прекрасное место с видом на город Южно-Сахалинск! Чтобы получить полное впечатление, стоит подняться на Горный воздух пешком, это займет минут 45-50, а потом спуститься на фуникулере. Если Вы любитель горных лыж или сноуборда - Вам сюда!",Опубликовано 8 октября 2015 г.
Дальневосточный округ,Сахалинская область,"Сахалин,Южно-Сахалинск",Развлечения в Южно-Сахалинске,"Спортивно-туристический комплекс ""Горный воздух""",Karmado,3,"Трассы разной сложности, современные подъёмники, отличные покатушки! Но!! Это когда есть снег. В этом году снега нет, все печально, работают 2,5 трассы из 9. Сделали новый подъёмник на гору Красную и новые трассы, но все это дело ещё не работает, с Зимы 2018 года грустит в ожидании горнолыжников. С обновлением системы иссккственного оснежения примерно то же самое, старая уже не работает а новую ещё не сделали. Ждём снег с которым в этом году явные проблемы. Из плюсов это куча детских горнолыжных школ с хорошими инструкторами и все это в шаговой доступности от гостиниц.",Опубликовано 12 февраля 2019 г.
Дальневосточный округ,Сахалинская область,"Сахалин,Южно-Сахалинск",Развлечения в Южно-Сахалинске,"Спортивно-туристический комплекс ""Горный воздух""",Katerina T,4,Отличное место для катания! Были на Сахалине два раза. В первый раз катались только на городухе а во второй как более опвтные пошли на горный воздух. Очень понравилось! Ночью подсветка трассы изумительная!!),Опубликовано 10 января 2015 г.
Дальневосточный округ,Сахалинская область,"Сахалин,Южно-Сахалинск",Развлечения в Южно-Сахалинске,"Спортивно-туристический комплекс ""Горный воздух""",Kir Sanchez,5,"Приехали на Сахалин всего на 4 дня только ради канатной дороги и знаменитого сахалинского молока. К сожалению, из-за непогоды канатная дорога не работала... Тем не менее мы решили хотя бы спуститься по ней вниз на ремнях, как Том Круз. Начали искать путь наверх. Для этой цели была выбрана экотропа ""Детская"" (около 3 км), раскинувшаяся по заснеженному хребту. Дорога до неё на такси по серпантину меж чудесного зимнего леса уже зародила сомнения. А само восхождение окончательно убедило, что мы не в фильме с Крузом, а в Ледниковом периоде 2: раскинувшаяся панорама города представляет собой чашу, которую скоро затопит растаявший снег, а мы голодные грифы. Однако то, что мы одолели лишь половину пути вернуло нас в Mission Impossible:)
Чедесное место, вернёмся когда будет теплее!",
Дальневосточный округ,Сахалинская область,"Сахалин,Южно-Сахалинск",Развлечения в Южно-Сахалинске,"Спортивно-туристический комплекс ""Горный воздух""",Kleo_nika,5,"Ездили на ""Горный воздух"" в Рождество. Качество трасс изумительное, уровень комплекса на высоте. На территории есть несколько подъемников: снизу до середины горы и с середины на самый верх. Проход на подъемники осуществляется по карточкам, которые заблаговременно покупаются в кассе, на карту можно положить любую сумму. Есть несколько кафе, где можно вкусно перекусить и погреться. Также можно нанять инструктора и взять в прокат снаряжение.
А какой с горы изумительный вид, особенно в вечернее время, когда город сияет огоньками!",
Дальневосточный округ,Сахалинская область,"Сахалин,Южно-Сахалинск",Развлечения в Южно-Сахалинске,"Спортивно-туристический комплекс ""Горный воздух""",KomarDI,4,"Извините, но кроме вида на город ничего сказать не могу, т.к. был здесь в августе. Есть канатная дорога с уютными кабинками.",Опубликовано 29 августа 2016 г.
Дальневосточный округ,Сахалинская область,"Сахалин,Южно-Сахалинск",Развлечения в Южно-Сахалинске,"Спортивно-туристический комплекс ""Горный воздух""",Konstanitn T,5,"Известный горнолыжный курорт. Прекрасное место, чтоб летом погулять, а зимой покататься на лыжах! Снизу в гору можно добраться на фуникулёре.",Опубликовано 31 октября 2014 г.
Дальневосточный округ,Сахалинская область,"Сахалин,Южно-Сахалинск",Развлечения в Южно-Сахалинске,"Спортивно-туристический комплекс ""Горный воздух""",Konstantin Chernavin,5,"К сожалению, было мало времени, чтобы оценить весь сервис. Потрясающие виды на город, разнообразный набор трасс, великолепные подъемники, разумные цены. Кафе на верхней точке было закрыто, но на среднем уровне можно было неплохо перекусить. Рад за сахалинцев и гостей данного курорта.",Опубликовано 5 апреля 2015 г.
Дальневосточный округ,Сахалинская область,"Сахалин,Южно-Сахалинск",Развлечения в Южно-Сахалинске,"Спортивно-туристический комплекс ""Горный воздух""",Konstantin S,4,"Сноубординг поездки в Сахалин. Гора отличная. Довольно хорошая альтернатива более дорогим курортам. Определенно рекомендую всем, кто живет в восточной части России. Но не ожидайте тот же уровень обслуживания как Хоккайдо или швейцарские Альпы.Весело провести время",
Дальневосточный округ,Сахалинская область,"Сахалин,Южно-Сахалинск",Развлечения в Южно-Сахалинске,"Спортивно-туристический комплекс ""Горный воздух""",Kote_rider,5,"Пока был в командировке - поймал шанс прокатиться на лыжах. Первый раз завернули, т.к. забыл с собой паспорт, а без документов они на прокат ничего не выдают.
Зато на следующий день накатался гот души! Подъёмники и трассы классные, всё работает, все радуются, воздух чистый и свежий, вид красивый... Просто сказка :)",Опубликовано 27 февраля 2014 г.
Дальневосточный округ,Сахалинская область,"Сахалин,Южно-Сахалинск",Развлечения в Южно-Сахалинске,"Спортивно-туристический комплекс ""Горный воздух""",Kriss_Comatose,5,"Не первый год катаюсь на Горном. Каждый раз, когда бываю на Сахалине зимой, весь отдых провожу, катаясь там. Пропустив пару сезонов и приехав в феврале 2014 года сюда, с радостью обнаружила новые трассы, доступные для абсолютно разных уровней катания. Динамо, трасса имеющая черные части, для уверенно катающихся. А на новом серпантине могут кататься как новички, так и более продвинутые. На серпантине можно расслабиться и наслаждаться красивыми видами вокруг, так как скорость там небольшая, а дорога долгая:) Южный склон - это еще одна трасса, которая мне очень нравится. На ней есть части и посложней и попроще, а внизу у подъемника очень живописно, так как располагается вся эта красота в низине, и вокруг сопки и лес. Рассказывать о Горном можно до бесконечности, но лучше увидеть и затестить это собственными глазами и ногами на сноуборде или лыжах :)",Опубликовано 19 февраля 2014 г.
Дальневосточный округ,Сахалинская область,"Сахалин,Южно-Сахалинск",Развлечения в Южно-Сахалинске,"Спортивно-туристический комплекс ""Горный воздух""",Kristina S,5,"На горном воздухе можно отдохнуть душой. Зимой здесь масса людей катаются на лыжах и сноубордах, там же можно взять все необходимое на прокат. на самом вержу виден весь город как на ладони, особенно красиво вечером.
Изумительное место на планете.",Опубликовано 28 февраля 2014 г.
Дальневосточный округ,Сахалинская область,"Сахалин,Южно-Сахалинск",Развлечения в Южно-Сахалинске,"Спортивно-туристический комплекс ""Горный воздух""",Ksenia78,5,"Все отлично! Персонал очень дружелюбный, все готовы помочь. Трассы прекрасные. С едой тоже проблем не возникало",Опубликовано 11 марта 2018 г.
Дальневосточный округ,Сахалинская область,"Сахалин,Южно-Сахалинск",Развлечения в Южно-Сахалинске,"Спортивно-туристический комплекс ""Горный воздух""",Lanfir777,5,"Качество склонов оценить не могу, так как поднималась на гору ради красивых видов. Могу сказать только что база удобно оборудована для любителей покататься начиная от камер хранения и магазина экипировки на входе, до кафе на вершине.
Кабинки на подъемнике двух типов: открытые на 6 человек для лыжников и закрытые для тех кто может зайти в кабинку на своих двоих. Закрытые кабинки оборудованы подставками под лыжи/сноуборд.
С вершины открывается замечательный вид на сам город и на горы вокруг. Так что советую посетить горнолыжку даже тем, кто не хочет кататься.",Опубликовано 13 февраля 2019 г.
Дальневосточный округ,Сахалинская область,"Сахалин,Южно-Сахалинск",Развлечения в Южно-Сахалинске,"Спортивно-туристический комплекс ""Горный воздух""",Larisa G,1,"Прилетаю отдыхать на «Горный воздух» не первый раз! Сегодня крайне неприятно было обнаружить отсутствие сидячих мест в зале для переобувания. Всегда здесь стояли скамеечки, диванчики, было очень приятно и удобно. Присела на единственную лавочку, которая находилась между стойками, так налетели работники проката во главе с администратором Григорьевой Анной, чуть ли из-под меня не выдергивали единственную скамейку и утверждали, что я зашла за стойку кассы. Хотя я находилась между стойками, никаких ограничений, кроме орущих работников не было. Попросила книгу отзывов, сказали, что ее забрал на проверку бухгалтер, которая в декрете.
Ни одной запрещающей надписи в зале нет, что нельзя проходить или нельзя переобуваться, но целая группа неклиентоориентироаанных работников, пожалуйста. Изначально сегодня я пришла в сервисный центр, т.е. я была клиентом данного пункта. Парень все объяснил по лыжам, рассказал, спасибо ему огромное, но вот вечер был испорчен налетевшим персоналом. Неприятно!
Планировала взять кабинку, чтобы оставить сумку с ботинками, но после такого отношения расхотелось.",
