Дальневосточный округ,Приморский край,Владивосток,Развлечения в Владивостоке,Сопка Орлиное гнездо,Pavel_Chepurkov,5,"Отличная видовая точка, с которой открывается обзор на половину города и его островной части. Здесь можно встретить толпы молодоженов, т.к. это является основным местом их паломничества в день свадьбы. А так же иностранцев обозревающих портовый город. На видовой точке, несколько лет назад поставили памятник Кириллу и Мефодию, основателям азбуки кириллицы, так же в комплексе можно найти арку желаний. Многие студенты проходили через нее не один раз во время сессии, пользуясь её услугами. С центра до этого места можно добраться за 12 минут на автобусе, либо за 20 на автобусе и фуникулере",Опубликовано 26 марта 2013 г.
Дальневосточный округ,Приморский край,Владивосток,Развлечения в Владивостоке,Сопка Орлиное гнездо,Perepituja,5,"С сопки открывается отличный вид на Владивосток, особенно красиво вечером! Однако похоже, что скоро ее совсем застроят:(",Опубликовано 14 февраля 2014 г.
Дальневосточный округ,Приморский край,Владивосток,Развлечения в Владивостоке,Сопка Орлиное гнездо,Piralex,5,"Отличный вид на город даже в пасмурную погоду. Советую взять теплые вещи, ветра тут сильные. Если придёте вечером тоже не разочаруетесь, город неплохо подсвечен. Только вот лестницы на подъем сюда сильно разбиты, будьте осторожны.",
Дальневосточный округ,Приморский край,Владивосток,Развлечения в Владивостоке,Сопка Орлиное гнездо,Professional-Pilgrim,4,"Целый день ясный, у вас будет хороший вид на VVO, особенно залив, со всеми судами в порту. Еще есть хорошо снабженный сувенирный магазин, но ничего особенного. Люди, смотрящие, также хорошие. Носите теплую одежду, если вы идете туда зимой.",Перевод: PROMT
Дальневосточный округ,Приморский край,Владивосток,Развлечения в Владивостоке,Сопка Орлиное гнездо,Ptzat0769,5,"Вид на бухту золотой Рог, весь город как на ладони. Можно насладившись видами на город, мост на остров Русский, прокатиться потом на Фуникулере и оказаться в старинном Университете. Ранее ДВПИ.",Опубликовано 29 мая 2015 г.
Дальневосточный округ,Приморский край,Владивосток,Развлечения в Владивостоке,Сопка Орлиное гнездо,RUFinder,3,"До смотровой площадки добираться удобнее на фуникулере или на машине. Красивый вид на бухту Золотой Рог, старую часть города, строящийся мост через бухту.",Опубликовано 23 июля 2012 г.
Дальневосточный округ,Приморский край,Владивосток,Развлечения в Владивостоке,Сопка Орлиное гнездо,Real555,5,"Хорошее меню, предупредительный персонал, приятная атмосфера и прекрасные панорамные виды!",Опубликовано 13 июня 2012 г.
Дальневосточный округ,Приморский край,Владивосток,Развлечения в Владивостоке,Сопка Орлиное гнездо,Robert B,4,"Я могу только описать его, день я пошел, это хорошая прогулка в гору, чтобы добраться туда, но когда вы приедете, прекрасный вид из окна. День я приехал, я забыл свой кулак, невероятно стоит транспорта",Перевод: PROMT
Дальневосточный округ,Приморский край,Владивосток,Развлечения в Владивостоке,Сопка Орлиное гнездо,Roman Gots,5,"Там и обзорная площадка, и фуникулер наверх, и замки молодеженов, чего только нет. Лучшее фото моста: на заре:)",Опубликовано 4 апреля 2014 г.
Дальневосточный округ,Приморский край,Владивосток,Развлечения в Владивостоке,Сопка Орлиное гнездо,Romanver В,5,"Самое ветреное место в ветреном городе. Зимой пальцев хватает на несколько снимков, потом замерзают. Ветер выжимает слезу. А местные сидят на лавочках прямо на вершине, любуются зимним закатом. Обычно под названием Орлиное Гнездо понимают смотровую площадку над фуникулёром, но собственно вершина расположена дальше. И выше, на 199 м над уровнем моря. Есть лесок из корявого дуба. У его нижнего края построили двадцатипятиэтажки, которые малость загородили вид на город, но хуже, что они на несколько этажей выше самой вершины, чем немного ущемили её достоинство. На западном предвершинном склоне есть маленькая гостиница ""Шале"". На восточном склоне - переливающаяся и блистающая огнями телевышка.",
Дальневосточный округ,Приморский край,Владивосток,Развлечения в Владивостоке,Сопка Орлиное гнездо,SVB89825,5,"Сопка Орлиное гнездо - лучшая смотровая площадка Владивостока, проверено! Смотрите фотографии и наслаждайтесь, а если будет возможность, приезжайте и смотрите воочию.",
Дальневосточный округ,Приморский край,Владивосток,Развлечения в Владивостоке,Сопка Орлиное гнездо,S_Violetta_S,5,"Открывается просто шикарный вид на город. Стоишь смотришь и дух захватывает. Советую посетить, главное не попасть в туман, а то не видно ничего)",Опубликовано 2 августа 2018 г.
Дальневосточный округ,Приморский край,Владивосток,Развлечения в Владивостоке,Сопка Орлиное гнездо,Savchenko Pavel,5,"Прекрасное место, с великолепным видом на бухту Золотой Рог и Золотой мост. Особенно красиво рано утром или ночью, когда загораются огни!",
Дальневосточный округ,Приморский край,Владивосток,Развлечения в Владивостоке,Сопка Орлиное гнездо,Schreibikus007,4,"Сюда можно подняться на фуникулёре. Отсюда открывается отличный вид на бухту Золотой рог и на новый вантовый мост.
Из минусов - место явно нуждается в реставрации и окультуривании.",Опубликовано 15 сентября 2019 г.
Дальневосточный округ,Приморский край,Владивосток,Развлечения в Владивостоке,Сопка Орлиное гнездо,Sergey A,5,"Вид, что открывается с вершины этой сопки просто завораживает. А по темноте, этот вид просто прекрасен. Ночь, а под тобой уйма разноцветных огней жилых районов этого чудесного города--Владивостока . Золотой Рог отливает синевой. Военные и гражданские корабли также стоят все в огнях. Душа тает и наслаждается этой красотой.
Я люблю свой город, я люблю эту сопку.",Опубликовано 15 декабря 2015 г.
Дальневосточный округ,Приморский край,Владивосток,Развлечения в Владивостоке,Сопка Орлиное гнездо,Sergey M,4,Отличный вид ! Очень хорошо виден золотой мост и где-то далеко даже мост на остров русский ! Ставлю 4 потому что очень плохо облагорожено и ржавая сетка сразу перед смотровой площадкой ! Почините её ! А так всё хорошо!,Опубликовано 14 июля 2016 г.
Дальневосточный округ,Приморский край,Владивосток,Развлечения в Владивостоке,Сопка Орлиное гнездо,Sergey R,5,"Очень проблематично добраться туда, так как сейчас там идёт ремонт объекта и все огорожено, НО при большом желании туда можно попасть. Вид неописуемый, лучше один раз увидеть чем сто раз услышать. Не пожалеете.",Опубликовано 29 марта 2021 г.
Дальневосточный округ,Приморский край,Владивосток,Развлечения в Владивостоке,Сопка Орлиное гнездо,Sersh_83,1,"Очень надеюсь, что хоть сюда иногда заглядывают чиновники администрации города Владивостока и читают отзывы об одной из главный смотровых площадок города. Так как я сильно сомневаюсь, что они там были в живую.
Со смотровой площадки открывается просто потрясающий вид на бухту Золотой Рог и Золотой мост. НО смотровая площадка и дорога на неё находятся в ужасном состоянии. Всё поросло метровой травой, заборы сржавели, всюду мусор и грязь. При этом площадка явно пользуется популярностью, туда ходят толпы туристов (в основном китайцев) и при грамотном подходе эта достопримечательность могла бы приносить доход городу и местным предпринимателям.
В общем, впечатление после посещения этого места удручающее....",
Дальневосточный округ,Приморский край,Владивосток,Развлечения в Владивостоке,Сопка Орлиное гнездо,Severelf,5,"Смотровую площадку, где возведен памятник Кириллу и Мефодию, любят посещать новобрачные. Ограждения увешаны замочками виде сердец с гравировкой имен молодоженов. Данная видовая площадка отлично подходит для свадебных фотографий, открывается отличный вид на красоты города. Опять же единственный минус – это сильный ветер.",Опубликовано 30 октября 2013 г.
Дальневосточный округ,Приморский край,Владивосток,Развлечения в Владивостоке,Сопка Орлиное гнездо,Shaye_78,5,"Экскурсия была крутой, но достаточно легкой, поскольку это - короткая экскурсия из города. Виды сделали экскурсию полностью стоящей. Я был здесь в феврале, когда полуостров, тот Владивосток расположен на, расколите замороженный Амурский залив на заднем плане от ледяного моря на переднем плане. Достойный внимания вид!",Перевод: PROMT
Дальневосточный округ,Приморский край,Владивосток,Развлечения в Владивостоке,Сопка Орлиное гнездо,Soap_al,5,"В любую погоду это must have :) превосходный вид на город, мосты, море. И туман здесь была, и в дождь, и в солнечную погоду. Как не побывать?",Опубликовано 12 октября 2017 г.
Дальневосточный округ,Приморский край,Владивосток,Развлечения в Владивостоке,Сопка Орлиное гнездо,SshellW,5,"С сопки открывается прекрасный вид на город Владивосток, обязательно нужно посетить если первый раз приехал во Владивосток! Не пожалеете!",Опубликовано 7 мая 2015 г.
Дальневосточный округ,Приморский край,Владивосток,Развлечения в Владивостоке,Сопка Орлиное гнездо,Starlit2010,5,"Потрясающий вид, который не испортит даже длительный подъем в гору. Мост золотые ворота и мост на о.Русский, набережные с пришвартованными парусниками, корабли... все это создаёт неповторимые впечатления.",
Дальневосточный округ,Приморский край,Владивосток,Развлечения в Владивостоке,Сопка Орлиное гнездо,Stefan M,4,"привет, от этого момента вы habe Очень хороший вид на Владивосток. Не легко найти дорогу к этому месту.",Перевод: PROMT
Дальневосточный округ,Приморский край,Владивосток,Развлечения в Владивостоке,Сопка Орлиное гнездо,Svetita2017,4,"Наш отель находился рядом, поэтому нам до нее идти было пять минут. На вершине находится довольно неухоженный памятник Кириллу и Мефодию.Но вид на мост и бухту открывается отличный.",Опубликовано 16 сентября 2020 г.
Дальневосточный округ,Приморский край,Владивосток,Развлечения в Владивостоке,Сопка Орлиное гнездо,TatianaBTV,5,"Одна из старейших и известных видовых площадок Владивостока. Открывается красивый вид на историческую часть города, на чуркинский мост, на Золотой рог. Все гостям города обязательно приезжать сюда. А еще я сюда на свою свадьбу фотографироваться приезжала :)",Опубликовано 25 июня 2014 г.
Дальневосточный округ,Приморский край,Владивосток,Развлечения в Владивостоке,Сопка Орлиное гнездо,Tatjanamai,5,Вид с площадки обалденный. Добирались долго пешком от порта до площадки. Но нисколько не пожалели. А фотографии вышли отличные.,Опубликовано 23 августа 2018 г.
Дальневосточный округ,Приморский край,Владивосток,Развлечения в Владивостоке,Сопка Орлиное гнездо,Tim M,5,"Сел на фуникулер по склону здесь - и какое потрясающее место. Отличный вид и вид на центр города и моста и аккуратный маленький souveneir магазин. Можно сесть на автобус и в 15 от близости здесь до острова русских, а не от центра города, что экономит примерно половину поездки",Перевод: PROMT
Дальневосточный округ,Приморский край,Владивосток,Развлечения в Владивостоке,Сопка Орлиное гнездо,ToyotaLandCruiser,5,"Какой замечательный вид от верха холма. Мы шли всю дорогу, но это стоило он (альтернативно, вы можете сесть в вагон фуникулера). Действительно хороший вид на Золотой Рожок залив, все суда, прибывающие в порт Владивостока, промышленные зоны с подъемными кранами, и вода и холмы, и Новый мост! Мы действительно наслаждались видом. Замечательный город.",Перевод: PROMT
Дальневосточный округ,Приморский край,Владивосток,Развлечения в Владивостоке,Сопка Орлиное гнездо,Tully_AC,5,Всем рекомендую посетить это место. Вид потрясающий. Нигде не видел ничего подобного. В этом месте открывается прекрасный вид практически на весь город.,Опубликовано 12 марта 2013 г.
Дальневосточный округ,Приморский край,Владивосток,Развлечения в Владивостоке,Сопка Орлиное гнездо,Valeritch,5,"дорога слегка путанная, но стоит того, чтобы заехать на сопку. Отсюда открывается отличный вид на Залив Золотой Рог, мосты и микрорайон Чуркин. Можно так же сотографироваться у памятнику Кириллу и Мефодию. Горожане цепляют на него свадебные замки",Опубликовано 27 сентября 2017 г.
Дальневосточный округ,Приморский край,Владивосток,Развлечения в Владивостоке,Сопка Орлиное гнездо,Vera B,3,"Если не останавливаться у памятника, а пройти чуть дальше - можно увидеть не только город со стороны залива Золотого Рога, но и со стороны Амурского залива.
Последние годы в ходе активного строительства там уже не так пусто и открыто, но все еще можно посмотреть на большую часть города.

Что бы подняться на саму Орлиную сопку - нужно обойти здание бывшего корпуса ""Б"" ДВГТУ, зайти за стадион и пройти вдоль общежитий. После Державина 19а будет поворот налево вверх. Либо второй вариант - подняться с улицы Нерчинской, повернув перед школой №75 направо и по прямой вверх.",
Дальневосточный округ,Приморский край,Владивосток,Развлечения в Владивостоке,Сопка Орлиное гнездо,Very Goood,5,"Доехать можно прям на такси, полнятся вверх, сверху открывается замечательный вид! Обязательно посетите",
Дальневосточный округ,Приморский край,Владивосток,Развлечения в Владивостоке,Сопка Орлиное гнездо,VilenaTur,4,"Обзор хороший и в дневное, и в вечернее время. Здесь же располагается сувенирный магазинчик, где ретро- открытки с достопримечательностями Владивостока (в 19,20,21. веках), карта достопримечательностей Владивостока. К открытке прилагается конверт и вы могли бы отправить открытку или письмо из Владивостока своим родным(друзьям, близким). Ночью на сопке мерцает телебашня (красивая подсветка).",Опубликовано 17 августа 2015 г.
Дальневосточный округ,Приморский край,Владивосток,Развлечения в Владивостоке,Сопка Орлиное гнездо,Vitabelka,5,"Обалденный вид на город, бухту Золотой рог и Золотой мост и днем, и особенно ночью!!! Единственное, не очень облагорожено, опасные ступеньки, поэтому будьте осторожны!",
Дальневосточный округ,Приморский край,Владивосток,Развлечения в Владивостоке,Сопка Орлиное гнездо,Vjhzr75,5,"Даже и не знал, что это место имеет название ""Сопка Орлиное гнездо"".... Когда друзья рекомендовали мне места для восхищения столицей Приморья, то просто сказали, что сейчас поедем к Кириллу и Мефодию. Я и представить себе не мог, что попаду, по-моему, на самую лучшую смотровую площадку: отсюда и Золотой мост виден с огромным потоком машин, и фуникулер, тихо поднимающийся на сопку, и корабли на рейде - от военных до гражданских. С высоты так приятно наблюдать суету городской жизни, как будто сидишь в кинотеатре и наблюдаешь жизнь мегаполиса со стороны...",
Дальневосточный округ,Приморский край,Владивосток,Развлечения в Владивостоке,Сопка Орлиное гнездо,VladimirAldobaev,5,"Увидеть все и сразу.Найдите время подняться на эту площадку. Не знаю какой еще общественный транспорт рядом, но верхняя станция фуникулера совсем рядом.",Опубликовано 19 февраля 2015 г.
