Дальневосточный округ,Сахалинская область,"Сахалин,Южно-Сахалинск",Развлечения в Южно-Сахалинске,"Спортивно-туристический комплекс ""Горный воздух""",Sergey K,3,"Само место отличное. Олицетворение красоты сахалина. Хорош и летом и зимой. нам нравится зимой. Регулярно катаемся с детьми на лыжах.

Но администрация комплекса как будто специально пытается сделать отдых людей с изъянами. Ну во первых цена далеко не мала, около 300 р за подъём на 1 человека. для семьи из 5 человек - 1500 за подъём...

Но да не суть. Теперь при этом ценнике ты получаешь глобальные пробки в начале сезона в... кассу чтобы положить эти деньги на ски пасс. Вопрос кто виноват и когда это закончится администрация игнорирует. Призвать представителей администрации в кассу невозможно.

Плавно в сезоне очередь перемещается к подъёмникам.

Ни малое достижение - не встретился пока с хамством со стороны обслуживающего персонала в 2016 году за 4 раза посещения. В сезоне 2015 - регулярно.

Открыли бесплатную парковку - большое дело! Но навести порядок с забитыми тротуарами автомобилей, владельцам которых невмоготу пройти 200 м разницы между стоянкой на пешеходном маршруте и бесплатной парковкой не могут. Почему нельзя выставить пост ГИБДД и выписывать штрафы за стоянку на пешеходном переходе или езду по тротуарам?

Искуственное производство снега не работает. почему - никто не знает

Трассы оборудуют медленно.

Несколько раз пробовали питаться в заведениях при горном воздухе. Помимо конского ценника еще и не вкусно. Больше не едим там, ездим в город.

В общем такое впечатление, что хозяина или нет, либо он не квалифицированный руководитель. Или правительственный чиновник, уж не знаю что хуже.

Вообщем при всём великолепии, увы, управление не на высоте. поэтому 3 из 5",Опубликовано 8 января 2016 г.
Дальневосточный округ,Сахалинская область,"Сахалин,Южно-Сахалинск",Развлечения в Южно-Сахалинске,"Спортивно-туристический комплекс ""Горный воздух""",Sergey K,5,"Быть на Сахалине и не побывать на Горном Воздухе непростительно. Горный Воздух является своего рода визитной карточкой Сахалина. Комплексу наверное лет 40 уже. Он широко известен далеко за пределами области.
Со смотровой площадки открывается хороший вид.
Горный воздух снабжен современными подъемниками, несколько отличных трасс.
Горный Воздух в лихие 90-е и сейчас - это, как говорят в Одессе, две большие разницы. Область вкинула немало денежек в развитие этого объекта и теперь с гордостью можно сказать, что Горный Воздух - современный горнолыжный комплекс.",Опубликовано 21 августа 2015 г.
Дальневосточный округ,Сахалинская область,"Сахалин,Южно-Сахалинск",Развлечения в Южно-Сахалинске,"Спортивно-туристический комплекс ""Горный воздух""",Sergey S,5,"Даже в летнее время, когда снег растаял, 2 смотровые площадки с прекрасными панорамными видами города обязательно следует посетить. Канатная дорога состоит из двух участков, надо пересаживаться. Билет стоит 150 рублей для каждого участка, всего 300 рублей. Можно подняться только по одному участку, там тоже есть смотровая площадка на середине горы. Хорошие панорамные виды на город. Пенсионеры могут подняться бесплатно. На вершине - большая смотровая площадка, можно осмотреть город и горы с другой стороны. Очень хорошо виден весь город, но только в хорошую погоду. Вечером и в туман видно плохо.",Опубликовано 20 мая 2017 г.
Дальневосточный округ,Сахалинская область,"Сахалин,Южно-Сахалинск",Развлечения в Южно-Сахалинске,"Спортивно-туристический комплекс ""Горный воздух""",Sergey V,5,Кататься там одно удовольствие. Когда темнеет трассы освещаются. Трассы оборудованы удобным подъёмником.,Опубликовано 13 сентября 2016 г.
Дальневосточный округ,Сахалинская область,"Сахалин,Южно-Сахалинск",Развлечения в Южно-Сахалинске,"Спортивно-туристический комплекс ""Горный воздух""",Simarina12,5,"На Сахалин приехали впервые, цель поездки - катание на горных лыжах. Были приятно удивлены организацией процесса здесь. Имеется все, что нужно - магазин, где можно купить все необходимое для катания, прокат снаряжения, камеры хранения, прекрасное кафе прямо на горе, отличные подъемники и хорошие склоны, которые, правда, не все были открыты в связи с недостаточным снежным покровом. Приветливый персонал. Кстати, хочется особо отметить бесплатный подъем для пенсионеров, детей и льготные тарифы для студентов. Получили огромное удовольствие от катания, думаю, ещё не раз приедем.",
Дальневосточный округ,Сахалинская область,"Сахалин,Южно-Сахалинск",Развлечения в Южно-Сахалинске,"Спортивно-туристический комплекс ""Горный воздух""",Sodju,5,"Был в апреле сам не лыжник,но люблю такого рода места.Меня больше интересовал вид на город,про который все говорят.Не разочаровало ничего.Приехал к кассам взял билет 200 руб на подъемник,сам подъем занял 7 минут с пересадкой на склоне.
Внизу комплекса было +5,наверху задувал свежий ветер,по ощущениям -10.Для профессиональных лыжников каждый в городе подчеркивал преимущества перед другими комплексами.Сам оценить не могу,но по внешним факторам все было на высоте.
Одним словом советую не забыть с собой фотоаппарат,вид того стоит.",
Дальневосточный округ,Сахалинская область,"Сахалин,Южно-Сахалинск",Развлечения в Южно-Сахалинске,"Спортивно-туристический комплекс ""Горный воздух""",Soldakov,5,"Рекомендую на обратном пути спускаться пешком по указателям ""Горный родник"". Это гарантирует Вам приятные впечатления!",Опубликовано 4 августа 2015 г.
Дальневосточный округ,Сахалинская область,"Сахалин,Южно-Сахалинск",Развлечения в Южно-Сахалинске,"Спортивно-туристический комплекс ""Горный воздух""",Spartak M,5,Отличное место для катания на горных лыжах и сноуборде. Вечером трассы освещаются. Открывается прекрасный вид на Южно-Сахалинск. Пункты проката есть как внизу так и на самой горе.,
Дальневосточный округ,Сахалинская область,"Сахалин,Южно-Сахалинск",Развлечения в Южно-Сахалинске,"Спортивно-туристический комплекс ""Горный воздух""",Splashoffun,5,"Если вы любите горные лыжи, сноуборд или просто красивый вид сверху, то вам обязательно сюда!
Подьем начинается практически из центра города. Доехать можно на автобусе (остановка пл. Победы) или такси (не более 200 рублей из города - цены 2014 года). сначала подьем до средней площадки с обязательным выходом. На средней площадке установили олимпийские кольца, от которых открывается вид на город. Можно почувствовать себя олимпийцем! На средней же площадке енсколько кафе-баров, пункт проката досок и лыж. С нее же можно спуститься по довольно-таки пологой горке для начинающих или ленивых до первого уровня .
На следующий уровень подьем на выбор в крытой канатке, либо на открытой скамье (для лыжников и сноубордистов). Едешь, смотришь как народ спускается... Красота! Летом смотришь как трава растет. Тоже красота...
А наверху выбор склонов для спуска!!! Западный, восточный, спортивный, южный, два серпантина! Прсото рай! Не буду подробно описывать все склоны, попробовать стоит каждый. Но на южном и восточном стоит бугельный подьемник. Если не уверены в своих силах, то задумайтесь, так как альтернативный способ вернуться с тех склонов в город - пешком в гору!
Вечером на западном склоне включается освещение. Город тоже весь светится и ну очччень красиво! Остальные склоны в темное время закрывают!
Оплата проезда - можн оприобрести карточку, ан которую кладется сумма депозита и считывается на электронных турникетах определенная сумма (окло 150 рублей за подьем). Можно приобрести разовый билет. Спуск вниз бесплатно.
Летом с верхней площадки можно прогуляться до Лысой горы и посмотреть на город оттуда. На врехней площадке также есть кафе и фото-поинты.
Отличного вам спортивного и созерцательного отдыха!",Опубликовано 22 апреля 2014 г.
Дальневосточный округ,Сахалинская область,"Сахалин,Южно-Сахалинск",Развлечения в Южно-Сахалинске,"Спортивно-туристический комплекс ""Горный воздух""",Sportsmenka86,5,"Все отлично:Персонал,трассы,обслуживание.Ездим каждый год. Единственный минус это цены на абонементы.",Опубликовано 27 февраля 2016 г.
Дальневосточный округ,Сахалинская область,"Сахалин,Южно-Сахалинск",Развлечения в Южно-Сахалинске,"Спортивно-туристический комплекс ""Горный воздух""",Sportsmenka86,5,"Лучший горнолыжный курорт на Дальнем Востоке.Катаемся только тут каждую зиму.Живем в Хабаровске.Отличное обслуживание,хорошие персонал.Нам бы такую горнолыжку.",Опубликовано 27 февраля 2016 г.
Дальневосточный округ,Сахалинская область,"Сахалин,Южно-Сахалинск",Развлечения в Южно-Сахалинске,"Спортивно-туристический комплекс ""Горный воздух""",Spring_girl17,5,"Побывала впервые в январе 2016 года, красиво, холодно, завораживающе! Поднимались на самый верх. Фотографировались, ночной Южно-Сахалинск мне очень понравился.",Опубликовано 16 января 2016 г.
Дальневосточный округ,Сахалинская область,"Сахалин,Южно-Сахалинск",Развлечения в Южно-Сахалинске,"Спортивно-туристический комплекс ""Горный воздух""",Staslohness,5,"Посетил ""Горный Воздух"" в мае, когда снег был только на самой вершине. С вершины открывается отличный вид на город и окрестности.",Опубликовано 2 июля 2015 г.
Дальневосточный округ,Сахалинская область,"Сахалин,Южно-Сахалинск",Развлечения в Южно-Сахалинске,"Спортивно-туристический комплекс ""Горный воздух""",Stepan L,5,"Известный с советских времен спортивный комплекс ""Горный Воздух"" обновился и теперь очень современен. Для спортсменов интересно прокатиться на лыжх или сноуборде. Для остальных просто можно неплохо прогуляться, подышать воздухом, выпить глинтвейна в одном из кафе...",Опубликовано 1 апреля 2014 г.
Дальневосточный округ,Сахалинская область,"Сахалин,Южно-Сахалинск",Развлечения в Южно-Сахалинске,"Спортивно-туристический комплекс ""Горный воздух""",Storia1984,5,"Для меня очарование базы заключается в возможности прокатиться на сноуборде между елей... , Когда воздух наполнен еловым ароматом. Когда ""лапы"" красавиц покрыты пушистым, искрящимся на солнце снегом. Чего-чего, а снега в Южно-Сахалинске достаточно, даже иногда слишком много:-))
На мой взгляд, база оборудована всем, чем требуется - есть раздевалка (хотя в пик сезона катострофически не хватает ячеек/кабинок), есть ремонтная мастерская, есть прокат и школа.
Для тех, кто устал и проголодался - есть уютное кафе с вполне адекватными ценами, мне везло, и даже если были очереди, то все равно удавалось найти столик.
Склоны освещены, что позволяет всем любителям ""укататься"".Обязательно приезжайте.",Опубликовано 23 ноября 2013 г.
Дальневосточный округ,Сахалинская область,"Сахалин,Южно-Сахалинск",Развлечения в Южно-Сахалинске,"Спортивно-туристический комплекс ""Горный воздух""",Svetlana Z,3,"Природа, место-просто замечательное, но комфорта не хватает!

21 век- а мы видим деревянные туалеты на улицах! Мало того, некоторые отделаны внутри облицовочной плиткой на которой скользишь прямо в.....
Надо было думать, что снег и плитка глазированная -несовместимы!",Опубликовано 9 мая 2016 г.
Дальневосточный округ,Сахалинская область,"Сахалин,Южно-Сахалинск",Развлечения в Южно-Сахалинске,"Спортивно-туристический комплекс ""Горный воздух""",Svkhrol Х,5,"Текущий сезон на горном воздухе порадовал новыми живописными трассами как для начинающих, так и скоростных для любителей экстремальной езды. Трассы отлично подготовлены. Канатно- кресельный подьемник на уровне зарубежных. Всем рекомендую посетить.",Опубликовано 7 ноября 2013 г.
Дальневосточный округ,Сахалинская область,"Сахалин,Южно-Сахалинск",Развлечения в Южно-Сахалинске,"Спортивно-туристический комплекс ""Горный воздух""",Taiana P,5,"Отличное место для того чтобы отлично провести свободное время на свежем воздухе с пользой для здоровья. Замечательная горнолыжная база. Удобный подъемник с панорамными кабинками. Множество спусков, как для новичков, так и для профи. В данный момент закрыта для посетителей, но это только на летне-осенний период. Готовят трассы для сезона. Устанавливают систему искусственного оснежения!!! В сНа территории несколько теплых комфортных кафешек, как на средней, так и на ферхней площадках. Вся трасса подсвечивается в вечернее время, звучит музыка.",Опубликовано 29 сентября 2013 г.
Дальневосточный округ,Сахалинская область,"Сахалин,Южно-Сахалинск",Развлечения в Южно-Сахалинске,"Спортивно-туристический комплекс ""Горный воздух""",Tamriko N,4,"Если вы любитель головокружительных горных видов, то вам точно не сюда. Однако прекрасная возможность, не выезжая за город, убежать от суеты и насладиться все-таки красивыми пейзажами. Есть кафе. Так же летом отличный вариант для велосипедистов-горников)",Опубликовано 5 августа 2016 г.
Дальневосточный округ,Сахалинская область,"Сахалин,Южно-Сахалинск",Развлечения в Южно-Сахалинске,"Спортивно-туристический комплекс ""Горный воздух""",TartarIIn,5,"На ДВ, пожалуй, лучший горнолыжный комплекс. Подъемник современный, за горой следят. Цены в кафе не показались очень высокими.",Опубликовано 27 августа 2015 г.
Дальневосточный округ,Сахалинская область,"Сахалин,Южно-Сахалинск",Развлечения в Южно-Сахалинске,"Спортивно-туристический комплекс ""Горный воздух""",Tasha_april,5,"Катались в течение недели. В этом году на средней станции в прокате оставляли свое снаряжение чтобы не возить каждый день из гостиницы. Очень удобно + на ночь ваши ботинки разместят в специальную сушку, и на утро вы снова чувствуете комфорт при катании.",Опубликовано 3 марта 2015 г.
Дальневосточный округ,Сахалинская область,"Сахалин,Южно-Сахалинск",Развлечения в Южно-Сахалинске,"Спортивно-туристический комплекс ""Горный воздух""",Tatyana V,4,"Отдыхаем на горном воздухе зимой каждые выходные, из минусов могу назвать только бугель на южном склоне ну очень большие очереди собираются там, и долго ехать до верха, забиваются ноги. А так все круто и перекусить можно в кафе очень вкусненько)))",Опубликовано 2 мая 2014 г.
Дальневосточный округ,Сахалинская область,"Сахалин,Южно-Сахалинск",Развлечения в Южно-Сахалинске,"Спортивно-туристический комплекс ""Горный воздух""",Tigrunya,5,"Молодцы! Новые трассы, подъемники, ни одного бугельного подъемника не осталось. При этом по одному абонементу могут ездить и двое и трое сразу, только внизу на турникете подождать друг друга - карточка позволяет пройти с разницей в 5 сек. Новая ценовая политика: теперь день делится на дневной абонемент и вечерний.",Опубликовано 5 марта 2017 г.
