zone,region,city,att_type,att_name,author,rating,comment,comment_date
Дальневосточный округ,Приморский край,Владивосток,Развлечения в Владивостоке,Центральная площадь Владивостока,baklajan4ik,4,"Центральная площадь - центр, куда ведут все пути, будь то автомобильные, железнодорожные или морские. Это чуть ли не единственная площадь в городе, поэтому когда говорят: ""Выхожу на площади"" или ""Еду на площадь"", подразумевают только одну площадь - площадь Борцов за власть Советов. Особенного интереса из себя не представляет. Тут проходят народные гулянья, ярмарки, концерты, спортивные мероприятия. Раньше под площадью был торговый центр больше похожий на барахолку. Историзма в это площади мало, поэтому можно на ней заострить свое внимание максимум мин 10. С нее есть удобный и быстрый переход к ЖД вокзалу.",Опубликовано 8 мая 2014 г.
Дальневосточный округ,Приморский край,Владивосток,Развлечения в Владивостоке,Центральная площадь Владивостока,bosforVL,5,"Площадь борцам за власть Советов на Дальнем Востоке, она же просто Борцов, она же Центральная – главная площадь Владивостока. Свое название она получила благодаря гигантской скульптуре тех, кто устанавливал здесь когда-то советскую власть.",
Дальневосточный округ,Приморский край,Владивосток,Развлечения в Владивостоке,Центральная площадь Владивостока,c0ldwind,5,"Кроме истории в этой площади нет ничего интересного. Но для галочки посетить ее можно. Хотя рядом много достопримечательностей, для посещения которых площадь можно сделать точкой старта.",Опубликовано 21 августа 2016 г.
Дальневосточный округ,Приморский край,Владивосток,Развлечения в Владивостоке,Центральная площадь Владивостока,david77083,5,Я сейчас во владивостокебыл на острове русский в центре погуляли на экскурсию по ездили всем рекомендую полететь во владивосток*,
Дальневосточный округ,Приморский край,Владивосток,Развлечения в Владивостоке,Центральная площадь Владивостока,delpik,5,"Находиться очень комфортно и приятно. что то очень историческое но приведенное в полный порядок. Рядом корабли, золотой рог, Гум, мост через золотой мост. Стоит сходить, что бы захотелось вернуться.",Опубликовано 26 января 2014 г.
Дальневосточный округ,Приморский край,Владивосток,Развлечения в Владивостоке,Центральная площадь Владивостока,devz_san,3,Сама по себе площадь ничего особенного не представляет площадь и площадь. Стоит три памятника борцам за власть. Рядом строиться церковь. неплохой вид на бухту золотой рог. но в целом особых впечатлений не получить....там нужно бывать на праздниках или народных гуляньях так же на открытие(закрытие) байкерского сезона. вот тогда там весело и есть на что посмотреть.,Опубликовано 18 февраля 2014 г.
Дальневосточный округ,Приморский край,Владивосток,Развлечения в Владивостоке,Центральная площадь Владивостока,fIrina03,5,"Оставила приятные впечатления центральная площадь Владивостока. Сравнительно небольшая, с красивым видом на морской порт.",Опубликовано 26 февраля 2016 г.
Дальневосточный округ,Приморский край,Владивосток,Развлечения в Владивостоке,Центральная площадь Владивостока,farmakeros f,4,"Мы посетили эту площадь в пятницу. В этой площади управляет открытым рыбный рынок, фруктами, овощами и едой. Это очень большой, с большим количеством вещей купить и поесть.",Перевод: PROMT
Дальневосточный округ,Приморский край,Владивосток,Развлечения в Владивостоке,Центральная площадь Владивостока,gribov2016,5,"Действительно - центр Владивостока. Площадь красивая, большая. Людей правда всегда много и проблема с парковкой, но с другой стороны не была бы так популярна и не было проблем. Хорошее место, знаковое для Владивостока",Опубликовано 21 октября 2016 г.
Дальневосточный округ,Приморский край,Владивосток,Развлечения в Владивостоке,Центральная площадь Владивостока,ilya2017,4,"Главный монумент и символ Приморья. Начало Океанского проспекта. Можно посмотреть совместно с остальными достопримечательностями. В некоторые дни недели на площади работает рынок. Правда ничего особенного, ни морепродуктов, ни специалитетов местных, там не продается. Ввиду отсутствия приличных супермаркетов в городе вцелом - может пользоваться спросом. Цены на рынке по сравнению с московскими показались высокими",Опубликовано 12 января 2017 г.
Дальневосточный округ,Приморский край,Владивосток,Развлечения в Владивостоке,Центральная площадь Владивостока,imponderadil,2,Мне кажется что базарам не место на центральной площади,Опубликовано 17 августа 2012 г.
Дальневосточный округ,Приморский край,Владивосток,Развлечения в Владивостоке,Центральная площадь Владивостока,kotyshev68,2,"Место с таким названием должно быть как минимум красивым, но это не про нашу захудалую площадь((( как это не прискорбно , но это так! В данный момент даже 36 причал выглядит куда приличней, похвастаться как говориться не чем((((",Опубликовано 25 февраля 2014 г.
Дальневосточный округ,Приморский край,Владивосток,Развлечения в Владивостоке,Центральная площадь Владивостока,liza_markiza,5,"Центральная площадь Владивостока-одна из моих любимых достопримечательностей. Первым делом всегда иду именно туда. Здесь часто проводятся мероприятия,выступают творческие коллективы города, действует прокат машинок для детей, много магазинчиков где можно перекусить в любое время. Больше всего завораживает открывающийся шикарный вид на бухту Золотой Рог,мост, корабельную набережную ,сопки...Также нравится любоваться памятником борцам за власть советов на ДВ и недавно возведенным барельефом""Владивосток-Город герой"". После прогулки по площади стоит лишь перейти дорогу и Вы в самом центре города,с его развитой инфраструктурой(многочисленные бары,рестораны,магазины,торговые центры,кафе и т.д),что не может не радовать.",Опубликовано 18 января 2014 г.
Дальневосточный округ,Приморский край,Владивосток,Развлечения в Владивостоке,Центральная площадь Владивостока,natash173,5,"Мимо Центральной площади сложно пройти. Расположена на ул. Светланская, на площади находится здание Администрации. В первой половине дня здесь рыбный, и не только, рынок.",Опубликовано 5 ноября 2016 г.
Дальневосточный округ,Приморский край,Владивосток,Развлечения в Владивостоке,Центральная площадь Владивостока,nik g,5,Естественно при посещении любого города все стремятся в центр! центр владивостока порадует свой чистотой и обилием достопримечательносте!,Опубликовано 15 ноября 2016 г.
Дальневосточный округ,Приморский край,Владивосток,Развлечения в Владивостоке,Центральная площадь Владивостока,panas2009,5,"Москва- Владивосток, все знакомо,
Москва - Владивосток - здесь я дома.
Мне каждый дорог здесь уголок,
Москва - Владивосток!

Излюбленное место туристов! Очень много здесь всего: и сувенирные ларьки, и церковь, и шикарные виды на Владивосток!",Опубликовано 22 апреля 2019 г.
Дальневосточный округ,Приморский край,Владивосток,Развлечения в Владивостоке,Центральная площадь Владивостока,polex4232,5,"К площади непременно нужно подходить по Океанскому проспекту, спускаясь вниз от пересечения с Семеновской. Только с такого ракурса постепенно и полностью открывается вся красота. Великих архитектурных сооружений там нет. Но площадь ценна своим местоположением и открывающимся пейзажами. Историческая архитектура окружающих домов подчеркивает облик площади и очень гармонично обрамляет её. Только здание краевой администрации контрастирует со всем этим вековым величием, оно явно выпадает из образа.=) С площади открывается прекрасный вид на бухту Золотой Рог и вход в неё со стороны пролива Босфор Восточный. С возвышенного положения смотришь как-бы ""сверзу-вниз"" на причалы порта и даже поезда пробегают к зданию вокзала где-то внизу. Вид конечно прекрасный и неподражаемый. Со всех сторон она разная. С одной стороны Океанский проспект убегает вверх от памятника Борцам за власть Советов, слева спокойная, узкая и историческая Светланская вьётся вдоль залива к Луговой, справа здание администрации, совершенно другого формата, а повернувшись лицом к океану где-то внизу видишь весь безграничный мир и открывающуюся дорогу туда. Площадь как и город, многогранная, неповторимая и обязательно разная, стоит только сделать шаг в сторону...",Опубликовано 8 мая 2015 г.
Дальневосточный округ,Приморский край,Владивосток,Развлечения в Владивостоке,Центральная площадь Владивостока,pollyana63,4,"Интересный и очень вкусно, чтобы увидеть такую большую площадь в центре города. Это была наша первая поездка в России перед Родством товары, поэтому все было новым и интересным!",Перевод: PROMT
Дальневосточный округ,Приморский край,Владивосток,Развлечения в Владивостоке,Центральная площадь Владивостока,saf_kate,5,"Центральная площадь города, место проведения парадов, концертов и различных мероприятий. Вокруг площади исторические красивые здания, виден порт. Памятники выглядят масштабно. Каких-то особых развлечений на площади нет.",Опубликовано 30 мая 2014 г.
Дальневосточный округ,Приморский край,Владивосток,Развлечения в Владивостоке,Центральная площадь Владивостока,saha09081960,4,"на площади находится целый монумент, посвященный борцам- освободителям города Владивостока. Площадь очень большая!!!",Опубликовано 4 сентября 2016 г.
Дальневосточный округ,Приморский край,Владивосток,Развлечения в Владивостоке,Центральная площадь Владивостока,sakril,2,"Если бы мне не сказали, что это центральная площадь Владивостока, никогда бы не подумала, что это она и есть. Ни архитектуры, ни единого типового решения застройки вокруг, ни зелени, ни фонтанов. Очень разочаровывает.",Опубликовано 9 февраля 2014 г.
Дальневосточный округ,Приморский край,Владивосток,Развлечения в Владивостоке,Центральная площадь Владивостока,sanya312,5,"Очень интересная скульптурная композиция, отличный вид на мост через бухту Золотой Рог. Минусы: стройка в непосредственной близости от площади, огромное количество машин на Светланской, образующие огромную пробку.",Опубликовано 23 ноября 2013 г.
Дальневосточный округ,Приморский край,Владивосток,Развлечения в Владивостоке,Центральная площадь Владивостока,se157,2,"Хуже чем в этом году площадь в Новогодние праздники ещё не была. Возникает вопрос ,что все деньги на салют ушли? Позор городским властям и всем ответственным лицам(это мягко сказано).Площадь не соответствует краевому центру.......",Опубликовано 28 июля 2016 г.
Дальневосточный округ,Приморский край,Владивосток,Развлечения в Владивостоке,Центральная площадь Владивостока,sueylt,5,Я прошел Центральной площадью мой тур по прогулок / поездки на автобусе по городу. Это было очень интересно. Я люблю узнать о других культурах и их истории.,Перевод: PROMT
Дальневосточный округ,Приморский край,Владивосток,Развлечения в Владивостоке,Центральная площадь Владивостока,Александр В,5,"Все пути и мысли направлены на посещение площади. Хороший вид на бухту!
Все что в городе проводится наверно на площади - концерты, народные гуляния, праздники и т.д. Место свиданий, встреч, прогулок и просто отдыха. Посетили который раз ярмарку. Остались довольны общением людей. Попробывали жималость.",
Дальневосточный округ,Приморский край,Владивосток,Развлечения в Владивостоке,Центральная площадь Владивостока,Александр И,4,"Площадь Борцам за власть советов. Самое центровое место. На ней есть все, памятники борцам, стела города воинской славы, эмблема саммита, дума края, рядом строят храм, красивый вид на бухты, морской вокзал. На площади проходят концерты, ярмарки, митинги, спортивные соревнования, шоу. Стоит прогуляться и сфотографироваться.",Опубликовано 10 мая 2015 г.
Дальневосточный округ,Приморский край,Владивосток,Развлечения в Владивостоке,Центральная площадь Владивостока,Александр К,5,Красивое место в городе. Своим особенным положением позволяет ощутить городской контраст. Да и интернет в этом месте особенно хорош...,
Дальневосточный округ,Приморский край,Владивосток,Развлечения в Владивостоке,Центральная площадь Владивостока,Александр М,5,"Центральная площадь города привлекательное место для тысяч туристов из разных стран.Рядом ж.д.вокзал,Морской порт и Набережная,где можно неспеша прогуляться,полюбоваться кораблями и подышать морским воздухом.Всем рекомендую.",Опубликовано 24 декабря 2016 г.
Дальневосточный округ,Приморский край,Владивосток,Развлечения в Владивостоке,Центральная площадь Владивостока,Алексей Р,4,"Гуляли во Владивостоке на площади, чистенько, приятно, музыка играла. Площадь не большая, детей очень порадовали голуби, которых они кормили. Какие то не понятные лавки стояли в которых продавали всякую ерунду как на борохолке.",Опубликовано 9 апреля 2019 г.
Дальневосточный округ,Приморский край,Владивосток,Развлечения в Владивостоке,Центральная площадь Владивостока,Анна В,5,"Находится площадь на пересечении ул. Светланской и Океанского проспекта. Таким образом, сразу по приезду во Владивосток и сойдя с поезда, я оказалась на площади Борцам. Затем. приехав в Центр города, мы с удовольствием ""пофотались"" с моим гидом возле скульптуры. Было много иностранцев в тот день.",Опубликовано 27 декабря 2017 г.
Дальневосточный округ,Приморский край,Владивосток,Развлечения в Владивостоке,Центральная площадь Владивостока,Анна К,5,"Площадь большая! Прогуливаясь по Светланской улице обязательно попадете на эту площадь. В центре величественный памятник борцам за революцию, а сбоку есть небольшой крест, в память о соотечественниках, вовлеченных в пучину гражданской войны, есть и часовенка. В праздничные дни и в выходные на площади устраиваются мероприятия - забеги, эстафеты, перформансы, рекламные акции или большой рынок разнообразных продуктов.",
Дальневосточный округ,Приморский край,Владивосток,Развлечения в Владивостоке,Центральная площадь Владивостока,Артем Г,5,"Это место завораживает своей красотой в любое время года. Вид в любой сторону классный. Поблизости находятся хорошие рестораны, уютные кафе и пиццерии, большое количество различных магазинов. Рядом также несколько музеев. С этого места можно проехать на общественном транспорте в любую точку города и пригорода.",Опубликовано 29 октября 2013 г.
