zone,region,city,att_type,att_name,author,rating,comment,comment_date
Дальневосточный округ,Приморский край,Владивосток,Развлечения в Владивостоке,Центральная площадь Владивостока,112DAVYDOV,4,"Центральная площадь Владивостока носит название площади Борцов революции или Борцов за власть Советов на Дальнем Востоке. Именно здесь проходят праздничные мероприятия, парады, демонстрации, концерты, ярмарки, Уже весной организаторы спортивных соревнований начинают подготовку к проведению на Центральной площади ставших популярными в последние годы массовых соревнований по уличному баскетболу Многие здания в районе Центральной площади были возведены в начале двадцатого века.
На западной стороне находится массивное здание краевой администрации, северную границу площади образует Светланская улица. В красивом здании на перекрестке Светланской и Алеутской улиц находится Государственный объединенный краеведческий музей им. В.К. Арсеньева. В квартале, который простирается от перекрестка по северной стороне Светланской улицы, есть и ряд других объектов культуры. Например, в здании старого деревянного театра находится концертный зал Приморской краевой филармонии. И почти здесь же в строении 19 века располагается Молодежный театр,
Определенно достопримечательностью Центральной площади Владивостока является проходящая прямо под ней железная дорога. Это последние километры Великой Транссибирской магистрали. Железка выходит на поверхность у здания краевой администрации. К платформам железнодорожного вокзала попадаешь от юго-западного угла площади.
На восток железнодорожные пути убегают к причалам Корабельной набережной. А далее виднеются опоры моста через бухту Золотой рог.
На и у Центральной площади Владивостока, как и на многих других центральных площадях, сегодня в избытке магазинов и мест, где можно перекусить. А вот железной дороги нет нигде. Я, во всяком случае, не припомню такой экзотики в других городах.",Опубликовано 4 мая 2014 г.
Дальневосточный округ,Приморский край,Владивосток,Развлечения в Владивостоке,Центральная площадь Владивостока,2015_Elli,4,Именно с этого места нас забирал автобус в дальнюю поездку. Сначала ничего рассмотреть особо не удалось. Зато по возвращению уже от души прогулялись. Место хорошее. Виды с площади красивые. Но место не обихожено. Хотелось бы обратить на это руководство портового города.,
Дальневосточный округ,Приморский край,Владивосток,Развлечения в Владивостоке,Центральная площадь Владивостока,550_650,5,"Очень удобная площадь для проведения культурно-массовых мероприятий. Гостям города можно успеть послушать концерт, а потом за 10 минут дойти до железнодорожного вокзала и сесть в поезд. Удобно!",
Дальневосточный округ,Приморский край,Владивосток,Развлечения в Владивостоке,Центральная площадь Владивостока,Aleksandr S,5,"Площадь Борцов за Власть Советов на Дальнем Востоке, как центральная площадь, в первую очередь, является местом официальных мероприятий: парады, демонстрации, митинги, новогодняя ёлка, профессиональные праздники, концерты популярных исполнителей. В выходные дни регулярно организуются продовольственные ярмарки, которые привлекают и местных жителей, и гостей города. Центральная площадь имеет небольшой размер по меркам равнинных городов, возведена на крыше спортивного манежа, построенного в 1965 году и прекрасно отражает характер города: дефицит ровных площадей, ведь город размещён на склонах крутых сопок вокруг бухты Золотой Рог и прилегающих районов. Рядом с центральной площадью находится много архитектурных достопримечательностей (большинство построено в конце девятнадцатого- начале двадцатого века), музеев, исторических мест. Отсюда открываются прекрасные виды на бухту Золотой Рог, Золотой мост, комплекс железнодорожного и морского вокзалов, особенно если в этот день пришвартована круизная принцесса. Это место обязательно для посещения туристам, пытающимся понять дух города.",Опубликовано 31 марта 2017 г.
Дальневосточный округ,Приморский край,Владивосток,Развлечения в Владивостоке,Центральная площадь Владивостока,Aleksandr S,5,"Центральная площадь, или просто площадь, - популярное место для встреч горожан и для памятных фото туристов. Основная достопримечательность - Памятник Борцам за власть Советов. Это историческое место, здесь 25 октября 1922 года в России завершилась Гражданская война. В этот день соединения Красной Армии промаршировали по Алеутской улице, затем повернули на Светланскую. А накануне, за несколько часов до этого, от причалов, расположенных в сотне метров от площади, 25 кораблей кораблей Сибирской флотилии с остатками Белой Армии навсегда покинули Россию. В 2015 году на площади был установлен знак, православный крест, напоминающий об этих трагических событиях.",
Дальневосточный округ,Приморский край,Владивосток,Развлечения в Владивостоке,Центральная площадь Владивостока,AlexanderVDK2,3,"Большая площадь. С кучей точек быстрого питания. В выходные проводятся ярмарки, приезжают частники со своей продукцией. Имеются прокат машинок для детей, пони/лошади и прочие ""прелести"". Напротив площади море бутиков, ТРЦ Центральный, кинотеатр Уссури.",Опубликовано 24 февраля 2016 г.
Дальневосточный округ,Приморский край,Владивосток,Развлечения в Владивостоке,Центральная площадь Владивостока,Alexandre N,3,"Всё, что тут есть надо видеть!
Город стоит того.
От этой площади начинается всё.
Владивосток покоряет и-влюбляется в себя своей динамикой, грубоватьй простой недоПричёсанностью, открытиями, прекрасными видами..
Широкий как море, резкий как горный ветер, пьянящий как морской прибой!",Опубликовано 3 июля 2015 г.
Дальневосточный округ,Приморский край,Владивосток,Развлечения в Владивостоке,Центральная площадь Владивостока,Alexey A,5,Короче не буду писать что пишут все... Мне тут нравится одно часто тут разворачивают рынок и можно полакомиться изысканностями начиная от клубники с юга Китая и заканчивая олениной вяленой )))),Опубликовано 5 июня 2015 г.
Дальневосточный округ,Приморский край,Владивосток,Развлечения в Владивостоке,Центральная площадь Владивостока,Alexey G,4,"За несколько дней во Владивостоке, у меня сложилось впечатление, что куда бы я не поехал, обязательно проезжал через эту площадь. Может дороги так устроены, может особенности восприятия. Мне безусловно центральное, главно и примечательное. Здесь проводятся парады и празднуются все главные праздники.",Опубликовано 24 сентября 2017 г.
Дальневосточный округ,Приморский край,Владивосток,Развлечения в Владивостоке,Центральная площадь Владивостока,Alexey K,3,"Большая широкая площадь с памятниками. Проводятся все мероприятия города. Стоит неинтересный храм-новодел.
Минут на десять.",
Дальневосточный округ,Приморский край,Владивосток,Развлечения в Владивостоке,Центральная площадь Владивостока,Andrey_Shilimanov,5,"Шикарный вид с площади на закате, когда солнце, опускаясь освещает крыши домов на склонах сопок и канаты нового моста. Особенно красиво на фоне голубого неба!",Опубликовано 8 ноября 2013 г.
Дальневосточный округ,Приморский край,Владивосток,Развлечения в Владивостоке,Центральная площадь Владивостока,Brad R,4,"Ослы, которые окрашены так, вы можете снять с ними. Не переполненный днем, но ночью для шоу, упакованного.",Перевод: PROMT
Дальневосточный округ,Приморский край,Владивосток,Развлечения в Владивостоке,Центральная площадь Владивостока,Christina C,3,"Это городская площадь для фестивалей и ярмарки, люди смотрели и расслабляющиеся. Если ничего не происходило, есть две группы скульптур и Берлинской стены Fighters для советских палаток электричества в центральной площади, чтобы вам было компанией.Мы не сделали остался долго в тот день, просто сделал несколько фотографий.Счастливое место!",
Дальневосточный округ,Приморский край,Владивосток,Развлечения в Владивостоке,Центральная площадь Владивостока,DPAVoyager,5,"Ощущение грандиозности со временем исчезло, однако, добавилось чувство сопричастности с аграрным возрождением Приморья. В выходные посещаем Ярмарку - интересно, а главное полезно.",
Дальневосточный округ,Приморский край,Владивосток,Развлечения в Владивостоке,Центральная площадь Владивостока,Daria F,4,"Площадь сама довольно маленькая, но впечатляющих размеров памятник на ней. Много туристов, мы с ребёнком прокормили голубей, рядом морвокзал и ждёт вокзал.
Странно, что совершенно нет пандусов для колясок нигде, и даже на центральной площади.",Опубликовано 23 июля 2016 г.
Дальневосточный округ,Приморский край,Владивосток,Развлечения в Владивостоке,Центральная площадь Владивостока,Ddd790,2,"Центральная площадь Владивостока - разочарование от в общем красивого города. Во время моего пребывания на ней зачем-то стояло 3 пустых сцены. В уголке подростки на скейтах прыгали по специально построенным деревянным горкам. Площадь маленькая, грязная, если подойти к перилам то вид на стройку-свалку.",
Дальневосточный округ,Приморский край,Владивосток,Развлечения в Владивостоке,Центральная площадь Владивостока,Dewa43,5,"Первый раз довелось увидеть эту площадь сорок лет назад. Новая встреча произвела хорошее впечатление. Изменилась, похорошела, приукрасилась...
Появились и новые памятники, строится храм...",Опубликовано 23 августа 2016 г.
Дальневосточный округ,Приморский край,Владивосток,Развлечения в Владивостоке,Центральная площадь Владивостока,Dmitriy_Anatolyevich,5,"главная площадь города, на которой проводят мероприятия и ярмарку выходного дня. расположена на пересечении улиц Светланской и Океанского проспекта",Опубликовано 21 июля 2017 г.
Дальневосточный округ,Приморский край,Владивосток,Развлечения в Владивостоке,Центральная площадь Владивостока,Dmitry K,3,"Площадь сама по-себе небольшая. На выходных на ней проходят еженедельные ярмарки. Памятники поставлены красноармейцам - защитникам России от интервентов. Если бы не они, этого города в составе России не было бы. В принципе посетить можно.",Опубликовано 19 сентября 2014 г.
Дальневосточный округ,Приморский край,Владивосток,Развлечения в Владивостоке,Центральная площадь Владивостока,Dmitry Z,4,"Запоминающаяся площадь и интересные памятники, но неудобно с коляской спускаться к Корабельной набережной.",Опубликовано 31 марта 2017 г.
Дальневосточный округ,Приморский край,Владивосток,Развлечения в Владивостоке,Центральная площадь Владивостока,Dzonik,5,"Своеобразная площадь с которой открывается вид на военные корабли, парусники и другие суда пришвартованные в море, а так вид на мост золотой рог и краевую администрацию.",Опубликовано 9 декабря 2013 г.
Дальневосточный округ,Приморский край,Владивосток,Развлечения в Владивостоке,Центральная площадь Владивостока,Eduard S,4,Главная и центральная площадь города Владивостока. Символ города и излюбленное место отдыха горожан и туристов. Прекрасный вид на бухту золотой рог. Очень советую посетить в любое время года. С семьей или с друзьями,Опубликовано 29 января 2014 г.
Дальневосточный округ,Приморский край,Владивосток,Развлечения в Владивостоке,Центральная площадь Владивостока,Ekaterina Z,4,"К посещению обязательна, так как является главной площадью города. Памятник и короткая набережная. От неё до карабельной набережной идут очень крутые ступеньки, что не особо удобно для путешественников с маленькими детьми. Слева от памятника идёт стройка церкви. Есть несколько лавочек, чтобы передохнуть",Опубликовано 18 апреля 2017 г.
Дальневосточный округ,Приморский край,Владивосток,Развлечения в Владивостоке,Центральная площадь Владивостока,Ekaterina1886,5,"Площадь Борцам за власть Советов самое центральное место в городе, где проводятся разнообразные культмассовые мероприятия. В осенний период здесь проходит сельско-хозяйственная ярмарка, где горожане могут купить любую продукцию по доступным ценам.",Опубликовано 21 января 2014 г.
Дальневосточный округ,Приморский край,Владивосток,Развлечения в Владивостоке,Центральная площадь Владивостока,EkaterinaVl,5,"На площадь попали 31 декабря 2013, на новогодний салют. Огненные цветы распускались прямо над головой и рассыпались на тысячи огоньков. Было очень красиво!!!!!",Опубликовано 6 января 2014 г.
Дальневосточный округ,Приморский край,Владивосток,Развлечения в Владивостоке,Центральная площадь Владивостока,Eva J,5,"Мы были там во время майских праздников, поэтому там было полно местных жителей и туристов. С одной стороны находится строящийся собор, с другой - гигантский советский памятник. Была также сцена, подготовленная для продолжающихся концертов.",
Дальневосточный округ,Приморский край,Владивосток,Развлечения в Владивостоке,Центральная площадь Владивостока,EvgeniiZu,3,"Не впечатлила, зимой хотя бы ёлка стоит и ярмарка работает, а летом пустота, жарко и нечего делать там",Опубликовано 25 июля 2017 г.
Дальневосточный округ,Приморский край,Владивосток,Развлечения в Владивостоке,Центральная площадь Владивостока,Evgeny K,4,"Центральная площадь Владивостока по другому называется Площадь борцов за власть Советов, и разумеется, находится в центре Краевой столицы.
Рядом несколько одноимённых остановок общ. транспорта.
Венчает Площадь памятник Борцам за власть Советов.
Рядом - Белый Дом - Администрация края. Кинотеатр Уссури. ГУМ, кафе. Есть где оставить машину на парковке.
Здесь мы хорошо провели время.",Опубликовано 5 сентября 2017 г.
Дальневосточный округ,Приморский край,Владивосток,Развлечения в Владивостоке,Центральная площадь Владивостока,Evgeny_1981,4,Площадь борцов за власть Советов на Дальнем Востоке может увлечь туриста минут так на 15. Кроме группы памятников и здания администрации ничего интересного для себя я тут не увидел,Опубликовано 26 июня 2014 г.
Дальневосточный округ,Приморский край,Владивосток,Развлечения в Владивостоке,Центральная площадь Владивостока,Fiartem88,5,Площадь Борцам за власть Советов является визитной карточкой Владивостока!!! Иногда можно прогуляться по площади( в будни когда мало народа). А по выходным на площади ярмарка)))))( советую),Опубликовано 1 июля 2015 г.
Дальневосточный округ,Приморский край,Владивосток,Развлечения в Владивостоке,Центральная площадь Владивостока,GorbunS,4,"Сама по себе площадь как площадь, ничего особенного. Рядом расположено здание краевой администрации, ж/д и морской вокзалы, привокзальная площадь с памятником Ленину и Почтамт. А на Центральной площади стоит памятник Борцам за власть Советов, а так же монумент Город воинской славы с интересными барельефами. На площади проводятся спортивные и культурные мероприятия, шествия, митинги, демонстрации, концерты. Бывают ярмарки. Назначают свидания и собирается молодежь.",
