Дальневосточный округ,Приморский край,Владивосток,Развлечения в Владивостоке,Сопка Орлиное гнездо,meidzin,3,"На отшибе, без дорог и общественного транспорта, в окружении зданий списанных граффити, покрытый облупившейся белой краской стоит памятник создателям русской письменности. Смотреть на него больно.
А вот вид на бухту просто фантастический.",Опубликовано 2 марта 2017 г.
Дальневосточный округ,Приморский край,Владивосток,Развлечения в Владивостоке,Сопка Орлиное гнездо,milayoo,5,"особенно в темное время суток, когда зажигаются фонари...бухта с расположенными по берегам микрорайонами, дорогами, доками... и мост, пересекающий ее...это надо увидеть!!!",Опубликовано 13 сентября 2016 г.
Дальневосточный округ,Приморский край,Владивосток,Развлечения в Владивостоке,Сопка Орлиное гнездо,mnr2001,4,"Та смотровая площадка, которая рядом с памятником Кириллу и Мефодию, это ещё не сопка! Это всего лишь пол-сопки. Сопка — это на самом верху, рядом с телевизионной вышкой, высота 193 метра над уровнем моря. Это телевизионная вышка. Это крест в честь казаков-землепроходцев. Это отсутствие специальной оборудованной смотровой площадки, зато есть не оборудованная вершина сопки, откуда открываются замечательные виды на город, на бухту Золотой Рог, на Золотой мост. И даже вдалеке видны Русский мост и Русский остров. Если, конечно, тумана нет. Когда мы были на сопке, тумана не было!",
Дальневосточный округ,Приморский край,Владивосток,Развлечения в Владивостоке,Сопка Орлиное гнездо,mrgamo,5,"С этой площадки открывается отличный вид и панорама, 120 метров над уровнем моря. Свежий воздух и отличный вид - обязательно к посещению!",
Дальневосточный округ,Приморский край,Владивосток,Развлечения в Владивостоке,Сопка Орлиное гнездо,nastenas82,5,Открывается отличный вид на бухту золотой рог. Идеальное место для просмотра салютов на празники. Так же там всегда свежий воздух и мало людей),Опубликовано 25 мая 2015 г.
Дальневосточный округ,Приморский край,Владивосток,Развлечения в Владивостоке,Сопка Орлиное гнездо,natallinka,4,"Добраться сюда оказалось не столь просто, как казалось, что пешком, что на автомобиле. Но вид, открывающийся со смотровой площадки в темное время суток того стоит! Не пожалеете! Днем здесь не так интересно, особенно, если погода солнечная, то вся бухта Золотой Рог оказывается против света.",Опубликовано 5 декабря 2017 г.
Дальневосточный округ,Приморский край,Владивосток,Развлечения в Владивостоке,Сопка Орлиное гнездо,natash173,5,"На сопке Орлиное гнездо находится Видовая площадка, к посещению обязательна! Виды с нее хороши как днем, так и ночью.... также на сопке есть видовой ресторан, тоже красота",Опубликовано 5 ноября 2016 г.
Дальневосточный округ,Приморский край,Владивосток,Развлечения в Владивостоке,Сопка Орлиное гнездо,neobizkit,5,"Место обязательное для посещения. Одна из самых доступных видовых, с которой можно насладиться отличным видом ночного города.",Опубликовано 8 августа 2015 г.
Дальневосточный округ,Приморский край,Владивосток,Развлечения в Владивостоке,Сопка Орлиное гнездо,nomerodin,5,"Сопка ""Орлиное гнездо"" лучшая видовая площадка города. Отсюда делаются лучшие снимки панорам дневного и ночного Владивостока.. Сюда приезжают новобрачные за фотографиями ""на долгую память"". Прекрасный вид на бухту ""Золотой Рог"", на новый мост. Если ходите охватить самую прекрасную часть города одним взглядом, сюда надо обязательно приехать, не даром на эту сопку знатоки привозят своих гостей города. Приезжайте и Вы)",Опубликовано 27 ноября 2013 г.
Дальневосточный округ,Приморский край,Владивосток,Развлечения в Владивостоке,Сопка Орлиное гнездо,nortonmaggie,4,"это стоит тогонемного староватый, но это еду части ее очарованиеотличный вид, даже когда мы там были и моста, был в тумане/Облаке;",Перевод: PROMT
Дальневосточный округ,Приморский край,Владивосток,Развлечения в Владивостоке,Сопка Орлиное гнездо,panas2009,5,"Владивосток - город на холмах, больше всего поражают виды Владивостока. С данной смотровой площадки как раз можно сделать самые красивейшие кадры! Видно все, и бухту Золотой Рог, и эти бесподобные мосты!",Опубликовано 22 апреля 2019 г.
Дальневосточный округ,Приморский край,Владивосток,Развлечения в Владивостоке,Сопка Орлиное гнездо,pao_1974,4,Лучшее место для просмотра ночного вида на Золотой рог. Любимое место для наблюдения за салютом во время праздников. Не очень много места для парковки и неудачное расположение общественного транспорта.,Опубликовано 6 августа 2016 г.
Дальневосточный округ,Приморский край,Владивосток,Развлечения в Владивостоке,Сопка Орлиное гнездо,puppy3541,5,"Это было довольно поздно ночью, когда я был там. Есть много света, в том числе Golden мост, который делает вид очень красиво. Это веяло так хорошо, это было просто так правильно. Rose туда на такси, но вы всегда можете подходят или снижаться пешком. Не то, что трудно подниматься наверх, просто нуждается в небольшом усилии. И это стоит, открывается великолепный вид и хороший ветер, как только вы попадаете на крыши. Мне очень понравилось.",
Дальневосточный округ,Приморский край,Владивосток,Развлечения в Владивостоке,Сопка Орлиное гнездо,romaleo88,5,"Одна из лучших видовых площадок Владивостока. Потрясающий вид на Золотой мост, и бухту Золотой рог. Очень красиво в солнечны день и ночью, когда масса огней заполняет пространство. Движутся огоньки по акватории, светятся дорожки от прожекторов и фонарей. Можно любоваться часами. Исключительные закаты",Опубликовано 4 августа 2015 г.
Дальневосточный округ,Приморский край,Владивосток,Развлечения в Владивостоке,Сопка Орлиное гнездо,rpocc,5,"После того, как наконец-то построили Золотой мост и облагородили немного все вокруг, место стало поистине потрясающим. Третье место занимает по красоте обзора. Лучше только с вертолета и с самого высокого пилона Золотого моста. Но первое есть не у всех, а второе - дело вообще-то запрещенное :) Так что, все на Орлиную, Владивосток действительно прекрасен!",Опубликовано 18 ноября 2013 г.
Дальневосточный округ,Приморский край,Владивосток,Развлечения в Владивостоке,Сопка Орлиное гнездо,saha09081960,5,"поднявшись сюда на фуникулере, очень хороший обзор всего Владивостока, как на ладони. Повыше скульптура святым Кириллу и Мефодию.",Опубликовано 4 сентября 2016 г.
Дальневосточный округ,Приморский край,Владивосток,Развлечения в Владивостоке,Сопка Орлиное гнездо,sakril,5,"Сопка Орлиное гнездо - замечательная смотровая площадка, с которой открывается восхитительный вид на город. К сожалению, сопка активно застраивается. Так что скоро о замечательных видах, возможно, придется забыть",Опубликовано 9 февраля 2014 г.
Дальневосточный округ,Приморский край,Владивосток,Развлечения в Владивостоке,Сопка Орлиное гнездо,scrbts,5,"Приятно просыпаться красивый город, Орлиное гнездо - обязательно. Вы можете рассмотреть BAYS, и оба основных моста с этой точки зрения. Кроме того, вы получаете проблеск местного клиентов с отъездом замок, символизирующих вашу любовь.",
Дальневосточный округ,Приморский край,Владивосток,Развлечения в Владивостоке,Сопка Орлиное гнездо,shekvl,5,"Место знаковое-свадьбы,выпускные,туристы и все такое!Отличная панорама на Золотой рог,мост,центр и Эгершельд.",Опубликовано 10 августа 2016 г.
Дальневосточный округ,Приморский край,Владивосток,Развлечения в Владивостоке,Сопка Орлиное гнездо,smaylik,5,"Очень красивый вид, обязательно посетите. Можно сделать отличные фотографии как днем, так и вечером на фоне моря и нового моста. Бухта Золотой Рог предстает во всей своей красе.",Опубликовано 29 марта 2013 г.
Дальневосточный округ,Приморский край,Владивосток,Развлечения в Владивостоке,Сопка Орлиное гнездо,sprutdj,5,"На сопку стоит забраться пешком, чтоб на самом верху глотнуть свежего ветра и обомлеть от открывшейся красоты",Опубликовано 12 августа 2015 г.
Дальневосточный округ,Приморский край,Владивосток,Развлечения в Владивостоке,Сопка Орлиное гнездо,stan_tchoub,5,"Думаю можно спорить о том, с какого места лучший в городе вид на бухту Золотой рог. Я например знаю площадку у ресторана ""Del mar"" или смотровую около гостиницы Азимут. Но однозначно сравнивая фотографии, с разных мест, считаю, что вид с Орлинного гнезда на мост Золотой и бухту самый шикарный! А еще там есть сувенирный магазинчик, в котором можно купить что то на память о городе!
Однако общее состояние смотровой площадки оставляет желать лучшего. Страшная сетка, мусор. Думаю, что столь посещаемое туристами место, администрация могла бы содержать в лучшем виде!",
Дальневосточный округ,Приморский край,Владивосток,Развлечения в Владивостоке,Сопка Орлиное гнездо,sueylt,3,"Это обязательное место. Вы можете выйти на части города и воды отсюда. Также там есть большой сувенирный магазин, расположенный в этом отеле.",Перевод: PROMT
Дальневосточный округ,Приморский край,Владивосток,Развлечения в Владивостоке,Сопка Орлиное гнездо,tanya010390,5,"С сопки открывается отличный вид на мост. Который является визитной карточной Владивостока. Приезжать лучше вечером, когда стемнеет. Так красивее)))",
Дальневосточный округ,Приморский край,Владивосток,Развлечения в Владивостоке,Сопка Орлиное гнездо,ted19902016,5,"Был вечером, открывается впечатляющий вид на бухту Золотой Рог и феноменальный мост Золотой Рог! Это первое место, откуда стоит знакомиться с городом.",Опубликовано 11 сентября 2016 г.
Дальневосточный округ,Приморский край,Владивосток,Развлечения в Владивостоке,Сопка Орлиное гнездо,try-berserk,5,"Во всех городах такого плана стараюсь залезть на какую-нибудь высоту. Сопка не подвела, вид на город оказался очень даже не плохой. Хорошо видно бухту, порт. Побывать стоит.",Опубликовано 30 июня 2014 г.
Дальневосточный округ,Приморский край,Владивосток,Развлечения в Владивостоке,Сопка Орлиное гнездо,urologemy,5,"В ясную погоду - неподражаемый вид!!! С этой точки города такой красоты нет ни в одном городе России!!!
Каскадами уходящий вниз и вширь город, завораживающий Золотой рог с бликами света на его воде ночью, грандиозная армада моста через бухту и перспектива водной глади самого залива Петра Великого.
Тебя треплет ветер, ты вдыхаешь солёный воздух и ощущаешь каждой клеткой своего организма, что никогда и ни на что не способен променять эту точку земного шара.",Опубликовано 4 июня 2015 г.
Дальневосточный округ,Приморский край,Владивосток,Развлечения в Владивостоке,Сопка Орлиное гнездо,vadim01789,5,"С видовой площадки открываются панорамные виды на Золотой мост, мыс Чуркин, полуостров Эгершельд. Идеальное место для наблюдения за салютом",Опубликовано 2 мая 2015 г.
Дальневосточный округ,Приморский край,Владивосток,Развлечения в Владивостоке,Сопка Орлиное гнездо,vu1cano,2,Очень неухоженное место. Хотя местоположение просто обязывает сделать из него визитную карточку города.,Опубликовано 8 января 2020 г.
Дальневосточный округ,Приморский край,Владивосток,Развлечения в Владивостоке,Сопка Орлиное гнездо,wayfarer1070,4,"Добирались с маленьким ребенком 1 год. Сначала на фуникулере. Потом пешком по кольцу и наверх. Было очень ветрено. Виды с площадки красивые, видна вся бухта и Золотой мост. Конечно хотелось, чтобы площадку обновили и обустроили - все-таки визитная карточка Владивостока. Обратно пошли пешком по довольно петляющей автомобильной дороге.",
Дальневосточный округ,Приморский край,Владивосток,Развлечения в Владивостоке,Сопка Орлиное гнездо,wizard86rus,5,"С высоты открывается отличный вид на город, бухту ""Золотой рог"" и мост через нее. Красиво как днем, так и вечером.",Опубликовано 12 июня 2016 г.
Дальневосточный округ,Приморский край,Владивосток,Развлечения в Владивостоке,Сопка Орлиное гнездо,xuxa1,5,"Пожалуй, главная видовая площадка Владивостока. Красиво, вдохновляюще, шикарный вид на Бухту. Всех сюда привожу, когда приезжаем",Опубликовано 24 ноября 2021 г.
Дальневосточный округ,Приморский край,Владивосток,Развлечения в Владивостоке,Сопка Орлиное гнездо,zukova,5,"Очень красивый вид сверху, который раскрывает тонкую и изысканную красоту города. По-моему, не олин турист мимо этого места не проходит.",Опубликовано 25 сентября 2017 г.
Дальневосточный округ,Приморский край,Владивосток,Развлечения в Владивостоке,Сопка Орлиное гнездо,Александр И,5,"Прекрасный вид с сопки на Золотой мост и бухту, проход к арке счастья. Посещение магазина сувениров. Фотографирование на фоне города.",Опубликовано 29 мая 2017 г.
Дальневосточный округ,Приморский край,Владивосток,Развлечения в Владивостоке,Сопка Орлиное гнездо,Александр С,5,Если вам захотелось вкусно покушать и есьь время - направляйтесь в Орлиное гнездо. Доехать можно на фунинулере и пять минут пешком. При этом вам будет открываться вид бухты Золотой рог. А о панораме с ресторана Орлиное гнездо - отдельный разговор. В это место желательно приходить в ясную погоду. Когда набегают облака - сидишь за столиком как в молоке.,Опубликовано 15 декабря 2015 г.
Дальневосточный округ,Приморский край,Владивосток,Развлечения в Владивостоке,Сопка Орлиное гнездо,Александра К,5,"Стоя на видовой площадке сопки Орлиное гнездо, ощущаешь, как морской ветер бьет в лицо. С площадки открывается чудесный вид на бухту Золотой Рог и Золотой мост. Недавно открытый памятник первопечатникам Кириллу и Мефодию, привлекает толпы туристов, свадебные кортежи приезжают сюда, чтобы сфотографироваться. Прекрасное место для отдыха и фотосессий",Опубликовано 25 октября 2015 г.
Дальневосточный округ,Приморский край,Владивосток,Развлечения в Владивостоке,Сопка Орлиное гнездо,Алексей Б,5,"Здесь находится одна из лучших смотровых площадок города, недалеко от центра. Правда, пешком идти минут 30 в гору, хотя можно легко добраться и на общественном транспорте, и на машине. Часто летом здесь можно застать свадьбу, это почти обязательно место для такого мероприятия во Владивостоке.
Ну и вообще здесь есть что посмотреть, посетить стоит обязательно.",Опубликовано 7 июля 2016 г.
Дальневосточный округ,Приморский край,Владивосток,Развлечения в Владивостоке,Сопка Орлиное гнездо,Анастасия М,5,"Смотровая площадка, с которой снимают новости для новостей 1-го канала 😂 на самом деле, площадка удобная очень, открывается обалденный вид. Путешественникам не знающим город совсем - прекрасное место, чтобы начать изучать этот замечательный город.",
Дальневосточный округ,Приморский край,Владивосток,Развлечения в Владивостоке,Сопка Орлиное гнездо,Анастасия С,5,"Я думаю, это очень романтическое место)Это место открывается красивый вид Владивостока. Там всегда много людей. Сильные что часто дуют, но это не большая плата за красивый вид",Перевод: PROMT
