Дальневосточный округ,Сахалинская область,"Сахалин,Южно-Сахалинск",Развлечения в Южно-Сахалинске,"Спортивно-туристический комплекс ""Горный воздух""",stan_tchoub,5,"Невероятные виды со смотровых площадок! Отличный сервис начиная с проката и заканчивая инструктором. Удивительная природа! Впервые здесь встали на лыжи. Все просто супер. Сегодня поднялись на самый верх в открытой кабинке - просто восторг от такой поездки. А потом серпантин вниз... Когда идет снег, ты едешь по склону, тишина и только скрип снега под лыжами-такие эмоции я помню только в далеком детстве, это счастье в чистом виде!",
Дальневосточный округ,Сахалинская область,"Сахалин,Южно-Сахалинск",Развлечения в Южно-Сахалинске,"Спортивно-туристический комплекс ""Горный воздух""",timey_spb,5,"При стоимости сопоставимой с одним днем катания в Питере, Горный воздух позволяет покататься в пухляке и вдоволь насладиться внетрассовым катанием. Думаю, что на 2-3 дня - самое то. На больший срок гурманам будет не интересно.",Опубликовано 28 мая 2016 г.
Дальневосточный округ,Сахалинская область,"Сахалин,Южно-Сахалинск",Развлечения в Южно-Сахалинске,"Спортивно-туристический комплекс ""Горный воздух""",valle v,5,"Много трасс разной сложности, есть фуникулер, в кабинках куда комфортнее, чем на бугеле подыматься. Есть кафешки. Минусы: комфорта маловато, нет нормальных санузлов, нет комнат для переодевания, камеры хранения непонятно где и есть ли вообще. Культура отдыхающих низкая- носятся сильно, могут врезаться.И очереди к кассам и кабинкам.",Опубликовано 7 февраля 2014 г.
Дальневосточный округ,Сахалинская область,"Сахалин,Южно-Сахалинск",Развлечения в Южно-Сахалинске,"Спортивно-туристический комплекс ""Горный воздух""",vesna271,5,"Я вижу Горный воздух каждый день из окна. Бываю там минимум раз в неделю на выходные, зимой чаще. В этом сезоне сдали трассу Динамо и Спортивную-2. Наши трассы в-основном, синие и красные. К черным, наверное, можно отнести только часть Армейки и два крутяка на Южном склоне, не считая части Спортивной. Мы очень любим бывать там, много хороших эмоций, свежего воздуха. Если переоборудуют подъемник с Южного и Восточного, будет вообще великолепно!",Опубликовано 14 февраля 2014 г.
Дальневосточный округ,Сахалинская область,"Сахалин,Южно-Сахалинск",Развлечения в Южно-Сахалинске,"Спортивно-туристический комплекс ""Горный воздух""",vnelya,5,"Разнообразные трассы, которые подходят как для чайников (для меня), так и для тех, кто катается хорошо! Удобная и современная гондольная доорога- подъемник- пока едешь- любуешься видами, защищенный от ветра. Снег хорошо утрабованный и жесткий- что для часто падающих чайников- больновасто))) Но все равно все понравилось!!",Опубликовано 16 сентября 2013 г.
Дальневосточный округ,Сахалинская область,"Сахалин,Южно-Сахалинск",Развлечения в Южно-Сахалинске,"Спортивно-туристический комплекс ""Горный воздух""",voloshina_larisa,5,"Бывая в Южно-Сахалинске я всякий раз возвращаюся на горный воздух. В разное время года он разный, летом можно гулять по лесу, любуясь окружающими пейзажами, осенью любоваться многообразием красок, зимою это обязательно встреча с друзьями в кафе ""Сугроб"", здесь можно выпить стакан горячего глинтвейна, съесть обалденные блинчики, просто пообщаться и покувыркаться в сугробах, даже если вы не катаетесь на лыжах и сноубордах. развлечения найдутся для всех.",Опубликовано 23 декабря 2013 г.
Дальневосточный округ,Сахалинская область,"Сахалин,Южно-Сахалинск",Развлечения в Южно-Сахалинске,"Спортивно-туристический комплекс ""Горный воздух""",zhuk-11,4,"Каждый год прилетаю сюда. Здесь есть где покататься и начинающим, и продвинутым. мягкий климат, красивая природа. Единственное, что не нравится, это то, что не все склоны работают каждый день. И если я прилетаю на 7 дней, то половину из них приходится кататься на ограниченном количестве склонов, а это приедается. И пара лучших склонов имеет только шваберный подъемник и там постоянно очередь. А вообще я люблю это место. Для местных это просто рай.",Опубликовано 12 июля 2015 г.
Дальневосточный округ,Сахалинская область,"Сахалин,Южно-Сахалинск",Развлечения в Южно-Сахалинске,"Спортивно-туристический комплекс ""Горный воздух""",Александр L,2,"Первый раз приехал покататься на ""Горный Воздух"", и уверен, что последний. И всех своих друзей оберегу от такого необдуманного шага. В кратце опишу свои впечатления о посещении столицы Сахалинской области: от общения с островетянами только приятные впечатления. А вот о ""ГВ"" этого не скажешь. Здесь сплошная совдепия, трассы не подготовлены, и самое интересное, что и готовить их особо никто не собирается. Ободранные до камней склоны, лыжи жалко, думали,что выпадет снег и будет здорово, не тут-то было. После снегопада никто и не подумал ретрачить склоны, Главный принцип видимо экономия топлива, сами горнолыжники укатают как-нибудь. А ещё есть такая уникальная вещь - скайпас (абонемент на несколько дней катания): везде списываются дни катания по активации карты на горе, а на ""ГВ"" по календарным дням, не зависимо ни от чего. Например по каким-то причинам ""ГВ"" начал работу только в 12.00 дня, или 31 декабря у них короткий день, или не открыли южный склон. Если человек например простыл и пару дней не вышел на гору, услуга ""ГВ"" не оказывалась, но оплата за не оказанную услугу снята - это по нашему!!! Потенциал у горы конечно хороший, ей бы ХОЗЯИНА. К сожалению здесь остров и видимо в администрации и горы и острова сидят временщики, их задачи хапнуть сегодня, а не развивать на года. Поэтому есть страны которые живут за счет туризма, а к нам едут только за экзотикой, но за экзотикой едут единицы..... Поездка на ""ГВ"" с перелетом, гостиницей, питанием и т.д, и т.п. дешевой не назовешь. Поэтому и разочарование......",Опубликовано 1 января 2014 г.
Дальневосточный округ,Сахалинская область,"Сахалин,Южно-Сахалинск",Развлечения в Южно-Сахалинске,"Спортивно-туристический комплекс ""Горный воздух""",Александр Б,4,"Катаюсь на Горном давно.
По интенсивности развития в последние годы комплекс уступает наверное лишь Сочи (могу ошибаться). В рамках развития ТОР ставки сделаны на максимальное освоение соседних с горой Большевик (это основная вершина с которой виден город) вершин с нарезкой на них склонов и постройкой современных подъемников. К сожалению инфраструктура (оснежение, кафе и гостиницы у подножия склонов или на них, кол-во ратраков; туалеты есть не на всех площадках) похоже не успевает за строительством трасс и подъемников. Строительство зачастую (не всегда) как и принято у нас в стране ведётся традиционно - бездумно и безобразно (сроки - темпы, большие деньги и связанные с ними так далее...). На этом о плохом и закончу.
В 2018-2019 сезоне с открытием горы Красной и входной группы комплекс без преувеличения станет претендовать на 2-3 место по России.
Для не искушённых туристов склоны уже достаточно разнообразны и их количество по крайней мере на уровне самых известных горнолыжек России (Сочи в расчёт не беру), а в грядущем 18-19 сезоне откроют новые склоны на горе Красной...
Подъемники:
Западный - основной подъемник с города, он разделён на две половины, нижняя часть кабинки на 8 человек, верхняя те же кабинки чередуются с креслами на 6 чел.;
Южный - кресла на 4 человека;
Северный - кресла на 4 человека.
Все кресельные подъемники с ветрозащитной (хлебница) и даже вроде как с подогревом (кроме Западного). В 2018-2019 сезоне заработает подъемник на вершину горы Красной, который будет длинной в районе 2000 метров и с подогревом, вместе с ним откроются и склоны на Красной.
На комплексе есть красные и черные трассы, которые возможно не совсем соответствую цветовой маркировке, но радует, что все они достаточно широкие. К примеру Южный склон отмечен красным из-за пары крутых участков на нём, а по большей степени он синий. Но вот северные трассы уж точно чёрные.
Освещение имеется только на Западном склоне и Серпантине. Надеемся, что к 18-19 сезону осветят ещё какие-нибудь склоны.
Подготовка склонов в 2017-2018 сезоне была на четвёрку. Часто бывает так, что ночью или под утро выпадает снег и приходящие ближе к обеду туристы сетуют на не подготовленные для них трассы. Надо понимать, что если выпал пухляк и если его даже утром тромбонуть ратраком он при температуре даже -20 (не говоря уже о -3, -7 гр.) всё равно не успеет задубеть и трассы раскатаются в хлам максимум за пару часов, а ратрачить трассы средь бела дня не так уж удобно и безопасно для самих катющихся. Для таких случаев и нужны универсальные (приближенные к таковым) лыжи, которые позволяют комфортно кататься на расколбашеных склонах, и не надо корчить из себя спортсмена (если Вы таким не являетесь), притаскивая цеховые лыжи в заранее не определённые условия. Кстати, спортсмены и эксспортсмены охотнее катаются по дубовой трассе на которую мало кому из туристов нравиться попадать, а вот на более комфортной для большинства туристов трассе цеховая лыжа уже начинает зарываться и становиться угрюмой. После снегопадов специально для любителей целины оставляют часть склонов не ратраченными. В верхней части северных склонов был лёд, скорее всего специально проливали снег водой, что бы его не выдувало. Лучшим склоном в мои катания по малочисленности и состоянию был Ски-кросс, но часто мешал ветер, а в холод с ветерком под конец хотелось поскорее попасть в кабинку подъемника. На Южном склоне практически всегда (в моё присутствие) был аншлаг по сравнению с другими склонами. Восточный склон интересен новичкам освоившим повороты и прогрессирующим, а еще тем кто любит недалеко съехать с трасы в лес.
Порадовало в прошлом сезоне и отсутствие очередей на подъемник, они стали исключением. Народу на склонах по сравнению с прошлыми годами стало в разы больше, но подъемники справлялись на ура. Даже на Южном подъемнике, ни разу не стоял более 10 минут в часы пик, хотя при подъезде к турникету очередь казалась довольно приличной. На средней площадке Западного склона и на Сервере вообще отдышаться толком не успеваешь как ты уже на верху. После открытия Красной думаю очередей вообще не должно быть как таковых, хотя возможно на Красной и будет ажиотаж, по крайней мере, по началу.
Дела с питанием на горе тянут на не твёрдую четверку. Если не привередничать, то поесть вполне можно нормально. Сам на горе в основном перекусываю, но бывает если собираюсь задержаться на гое подольше то и горячее ем. Еда вполне съедобная и вкусная. Цены на горе естественно выше чем в городе, но в пределах разумного.
В ближайшее время должно начаться строительство подъемника на северном склоне горы Красной и освоение следующей вершины горы Острая с сооружением у её подножья второй входной группы с южной стороны города в районе где находится аэропорт. Гора Красная выше горы Большевик примерно на 200 метров, а Острая выше Красной примерно на столько же. Поэтому высота склонов и перепад высот комплекса увеличиться более чем на 50%.",
Дальневосточный округ,Сахалинская область,"Сахалин,Южно-Сахалинск",Развлечения в Южно-Сахалинске,"Спортивно-туристический комплекс ""Горный воздух""",Александр Д,2,"Зима безснежная конечно, но склонов можно было подготовить и побольше. В работе 3 трассы. Две из которых закрыты полдня для соревнований или на детских тренировках.",Опубликовано 24 февраля 2019 г.
Дальневосточный округ,Сахалинская область,"Сахалин,Южно-Сахалинск",Развлечения в Южно-Сахалинске,"Спортивно-туристический комплекс ""Горный воздух""",Александр Л,5,Хорошее место провести свободное время в тёплую ясную погоду даже летом. Рекомендую к помещению.......,Опубликовано 23 августа 2018 г.
Дальневосточный округ,Сахалинская область,"Сахалин,Южно-Сахалинск",Развлечения в Южно-Сахалинске,"Спортивно-туристический комплекс ""Горный воздух""",Александр С,4,Хороший комплекс и гора. Прокат горный воздух и инструктор были отличными. Подъемник дороговат на мой взгляд для разовых абонементов.,
Дальневосточный округ,Сахалинская область,"Сахалин,Южно-Сахалинск",Развлечения в Южно-Сахалинске,"Спортивно-туристический комплекс ""Горный воздух""",Александра М,5,"отличный отдых и летом и зимой. Летом вело даунхилл и просто пешие прогулки, зимой катание на лыжах и сноубордах. Рядом отличные места для любителей фрирайда, на горе есть кафешки, можно перекусить и выпить чаю или что-нибудь покрепче.",Опубликовано 29 мая 2014 г.
Дальневосточный округ,Сахалинская область,"Сахалин,Южно-Сахалинск",Развлечения в Южно-Сахалинске,"Спортивно-туристический комплекс ""Горный воздух""",Алексей М,5,"Гора, покрытие, трассы, подъёмники - без нареканий. Супер впечатление, мне очень понравилось. Руководству стоит задуматься над реорганизацией системы проката, организовать камеры хранения , сделать тёплую чистую раздевалку / комнату для отдыха. Пересмотреть свой взгляд на ""инструкторов"". Это ужасно. Списки на бумажке, инструктору болтаются в здании и ждут когда их кто нибудь подберёт. Их профессионализму нет претензий. Прокат оборудования - это ужас . Какой то Хаос, ищут эту мелочь, сдачу, все дёргаются. Касса. Отдельное замечание. Ребята, ну если есть очередь в которой можно стоять 40 минут и более, значит нужно как минимум что то менять - персонал, систему начисления , количество касс. Обозначьте уже нормальным табличками номера касс. Обозначьте что да где можно делать. Подъёмники супер. Быстро. Удобно. Хоть и очередь, но двигается она хорошо. К трассам как уже сказал только +. Очень понравилось. Вид с горы супер.",Опубликовано 4 января 2016 г.
Дальневосточный округ,Сахалинская область,"Сахалин,Южно-Сахалинск",Развлечения в Южно-Сахалинске,"Спортивно-туристический комплекс ""Горный воздух""",Алексей С,5,"Качественные подъёмники, великолепные виды, есть кафе, замечательное место для осенних прогулок, город виден как на ладони.",Опубликовано 24 декабря 2017 г.
Дальневосточный округ,Сахалинская область,"Сахалин,Южно-Сахалинск",Развлечения в Южно-Сахалинске,"Спортивно-туристический комплекс ""Горный воздух""",Алена К,5,"Комплекс приведет в восторг не только любителей лыж и сноуборда, но и людей, получающих удовольствие от пеших прогулок. Канатная дорога имеет две площадки остановок. На первой площадке есть кафе, но там нам не так нравится, как на второй площадке, где есть не только два кафе, но и площадка, с которой открывается потрясающий вид на город.
От верхней площадки ведет несколько дорог вниз в город, поэтому подняться можно на канатке, а спуститься в удовольствие пешком!",Опубликовано 25 мая 2014 г.
