zone,region,city,att_type,att_name,author,rating,comment,comment_date
Дальневосточный округ,Приморский край,Владивосток,Развлечения в Владивостоке,Океанариум Аквамир,Vitabelka,1,"Простые аквариумы, в трети плавают обычные рыбы (форель радужная и т.п.). В центре в круговом аквариуме, в котором нет ничего, кроме воды, плавают огромный осетр и тунец. Неприятное зрелище.
Нет даже осьминога.
На втором этаже жуткая пыльная коллекция заспиртованных червей, засушенных креветок и чучел птиц и животных...
Это худшее место, которое мы посетили во Владивостоке. Не тратьте время и деньги...
В магазине при океанариуме рыбки гораздо красивее и интереснее, там и скат, и рыбки клоуны (из мультика Немо) и еще много интересного))) при этом совершенно бесплатно )",Опубликовано 15 апреля 2016 г.
Дальневосточный округ,Приморский край,Владивосток,Развлечения в Владивостоке,Океанариум Аквамир,VitekKalugin,3,"Интересное место, есть на что посмотреть, особенно для детей, но как-то темнова-то на первом этаже, что даже толком некоторых рыбок не рассмотреть.",Опубликовано 29 августа 2016 г.
Дальневосточный округ,Приморский край,Владивосток,Развлечения в Владивостоке,Океанариум Аквамир,Vovka-dobraya_dusha,5,"то что касается аквариумов, без сомнения проигрывает по подаче Бангкоку, Барселоне, да, даже Калиниграду, выигрывая разве что у ""аквариума"" Эль Гуны. зато диковинных рыб и видов фауны, пожалуй, тут даже побольше, можно увидеть, например, того же ""зевающего"" уссурийского осетра или дальневосточного краба в боевой стойке. ну, сделайте более внятные, расположеные на удобной высоте и подсвеченые таблички с подписями - этоже совсем не сложно.
труды работ научных сотрудников по исследованию мира обитателей океана на втором этаже экспозиции, конечно, впечатляют. собрана очень внушительная коллекция.
может быть, чуть-чуть не хватает современных технологий: интерактива, мультимедии и прочих wi-fi, хотя и камень с надписью ""не брать"" в кассе тоже может повеселить посетителей",Опубликовано 12 марта 2013 г.
Дальневосточный округ,Приморский край,Владивосток,Развлечения в Владивостоке,Океанариум Аквамир,Yulya199,5,океанариум отличное место для посещения с детьми но цена завышена . Но побывав во Владивостоке и не посетить это не возможно .,Опубликовано 14 августа 2015 г.
Дальневосточный округ,Приморский край,Владивосток,Развлечения в Владивостоке,Океанариум Аквамир,Yury M,4,"Океанариум достаточно небольшой, но интересный. В нем собраны основные представители морской флоры и фауны, обитающие в Японском море. Есть и очень крупные экземпляры. Океанариум расположен недалеко от центральной набережной Владивостока, поэтому при ее посещении целесообразно зайти и в океанариум. Рекомендуется посетить вместе с детьми.",Опубликовано 9 августа 2014 г.
Дальневосточный округ,Приморский край,Владивосток,Развлечения в Владивостоке,Океанариум Аквамир,Zakhar K,4,"Ходил туда с родителями, мне понравилось. Много рыбок, есть на что посмотреть) Особенно впечатлили огромные сомы. Моей сестренке очень понравилось)",Опубликовано 14 января 2016 г.
Дальневосточный округ,Приморский край,Владивосток,Развлечения в Владивостоке,Океанариум Аквамир,adm1916,5,"Находится рядом с парком культуры и отдыха ""Карусель"" на набережной. Очень большое разнообразие морских обитателей. Рядом с аквариумом краткое описание обитателей. На вторм этаже размещен музей. Советую не торопится, внимательно рассматривать кто находится в аквариумах, потому что когда подходишь не сразу рассмотришь. Посещение платное. Не пожалеете. Бывают дополнительные выставки, например бабочек.",Опубликовано 1 января 2014 г.
Дальневосточный округ,Приморский край,Владивосток,Развлечения в Владивостоке,Океанариум Аквамир,alexxx1993,4,"Находится на всеми любимой городской набережной. Как водится в океанариумах, там присутствует большое разнообразие не только рыб, но и других обитателей морей и океанов. Сходить стоит, особенно с детьми, которым будет интересно и забавно вдвойне)",Опубликовано 13 июня 2014 г.
Дальневосточный округ,Приморский край,Владивосток,Развлечения в Владивостоке,Океанариум Аквамир,b_firuza_n,3,"В целом неплохо, но ожидала большего. Несколько залов, рыбки от мало до велика. Цена если не изменяет память в районе 200-300 рублей. Не понравилось освещение, особенно что касается больших рыб. Понравился аквариум с огромными осетрами. На втором этаже музей. на первый этаж уйдет не более 15 минут ну и второй этаж займет примерно столько же, если вы конечно же не будете углубляться в изучение скелетиков.",
Дальневосточный округ,Приморский край,Владивосток,Развлечения в Владивостоке,Океанариум Аквамир,cinephil,4,"Ждём скорого открытия (летом 2014?) нового, настоящего океанариума на о.Русский. А пока то, что есть. 300 руб. за вход - это многовато, хотя удовольствие того стоит. На первом этаже обращают внимание гигантские амурские осётры - точно акулы какие-нибудь. Стоит памятник исчезнувшей морской корове. На 2-ом этаже - какая-то натуральная кунсткамера, где собраны эмбрионы акул, моржа, гербарий водорослей...не думаю, что всем это будут приятно смотреть, но для кругозора более чем достаточно. На выходе можно купить понравившихся рыбок, комбикорма, разл.аква-прибамбасы и аквариумы.",Опубликовано 8 мая 2014 г.
Дальневосточный округ,Приморский край,Владивосток,Развлечения в Владивостоке,Океанариум Аквамир,derzkaya_vip,5,"ездила с дочкой (4 года), ей очень понравилось, экспонаты рыбок, морских котиков черепашки и прочая живность. на выходе нам подарили магнитик - милота",Опубликовано 23 декабря 2013 г.
Дальневосточный округ,Приморский край,Владивосток,Развлечения в Владивостоке,Океанариум Аквамир,djon27,4,"Маленькая коллекция живых рыб, поразили только калуги в большом аквариуме. Очень душно в помещениях, думаю вентиляция там вообще не работает, к концу посещения даже стало немного плохо.",Опубликовано 1 февраля 2016 г.
Дальневосточный округ,Приморский край,Владивосток,Развлечения в Владивостоке,Океанариум Аквамир,dmitryrus2016,3,"Мало рыб. Мало, что поражает. Если только акулы. С детьми идти стоит. Но если ты уже взрослый и был где-нибудь за границей в океанариумах, то этот не впечатлит. Сувениры дорогущие.",Опубликовано 15 марта 2016 г.
Дальневосточный округ,Приморский край,Владивосток,Развлечения в Владивостоке,Океанариум Аквамир,elena200975,4,"Впечатлений особых нет, на первом этаже большие аквариумы, есть даже крокодильчик, но помещение какое-то темное, небольшое. Второй этаж муляжи разные, чучела морских животных. Мое мнение , посетить этот океанариум одного раза достаточно.",Опубликовано 13 сентября 2016 г.
Дальневосточный округ,Приморский край,Владивосток,Развлечения в Владивостоке,Океанариум Аквамир,elenaf75,4,"Потрясли тюлени, порадовали еноты дручуны, но очень душно. Бедные измученые животные, в которых вечно тыкают, видела в интернете смешную картинку-фотографию. а ведь это и правда наклеено на стекле животных в этом океанариуме. Есть там такое место, где открытый аквариум, хорошо хоть не пытаются никого там поймать и выкинуть туда ничего. Там мило и даже чуточку романтично, но жутко дорого",Опубликовано 17 апреля 2013 г.
Дальневосточный округ,Приморский край,Владивосток,Развлечения в Владивостоке,Океанариум Аквамир,ggoleon,4,"Новый океанариум наполнен не только рыбами и другими жителями океана. Он полон новых технологий которые дают возможность по новому воспринимать Океанариумы. Не смотря на сложности в покупке билета и высокие цены рекомендую потратить 2-3 часа своей жизни и получить море впечатлений, знаний и просто удовольствия.",
Дальневосточный округ,Приморский край,Владивосток,Развлечения в Владивостоке,Океанариум Аквамир,ikar1953,3,"Думаю, это будет интересно детям младшего возраста. В большом аквариуме пара осетров, остальное - аквариумные рыбки.",Опубликовано 29 сентября 2017 г.
Дальневосточный округ,Приморский край,Владивосток,Развлечения в Владивостоке,Океанариум Аквамир,kajser27,3,"Это располагается в центре города около Стадиона и Крепости. Входная плата в размере 250 рублей.Персонал, не настолько доброжелательный, но насколько я видел, это - российский путь. Океанарий не очень большой, и вестибюль довольно паршивый, больше сувенирных магазинов (драгоценности даже), чем выставки. Но у главного зала есть некоторый довольно интересный материал, который я никогда не видел прежде, такие как кит, акула и запечатываю яйца и эмбрионы. Так же как некоторые красивые странно большие крабы я не хотел бы встречаться. И резервуар с довольно большим kalugas и осетрами.В целом, не очень, но если у вас есть час, чтобы убить, почему бы не потратить его здесь.",Перевод: PROMT
Дальневосточный округ,Приморский край,Владивосток,Развлечения в Владивостоке,Океанариум Аквамир,kotyshev68,4,"Само по себе место интересное, но на один раз!!! Даже через пару лет нет изменений , либо они не значительные и незаметные для посетителей . Один раз ребенка погулять , пойдет))))",Опубликовано 25 февраля 2014 г.
Дальневосточный округ,Приморский край,Владивосток,Развлечения в Владивостоке,Океанариум Аквамир,kseniy_fedorov,3,"Ожидала от Владивостокского океанариума намного больше! для города расположенного в стихии воды, океанариум уж очень обыкновенный! маленький и ничем не примечательный!намного интереснее на дне амурского залива, если понырять с маской!",Опубликовано 5 октября 2014 г.
Дальневосточный округ,Приморский край,Владивосток,Развлечения в Владивостоке,Океанариум Аквамир,olga_grivanova,4,"Хорошее место для посещения с детьми.Океанариум небольшой, но познавательный.Обязательно посетите его во время прогулки по набережной.Приятных впечатлений!",Опубликовано 1 февраля 2014 г.
Дальневосточный округ,Приморский край,Владивосток,Развлечения в Владивостоке,Океанариум Аквамир,panas2009,1,"Это не стоит вообще таких кошмарных денег, которые просят на входе.
Более того, насколько мало там экспонатов, что обалдеть можно!
Куда больше океанариум на острове Русском! Этот океанариум надо точно закрывать!",Опубликовано 22 апреля 2019 г.
Дальневосточный округ,Приморский край,Владивосток,Развлечения в Владивостоке,Океанариум Аквамир,sunshine_gold,5,"Океанариум находится в центре города на набережной. Для детей на мой взгляд это лучшее место развлечений. Множество рыб и морских жителей, на которых интересно взглянуть даже взрослым. Он не очень большой по территории.",Опубликовано 27 марта 2014 г.
Дальневосточный округ,Приморский край,Владивосток,Развлечения в Владивостоке,Океанариум Аквамир,travelsofchris,2,"Во всей честности мы дали этому визит, основываясь на близких постоянно плохих отзывов об этом отеле (конечно, это не могло быть Таким плохим? ) Я жалею, что это действительно был очень плохим.Должно быть, проходило своего рода ремонт, потому что у нас в отеле, кажется, был доступ в лобби, вторичному номер в задней части отеля и коридору наверху, который был наполовину пуст.lowlight был баком различными крокодила, который был настолько мал, крокодил пришлось обернуть хвост вокруг себя. Сувенирный магазин был больше, чем ведро крокодила. Другие резервуары было рыбу, что мы были уверены, были мертвы. Вода в основном была грязной. Были крошечные баки, наши одну большую рыбу, которые были такими маленькими, рыба, не могли переехать в них и другие огромные баки, наши несколько золотых рыбок. Коридор рептилии вообще был лучшим состояние, хотя наполовину закрылся на 'ремонт' (мы не видели никаких доказательств нет настоящей работы, потягивая место).Персонал на входной двери был довольно дружелюбным (хотя персонал превзошел все посетителей - мы были единственными людьми там в течение всех 45 минут, что мы там были). Я поставила 2 звезды кстати, потому что это было ужасно, это был вид приятных.Вход составлял 350 рублей.",Перевод: PROMT
Дальневосточный округ,Приморский край,Владивосток,Развлечения в Владивостоке,Океанариум Аквамир,wiktorina,5,"Очеень нравиться.Раньше конечно больше людей ходило.Но с каждым разом все меньше и меньше.Приятно посещать такие места.Хотелося конечно же чтоб было побольше рыбок,но пока радуемся тем что есть.Особенно кракодилом,который постоянно спит.Ахаха)Приходите,понравиться)",Опубликовано 7 января 2014 г.
Дальневосточный округ,Приморский край,Владивосток,Развлечения в Владивостоке,Океанариум Аквамир,Александр А,3,"можно убить время но до уровня заграничных океанариумов не дотягивает. экспозиции бедноваты, экземпляров маловато, в общем все сделано на среднем уровне для семейных пар с детишками.",Опубликовано 10 июня 2014 г.
Дальневосточный округ,Приморский край,Владивосток,Развлечения в Владивостоке,Океанариум Аквамир,Александр В,3,"В целом надо отдать должное персоналу за работу по поддержанию на должном уровне экспозиций. Смотреть надо все и чем больше тем лучше- иначе вас ждет дом2. Жду открытие нового ОКЕАНАРИУМА и поверьте там будет что посмотреть. Хорошая задумка и жителям Владивостока и приморья повезло , что у них скоро появится очередное место где душа будет радоваться в том числе и за нашу страну!",Опубликовано 11 июля 2015 г.
Дальневосточный округ,Приморский край,Владивосток,Развлечения в Владивостоке,Океанариум Аквамир,Алёна П,4,"Одно из самых интересных мест во Владивостоке. В большом зале открывается панорама на огромный аквариум в котором живут гигантские рыбки (осётр, карп и пр.), а разнообразных глубоководной фауны пугает и восхищает. Обязательное место для посещения семьей или компанией друзей, для общего развития и получения непередаваемых ощущений. Ставлю хорошо, жаль что нет галереи с видом в настоящее море, а ведь оно так близко.",Опубликовано 10 декабря 2014 г.
Дальневосточный округ,Приморский край,Владивосток,Развлечения в Владивостоке,Океанариум Аквамир,Анжелика Т,5,"Отлично, жалко не попали в дельфинариум. От остановки до самого океанариуму ходит автобус, что очень удобно, когда на улице жара. Есть где погулять.",
Дальневосточный округ,Приморский край,Владивосток,Развлечения в Владивостоке,Океанариум Аквамир,Арсен Бугулов,2,"Цена билета не дешевая, а смотреть по сути не чего. Пару маленьких аквариумов, помещение маленькое при большом скоплении людей ходить не возможно, а к экспонатом и вовсе не подобраться. Можно сходить максимум один раз, больше там делать нечего.",Опубликовано 10 декабря 2014 г.
