Дальневосточный округ,Хабаровский край,Хабаровск,Развлечения в Хабаровске,Парк Муравьева-Амурского,123443215789,1,"Ура!В Хабаровск вернулось колесо обзора.Вся наша семья очень любит парк Муравьёва -Амурского и очень обрадовались установке колеса обзора.На ближайших выходных рванули туда.Разочарованию не было предела,с колеса кроме Амура и крыш города,не видно ничего.Конечно Амур прекрасная река и у нас замечательная природа вокруг,но мы то рассчитывали как в старые добрые времена осмотреть Хабаровск с высоты птичьего полёта.Не вышло.Разочарование было таким сильным,что даже другие аттракционы не радовали и мы не сговариваясь дружно пошли на выход.",Опубликовано 10 июля 2015 г.
Дальневосточный округ,Хабаровский край,Хабаровск,Развлечения в Хабаровске,Парк Муравьева-Амурского,184ANNASUN,5,"Парк продолжают облагораживать. Сейчас в нем есть: обозрения, зимой каток, летом музыкальный напольный фонтан, большое количество качелей, лавочек, фуд зон, велосипедные дорожки и многое другое!",Опубликовано 25 октября 2017 г.
Дальневосточный округ,Хабаровский край,Хабаровск,Развлечения в Хабаровске,Парк Муравьева-Амурского,197206292017,5,"Иногда хочется побродить в полном одиночестве!
Интересный дизайн качелей! Набережная, фонтан, инсталляции! Все располагает к отдыху! Не спешному и приятному время препровождению! Около фонтана играют дети! Много гуляющих, но не мешающих прогулке! Подростки катаются на роликах и скейтбордах! Все размеренно и спокойно! Это бывает редко!",Опубликовано 27 августа 2018 г.
Дальневосточный округ,Хабаровский край,Хабаровск,Развлечения в Хабаровске,Парк Муравьева-Амурского,686xox,4,"Хорошее место для прогулки, вдвоем, с семьей, да и просто пройтись вечерком)Прекрасный вид на величественный Амур и Соборную площадь. катание на роликах будет не очень приятным, все уложено брусчаткой.",Опубликовано 29 ноября 2013 г.
Дальневосточный округ,Хабаровский край,Хабаровск,Развлечения в Хабаровске,Парк Муравьева-Амурского,776MariNH,5,"Парк привлекателен как место отдыха в любое время года. Летом здесь очень оживленно, разносится дразнящий запах шашлыка, гуляют пары, семьи с детьми, приверженцы здорового образа жизни катаются на роликах, велосипедах, или занимаются спортивным бегом. Зимой парк хорош для неспешных прогулок. В парке несколько памятников, имеющих историческое значение, и несомненным его украшением является величественный памятник генерал-губернатору Восточной Сибири графу Н.Н. Муравьеву-Амурскому. Еще одно знаковое место в парке - Амурский утес, в здании которого размещена музейная экспозиция. Терраса утеса - замечательная смотровая площадка, с неё открываются панорамные виды на Амур и Хабаровск. И конечно же, природный ландшафт, подчеркивающий красоту дальневосточной природы, - главное украшение парка.",Опубликовано 26 мая 2015 г.
Дальневосточный округ,Хабаровский край,Хабаровск,Развлечения в Хабаровске,Парк Муравьева-Амурского,926Dmitry,4,Парк меня очень впечатлил. Очень приятное место отдохнуть после трудного рабочего дня. Удивили фигуры из льда. Замечательное место.,Опубликовано 18 февраля 2014 г.
Дальневосточный округ,Хабаровский край,Хабаровск,Развлечения в Хабаровске,Парк Муравьева-Амурского,A B,5,"Парку не намного меньше лет,чем самому городу. Он несколько раз перестраивался, менялось назначение отдельных зон. Но в том виде. какой он сейчас, действительно выглядит прекрасно. Парк расположен на крутом берегу Амура, что придаёт ему особую живописность. Прекрасная смотровая площадка на реку при входе в парк, дорожки по изменяющемуся рельефу, лестницы к реке и ""жемчужина"" парка - утёс, который является символом города. Парк прекрасен в любое время года. Летом на открытой эстраде проходят выступления различных творческих коллективов, включая Дальневосточный симфонический оркестр.",Опубликовано 9 июля 2015 г.
Дальневосточный округ,Хабаровский край,Хабаровск,Развлечения в Хабаровске,Парк Муравьева-Амурского,ARP1961,4,"Красивый просторный и безалкогольный (?) парк. Лицо Хабаровска, очень милое. Но, сильно контрастирует с самим городом. Одно из немногих must see в Хабаровске..",
Дальневосточный округ,Хабаровский край,Хабаровск,Развлечения в Хабаровске,Парк Муравьева-Амурского,AlekseyV,3,"Температура -20, но сильный ветер в феврале и по ощущениям -33. Лестница к коллонаде на реконструкции, колесо оборзения при сильном ветре не работает, лед на катке подойдет не для каждого. Выбирайте время года, если хотите полюбоваться видами на Амур...",Опубликовано 5 февраля 2019 г.
Дальневосточный округ,Хабаровский край,Хабаровск,Развлечения в Хабаровске,Парк Муравьева-Амурского,Alex S,5,"Парк расположенный на берегу реки Амур, представляет собой шикарное место для прогулок в летнюю жару или осеннюю слякоть. Весной запах свежих распускающихся листьев и бриз с реки просто опьяняет. Парк имеет большую протяженность и несколько аллей. Местами имеются места общественного питания . На центральном входе в летнее время есть игровая зона для детей",Опубликовано 18 марта 2013 г.
Дальневосточный округ,Хабаровский край,Хабаровск,Развлечения в Хабаровске,Парк Муравьева-Амурского,AlexFro,4,"Большой красивый интересный парк!и спокойный!красивые ледяные фигуры зимой,супер подсветка!весной только немного атракционов.",Опубликовано 2 апреля 2014 г.
Дальневосточный округ,Хабаровский край,Хабаровск,Развлечения в Хабаровске,Парк Муравьева-Амурского,Alexander B,5,"Будучи в городе, решил посетить местные достопримечательности, в частности парк Муравьева-Амурского. Парк ухоженный, великолепные виды открываются с утеса. С момента посещения Хабаровска и этого парка 5 тысячная купюра стала для меня не только дорогой бумажкой, но и напоминанием о Хабаровске.",Опубликовано 12 марта 2014 г.
Дальневосточный округ,Хабаровский край,Хабаровск,Развлечения в Хабаровске,Парк Муравьева-Амурского,Alexander K,4,Ничего особенного конечно можно погулять в охотку. Мне больше на самих прудах понравилось это вроде как продолжение парка,Опубликовано 19 июня 2014 г.
Дальневосточный округ,Хабаровский край,Хабаровск,Развлечения в Хабаровске,Парк Муравьева-Амурского,Alexander_Kudrin,4,"Центральный парк города Хабаровска расположен на высоком берегу Амура. Отсюда открывается отличный вид на реку и город. Несмотря на зиму дорожки были почищены, много скамеек для отдыха, Самой главной достопримечательностью парка является бронзовый памятник генерал-губернатору Восточной Сибири графу Н.Н. Муравьеву-Амурскому, который изображен на купюре в 5000 рублей. При входе в парк стоит несколько старых пушек. Приятное место для прогулок.",
Дальневосточный округ,Хабаровский край,Хабаровск,Развлечения в Хабаровске,Парк Муравьева-Амурского,Alexanteri,5,"Как и основная часть Хабаровска, лучше смотреть летом. Мощеные дорожки, скамьи, памятник Муравьеву-Амурскому с пятитысячной купюры и отличная видовая площадка. Подняться можно с набережной. Зимой очень ветрено.",Опубликовано 2 февраля 2015 г.
Дальневосточный округ,Хабаровский край,Хабаровск,Развлечения в Хабаровске,Парк Муравьева-Амурского,Alexey,4,"Плюсы: Хорошее место для прогулки с маленькими детьми, в тёплое время ребёнок направит искупаться в фонтане. Хорошие аттракционы . Вечером включается подсветка , очень красиво. Идеально в рабочие дни когда не много народу . Есть места где можно перекусить на ходу или что то посерьёзнее .
Минусы: не законченный ремонт, ездят машины , смешанная зона для пешеходов и велосипедистов,в выходные много людей. За ребёнком нужен глаз да глаз .",
Дальневосточный округ,Хабаровский край,Хабаровск,Развлечения в Хабаровске,Парк Муравьева-Амурского,Alexey K,5,"Очень красивый парк прямо над реки Амур. Хорошее место для прогулок, особенно если вы приводите к набережной. Парк возле местного музея истории, поэтому можно продолжать исследовать город оттуда.",Перевод: PROMT
Дальневосточный округ,Хабаровский край,Хабаровск,Развлечения в Хабаровске,Парк Муравьева-Амурского,Alikvl,5,"Хабаровску есть чем гордиться. С удовольствием провели несколько часов , прогуливаясь по этому парку и фотографируясь.",Опубликовано 26 июля 2016 г.
Дальневосточный округ,Хабаровский край,Хабаровск,Развлечения в Хабаровске,Парк Муравьева-Амурского,Andrey_Ved,4,"Просто восхищает, что центр города, его доминанта это парк. С изумительными видами, приятной атмосферой, старыми деревьями... Но вот какой-то ухоженности, душевности, что-ли, ему как-то не хватает... Вроде все так, вроде все правильно, но кривой от времени, хоть и покрашенный, бордюрный камень или облупившиеся краска как-то мешают целостному образу.",Опубликовано 2 сентября 2015 г.
Дальневосточный округ,Хабаровский край,Хабаровск,Развлечения в Хабаровске,Парк Муравьева-Амурского,Arina77,5,"Давно не была в хабаровске и попав туда в мае этого года, была приятно удивлена этим парком. Распрложен между комсомольской площадью и Амуром на склоне, поэтому что сверху, что снизу замечательные виды - цветы, цветущие кусты, деревья, хвойные. То тут, то там лавочки стоят. И погулять приятно по мощеным дорожкам и в тени посидеть.",Опубликовано 11 июля 2014 г.
Дальневосточный округ,Хабаровский край,Хабаровск,Развлечения в Хабаровске,Парк Муравьева-Амурского,Artyom,5,"Чисто и душевно. Прекрасный вид. Все ухоженно и аккуратно. Отличное место для прогулки с семьей, хотя подходит для всех категорий граждан",Опубликовано 27 ноября 2014 г.
Дальневосточный округ,Хабаровский край,Хабаровск,Развлечения в Хабаровске,Парк Муравьева-Амурского,Ayratravel,5,"Парк расположен у высокого берега Амура, на рельефной местности. Здесь когда-то были устроены первые поселения, а сейчас - замечательный, красивый парк. Хорошо обустроен, чисто, приятно прогуляться.",Опубликовано 25 июля 2015 г.
Дальневосточный округ,Хабаровский край,Хабаровск,Развлечения в Хабаровске,Парк Муравьева-Амурского,Boyardina,5,"Очень аккуратный парк! Здесь можно проводить время с мужем, с детьми, с друзьями! Наслаждаться зеленью, видом на р.Амур. Тихо, спокойно, если погода солнечная, и середина дня..",Опубликовано 16 сентября 2013 г.
Дальневосточный округ,Хабаровский край,Хабаровск,Развлечения в Хабаровске,Парк Муравьева-Амурского,BukvaED,5,"Очень красивое рукотворное место расположилось на берегу Амур-реки.
Парк очень большой: он растянулся от Комсомольской площади до Утеса и Краеведческого музея.
Много зеленых деревьев, кустарников, цветников, выполненных в старинном стиле фонарей, скамеек.
Вдоль всего парка проложены брусчатые дорожки - они слегка запутаны, но я не видел большой проблемы в этом.
Так как парк распростерся до краеведческого музея им. Гродекова, то можно сказать, что часть парка и есть - музей под открытым небом:
В этой части парка установлены скульптуры (а-ля Советский Союз), и пушечный Арсенал (орудия, пушки)...
В даркий день бабьего лета, когда я был парке - там не было жарко, так как свежий бриз дул с Амура.

Раньше в советское время на территории, которую занимает парк сейчас (между Комсомольской площадью и набережной), тоже был парк - парк атракционов
(со стандартным набором развлечений включая комнату смеха и т.д.), но он был какой-то неухоженный.
Но прошло время, атракционы переехали в другое место, парк облагородили и в теперешнем его виде он стал гораздо лучше и привлекательнее...",
Дальневосточный округ,Хабаровский край,Хабаровск,Развлечения в Хабаровске,Парк Муравьева-Амурского,BukvaED,5,"Парк очень красивый и обустроенный - много зелени, фонарей, дорожек, выложенных брусчаткой .
По моему мнению парк некое связующее звено между другими достопримечательностями Хабаровска - набережной реки Амур, Амурским утесом, Краеведческим музеем, памятником генерал-губернатору Н.Н.Муравьеву-Амурскому, Комсомольской площадью.
Парк преобразился (по сравнению с прошлыми годами), но как тогда, так и теперь с его территории открывается прекрасный вид на реку Амур.
В парке установлен памятник генерал-губернатору Н.Н.Муравьеву-Амурскому, средства на который собирали всем Хабаровским краем...
И ведь вся Россия знает об этом памятнике (из 5000-й купюры), но не все знают, где он установлен...
Так вот страна - знай - в Хабаровске, в парке, который раскинулся на берегу реки Амур!
Вечером парк освещается фонарями - великолепное зрелище, если смотреть на парк со стороны реки...
В этом парке комфортно отдыхать - можно посидеть посмотреть на реку, можно отдохнуть с книжкой....",
Дальневосточный округ,Хабаровский край,Хабаровск,Развлечения в Хабаровске,Парк Муравьева-Амурского,CHAI63,5,"Памятник Муравьеву-Амурскому знаком многим, так как изображен на пятитысячной купюре Центрального банка России. Тем более привлекательно увидеть его в натуральную величину. Памятник величествен. Место расположения памятника выбрано очень удачно. Памятник построен на пожертования сограждан и открыт в мае 1891 года в присутствии его императорского высочества государя наследника цесаревича и великого князя Николая Александровича. Статуя отлита из бронзы по модели академика Опенушина. Рядом смотровая площадка, с которой открывается панарама реки Амур.",
Дальневосточный округ,Хабаровский край,Хабаровск,Развлечения в Хабаровске,Парк Муравьева-Амурского,Cirorok,3,"Часто, после работы, гуляла в этом парке, был уютным, а сейчас чего-то не хватает. Убрали главные ходы - зачем? Хочется больше кустов, деревьев, зелени, т.к. этот минимализм (а по факту нищета) надоел! Туалеты, лавочек мало, негде посидеть в тени, всё на виду и это утомляет!",Опубликовано 13 мая 2019 г.
Дальневосточный округ,Хабаровский край,Хабаровск,Развлечения в Хабаровске,Парк Муравьева-Амурского,Danil K,5,"Если Вы были в замечательном и красивейшем городе Хабаровске и не посетили Парк (а именно утес) - значит Вы не узнали город изнутри. На самом деле - это одно из красивейших мест города, особенно в ночное время. В этом месте протекает могущественный Амур и Вы находитесь прямо над ним (утес - возвышенность). Так же советую прогуляться при закате. Зеленый уголок парка, обзор того самого скелета в краеведческом музее, иногда концерты уличных групп. Потрясающие люди, красиво, тихо спокойно именно здесь Вы насладитесь прелестью тишины и единения с природой. Гуляю каждый день и Вам советую посетить наш замечательный парк",Опубликовано 14 мая 2014 г.
