Дальневосточный округ,Приморский край,Владивосток,Развлечения в Владивостоке,Сопка Орлиное гнездо,Fatalist-Mizant... S,4,"Ветреный на верхе. И туман утром. Если вы ходите пешком, то много автомобилей вокруг и загрязненного воздуха. Колючка вы можете использовать фуникулер/, очень милая.:))",Перевод: PROMT
Дальневосточный округ,Приморский край,Владивосток,Развлечения в Владивостоке,Сопка Орлиное гнездо,Fiartem88,5,"Самая высокая точка исторической части города Владивостока, ранее именовавшаяся сопкой Клыкова.Наивысшая точка достигает 199 м над уровнем моря!!! Открывается отличный вид на город!!!очень красивое место)",Опубликовано 1 июля 2015 г.
Дальневосточный округ,Приморский край,Владивосток,Развлечения в Владивостоке,Сопка Орлиное гнездо,Freesia69,5,"Отличная панорама на город, на акваторию Золотого рога и Амурский залив. А если представить отсутствие зданий и прочих сооружений, так сказать в первозданном виде - дух захватывает от этой красоты...",Опубликовано 16 апреля 2015 г.
Дальневосточный округ,Приморский край,Владивосток,Развлечения в Владивостоке,Сопка Орлиное гнездо,FunnyWomanbyTrevel,5,"Мы поднялись наверх на закате, поэтому по полной насладились великолепным видом Владивостока, бухты Золотой Рог и всеми красками уходящего в море (в океан?) солнца. Один из лучших обзорных пунктов Владивостока. Мы добрались на такси.",Опубликовано 4 ноября 2016 г.
Дальневосточный округ,Приморский край,Владивосток,Развлечения в Владивостоке,Сопка Орлиное гнездо,Galina K,5,"Захватывающий вид на мост и залив. Город на ладони весь. Гуляя по улицам не понимаешь масштаба, а тут понимаешь всю красоту города. Была вечером весь город в огня, ветра не было. Брала такси, рядом фуникулёр.",Опубликовано 17 ноября 2014 г.
Дальневосточный округ,Приморский край,Владивосток,Развлечения в Владивостоке,Сопка Орлиное гнездо,Gavrilov_Andrey,5,"Одна из лучших смотровых площадок Владивостака. Бухта, мост и большая часть города как на ладони. Обязательно посетите.",Опубликовано 25 мая 2015 г.
Дальневосточный округ,Приморский край,Владивосток,Развлечения в Владивостоке,Сопка Орлиное гнездо,Gene732,5,"Вид на бухту Золотой Рог захватывающий. И буквально за пять минут ее накрыло туманом так, что даже мачты кораблей перестали быть видны... Говорят, что Лондон - город туманов. Ерунда! Город туманов - это Владивосток! Верхние этажи высоток на сопках скрыты от глаз так, что и не поймешь, сколько там этажей, и это придает очаровательный колорит городу...",Опубликовано 29 июня 2014 г.
Дальневосточный округ,Приморский край,Владивосток,Развлечения в Владивостоке,Сопка Орлиное гнездо,GorbunS,5,"Открывается прекрасный вид на море, мост и город в целом. Чуть ниже торгуют сувенирами. Памятник Кириллу и Мефодию заслуживает внимания. На стропах, поддерживающих часовенку за их спинами, влюбленные вешают замочки на память. Впрочем, был свидетелем навешанного на стропу врезного замка:) Не иначе, любовь его обладателя сильнее всех:)",
Дальневосточный округ,Приморский край,Владивосток,Развлечения в Владивостоке,Сопка Орлиное гнездо,Groomboombess,5,"Отличный вид на Владивосток и мост через бухту Золотой рог. Видны были и опоры моста на остров Русский (сам мост был закрыт облаками, что тоже выглядело красиво). Для хорошего фотоаппарата великолепная возможность сделать удачные снимки. На видовой площадке подрабатывал ""кузнец"", который за 100 рублей на месте ковал памятные монетки",
Дальневосточный округ,Приморский край,Владивосток,Развлечения в Владивостоке,Сопка Орлиное гнездо,Igor_Besschastnyy,3,"место для парочек и свадеб, открывается красивый вид на Золотой мост. Но как и многое во Владивостоке выглядит заброшено и обшарпано.",Опубликовано 22 июня 2016 г.
Дальневосточный округ,Приморский край,Владивосток,Развлечения в Владивостоке,Сопка Орлиное гнездо,Ivan I,4,Очень хорошее место для любителей пофотографировать. С этой сопки получаются отличные панорамы. Ночью вид просто волшебный. Лично мне нравится делать снимки ночью. Добраться до Орлиного гнезда можно легко на общественном транспорте.,Опубликовано 11 мая 2016 г.
Дальневосточный округ,Приморский край,Владивосток,Развлечения в Владивостоке,Сопка Орлиное гнездо,Ivan M,5,"Обзательно заедьте на смотровую площадку. Отсюда открывается очень приятный вид на город (не видно разрухи). На последнем этаже жилого дома ""Орлиное гнездо"" есть дорогой ресторан с еще более завораживающим видом.",Опубликовано 27 ноября 2013 г.
Дальневосточный округ,Приморский край,Владивосток,Развлечения в Владивостоке,Сопка Орлиное гнездо,Ivan55555,5,"это лучшее место для осмотра панорамы города: открывается отличный вид на бухту Золотой рог, мост и централ. часть города.",Опубликовано 23 декабря 2013 г.
Дальневосточный округ,Приморский край,Владивосток,Развлечения в Владивостоке,Сопка Орлиное гнездо,Ivan_s_0180,5,"Очень живописное место, открывается шикарный вид на акваторию Амурского залива. Рекомендую посетить!",Опубликовано 24 января 2014 г.
Дальневосточный округ,Приморский край,Владивосток,Развлечения в Владивостоке,Сопка Орлиное гнездо,Jac-and-Jek,3,"Быть лучшим момент зрения во Владивостоке не значит, что это отличное место. Хорошая вещь в горе розетки Орла состоит в том, что вы видите полностью мост, это типичная открытка для всех и тому подобное. Но больше ничего нет. Не очень хорошая скульптура St Кириллу и St Мефодию и виду.Ах, и если вы хотите подняться туда, вы, вероятно, читали, что есть фуникулер. Да, фуникулер доставит вас со Светланская-Стрит, но не полностью!! Вы можете добраться до такого же возвышения, шедшего из города, путешествий в Сухановой. Фуникулер доставит вас от Svetlanskaya до Сухановой, не к Статуе розетки Орла. После фуникулера вам придется пройти несколько ступенек, потом еще немного, чтобы идти под уклоном, пешком до другой стороны, а затем 125 дополнительных жутких и полуразрушенных шагах на балкон.Я ожидал прекрасный вид на город, но вы хорошо видно только часть его.",Перевод: PROMT
Дальневосточный округ,Приморский край,Владивосток,Развлечения в Владивостоке,Сопка Орлиное гнездо,JensPerregaard,3,"Хорошее место, чтобы приехать и получить общее представление о городе. Также, что половина Китая сделала в то же время - только шутка, но ресторан был переполнен, и, как таковое, спокойствие не может быть мы заметили",Перевод: PROMT
Дальневосточный округ,Приморский край,Владивосток,Развлечения в Владивостоке,Сопка Орлиное гнездо,John B,5,"Это отличный вид на Владивосток и мост Золотой Рог. Я видел его в течение дня и вечером, оба были великолепны, но ночь была лучше, по моему мнению.",Перевод: PROMT
Дальневосточный округ,Приморский край,Владивосток,Развлечения в Владивостоке,Сопка Орлиное гнездо,Jules_G_Verne,5,"Наверно самое высокое место в городе, откуда открывается замечательный вид на весь город. Добраться лучше и интереснее на старинном фуникулёре ))",
Дальневосточный округ,Приморский край,Владивосток,Развлечения в Владивостоке,Сопка Орлиное гнездо,Karina V,4,"Стоит посетить эту видовую площадку, если есть время. Кроме как сделать фотография на фоне золотого моста - делать здесь нечего.",Опубликовано 28 февраля 2017 г.
Дальневосточный округ,Приморский край,Владивосток,Развлечения в Владивостоке,Сопка Орлиное гнездо,Kasper H,5,"У нас был прекрасный вид на город, гавань и золотой мост от здесь. Мы решили идти пешком от центра города, но он был довольно сложным из-за какой-то новой строительные площадки к западу от места. Возвращаться вдоль дороги фуникулера было намного легче. Несмотря на то, что это было довольно много людей, также наслаждающимися видом (включая невесту и жениха), все равно было очень приятно.",Перевод: PROMT
Дальневосточный округ,Приморский край,Владивосток,Развлечения в Владивостоке,Сопка Орлиное гнездо,Kattrinn,5,"Владивосток прекрасен! Смотровая площадка открывает изумительный вид на Золотой мост и город.
Удивил подъезд и подход к этому чудесному месту - его нет! Но посещение сопки обязательно! Захватывает дух!
Чуть ниже есть сувенирная лавка с огромным выбором всякой всячины.",
Дальневосточный округ,Приморский край,Владивосток,Развлечения в Владивостоке,Сопка Орлиное гнездо,KiGaTka,5,"Если есть время и желание увидеть город Владивосток - то попасть в ""орлиное гнездо"" нужно обязательно. Панорама города перед вами завораживает! Главное - что бы повезло с погодой!!!",
Дальневосточный округ,Приморский край,Владивосток,Развлечения в Владивостоке,Сопка Орлиное гнездо,Kirbyk,5,"Я шел от центра города до фуникулера и довозит до достопримечательностей, когда я заметил эту более высокую платформы нельзя. Сядьте на фуникулер и несколько подземных переходов и довольно много лестниц, и вы будете вознаграждены лучшим видом в городе. Есть сувенирный магазин со всеми Владивостокскими сувенирами, в которых вы будете понадобиться.",Перевод: PROMT
Дальневосточный округ,Приморский край,Владивосток,Развлечения в Владивостоке,Сопка Орлиное гнездо,Konstancio,5,"Отличная смотровая площадка над городом. Бухта Золотой рог и Золотой мост, как на ладони. На площадке памятник первым просветителям России.",
Дальневосточный округ,Приморский край,Владивосток,Развлечения в Владивостоке,Сопка Орлиное гнездо,Konstantin L,5,"Очень хорошее место для обзора города, открывается великолепный вид на бухту Золотой рог и, конечно, потрясающий мост! Маршрут можно проложить через фуникулёр, проезд 11 рублей, колоритный транспорт в ретро стиле.",
Дальневосточный округ,Приморский край,Владивосток,Развлечения в Владивостоке,Сопка Орлиное гнездо,Kseniia B,5,"Самая лучшая видовая площадка в городе. С нее открывается действительно потрясающий вид на вантовый мост и Золотой рог. Особенно красиво вечером, когда зажигаются огни",Опубликовано 3 февраля 2014 г.
Дальневосточный округ,Приморский край,Владивосток,Развлечения в Владивостоке,Сопка Орлиное гнездо,Kuzyaaa,5,Место нам показалось странным как то все убого. Ржавые замки на ржавых перилах. Но вид просто шикарный! Весь Владивосток как на ладонях!,Опубликовано 18 ноября 2017 г.
Дальневосточный округ,Приморский край,Владивосток,Развлечения в Владивостоке,Сопка Орлиное гнездо,Leha E,5,"Каждый раз когда есть возможность, прогуливаюсь с Изумруда до этой сопки, насладиться чудесным видом на город, просто постоять и полюбоваться. Всем советую! Наикрутейшее место!",Опубликовано 18 января 2016 г.
Дальневосточный округ,Приморский край,Владивосток,Развлечения в Владивостоке,Сопка Орлиное гнездо,Lenovich85,4,"Насладиться прекрасным видом нам не повезло, притопали на площадку в туман, а больше как-то не собрались. Будет повод вернуться во Владивосток второй раз :)",
Дальневосточный округ,Приморский край,Владивосток,Развлечения в Владивостоке,Сопка Орлиное гнездо,Liluli43,5,С этой видовой площадки отрывается самый красивый вид . Любим с семьей приезжать сюда и любоваться городом в любую погоду,
Дальневосточный округ,Приморский край,Владивосток,Развлечения в Владивостоке,Сопка Орлиное гнездо,Limp B,4,"Будет прекрасно после ремонта. Виды супер, но разруха. Отдельно стоит смотреть и днем и при ночном освещении",Опубликовано 16 ноября 2020 г.
Дальневосточный округ,Приморский край,Владивосток,Развлечения в Владивостоке,Сопка Орлиное гнездо,Malvina S,5,"Вид с сопки Орлиное гнездо перехватывает дыхание, такая панорама расстилается перед глазами: бухта Золотой Рог и вид на мыс Чуркин, издали виден остров Русский и центр города. Конечно, следует обустроить лучше смотровую площадку. Надо быть осторожными при фотографировании, чтобы не упасть с высоты.",Опубликовано 1 июля 2019 г.
Дальневосточный округ,Приморский край,Владивосток,Развлечения в Владивостоке,Сопка Орлиное гнездо,MargoRitulya,5,"Со смотровой площадки открывается панорамный вид на город, с этого места Владивосток как на ладони! Была когда еще город отстраивался к саммету, и от мостов были только ""рогатки"". Зрелище было необычное и захватывающее =)",
Дальневосточный округ,Приморский край,Владивосток,Развлечения в Владивостоке,Сопка Орлиное гнездо,Mari M,5,"Надо признать, посещаю это место не часто, обычно, когда вожу друзей из всех уголков страны и мира по must see places Владивостока. Всем приезжим - быть обязательно, лучше вечером! Вид, правда, потрясающий и Владивосток очень красивый - мосты, бухта, огни , он ведь разный Владивосток. Моим гостям всегда нравится, Владивосток с сопки Орлиное гнездо вызывает только восхищение :)",Опубликовано 31 июля 2014 г.
Дальневосточный округ,Приморский край,Владивосток,Развлечения в Владивостоке,Сопка Орлиное гнездо,MariiaLoginova,5,"Посетите это место обязательно! Самое лучшее, приехать на машине под вечер и наблюдать как садится солнце, как зажигаются огни города! С собой обязателен термос с чаем и всякие вкусняшки!)))",Опубликовано 19 июля 2015 г.
Дальневосточный округ,Приморский край,Владивосток,Развлечения в Владивостоке,Сопка Орлиное гнездо,Marina E,5,"Отличный вид на золотой мост и набережную. Сама площадка в плохом состоянии, но обзор хороший. Виден фуникулёр.",
Дальневосточный округ,Приморский край,Владивосток,Развлечения в Владивостоке,Сопка Орлиное гнездо,Marina K,5,"Рекомендую посетить видовую площадку вечером и полюбоваться завораживающим видом подсвеченного илюминацией ночного Владивостока.Весь город будет перед вами: фуникулёр, бухта Зототой Рог, Золотой мост, центр города, а за спиной - мерцающая телебашня.",Опубликовано 20 сентября 2017 г.
Дальневосточный округ,Приморский край,Владивосток,Развлечения в Владивостоке,Сопка Орлиное гнездо,Marina Shestakova,5,"Такой вид открывается с этой точки! Видно город, море, горы))) очень и очень впечатляет, да и фотографии получаются отличные! И какой там видно закат! Но место продувается всеми ветрами)))",Опубликовано 30 сентября 2016 г.
